,Gemeinte_Source:_Experiencer,Gemeinte_Source:_Zuschreibende_Instanz,Gemeintes_Target:_Charakter,Gemeintes_Target:_Nicht-Charakter,Polarität,annotator,base_polarity,end,id,length_in_tokens,main_emotion_class,polarity,start,tag_type,text,tokens
852,,,Herr_KATZENBALG,,,ER,positiv,146250,CATMA_21E71D58-8911-4C16-A5D2-DDDDE4C42EE2,11,Emotionen der Freude,positiv,146195,Freude, Diese Ehre gilt mir – doch ich bitte ohne Komplimente!,"['Diese', 'Ehre', 'gilt', 'mir', '–', 'doch', 'ich', 'bitte', 'ohne', 'Komplimente', '!']"
853,Herr_KATZENBALG,,,,,ER,positiv,146697,CATMA_45719172-F7DE-4814-9CD6-93DA69BF5DB9,12,Emotionen der Freude,positiv,146635,Freude,. Itzt wird sich mein Sohn mit einem Konzert hören lassen – ,"['.', 'Itzt', 'wird', 'sich', 'mein', 'Sohn', 'mit', 'einem', 'Konzert', 'hören', 'lassen', '–']"
854,,,,,,ER,negativ,147535,CATMA_570FBA15-B1CA-4DC2-9287-008AEFA36643_0,24,Emotionen der Ablehnung,negativ,147433,Ärger,"Hr. BUCHWALD tritt rasch ein, und erblickt seine Frau am Arm des BARONS, eilt also gleich auf sie zu.)","['Hr', '.', 'BUCHWALD', 'tritt', 'rasch', 'ein', ',', 'und', 'erblickt', 'seine', 'Frau', 'am', 'Arm', 'des', 'BARONS', ',', 'eilt', 'also', 'gleich', 'auf', 'sie', 'zu', '.', ')']"
855,,,,,,ER,negativ,147614,CATMA_570FBA15-B1CA-4DC2-9287-008AEFA36643_1,14,Emotionen der Ablehnung,negativ,147554,Ärger,. Ha! Verführer hab ich dich endlich doch auf der That? – ,"['.', 'Ha', '!', 'Verführer', 'hab', 'ich', 'dich', 'endlich', 'doch', 'auf', 'der', 'That', '?', '–']"
856,,,,,,ER,negativ,147700,CATMA_09F2F461-06FB-46DB-B270-E86B1FFB9CD0,14,Emotionen der Angst,negativ,147632,Angst, (sich loßreissend und schreiend) Gott mein Mann – mein Mann! – ,"['(', 'sich', 'loßreissend', 'und', 'schreiend', ')', 'Gott', 'mein', 'Mann', '–', 'mein', 'Mann', '!', '–']"
857,Herr_BUCHWALD,,WELLBACH_Lindenthal,,,ER,negativ,147924,CATMA_0848991E-E4C5-4F73-B1FB-D08AC626229F,21,Emotionen der Ablehnung,negativ,147839,Ärger,Den Ort? – das Nest der Schande ha! ha! bedenken! – Morgen sprechen wir uns weiter!,"['Den', 'Ort', '?', '–', 'das', 'Nest', 'der', 'Schande', 'ha', '!', 'ha', '!', 'bedenken', '!', '–', 'Morgen', 'sprechen', 'wir', 'uns', 'weiter', '!']"
858,,,,,,ER,negativ,148203,CATMA_8E398446-AF4F-47B0-9666-47DABCABEF29,46,Emotionen der Ablehnung,negativ,147983,Ärger,"(springt wie rasend dazwischen) Wie, was untersteht man sich, in meinem Hause, vor der ganzen Assemblée61 meine Tochter zu beschimpfen! – wer darf das wagen, nicht einen Schritt, oder man hat es mit mir zu thun! – ","['(', 'springt', 'wie', 'rasend', 'dazwischen', ')', 'Wie', ',', 'was', 'untersteht', 'man', 'sich', ',', 'in', 'meinem', 'Hause', ',', 'vor', 'der', 'ganzen', 'Assemblée61', 'meine', 'Tochter', 'zu', 'beschimpfen', '!', '–', 'wer', 'darf', 'das', 'wagen', ',', 'nicht', 'einen', 'Schritt', ',', 'oder', 'man', 'hat', 'es', 'mit', 'mir', 'zu', 'thun', '!', '–']"
859,Herr_BUCHWALD,,"['Frau_KATZENBALG', 'Madame_BUCHWALD']",,,ER,negativ,148341,CATMA_44E933CA-FF6C-44E3-B258-936A7A403284,24,Emotionen der Ablehnung,negativ,148220,Ärger," Und wärs mit dem Teufel – und wärs in einem königl. Palaste – meine Rechte sind heiliger, als ihr albernes Etiquette! ","['Und', 'wärs', 'mit', 'dem', 'Teufel', '–', 'und', 'wärs', 'in', 'einem', 'königl', '.', 'Palaste', '–', 'meine', 'Rechte', 'sind', 'heiliger', ',', 'als', 'ihr', 'albernes', 'Etiquette', '!']"
860,Madame_BUCHWALD,,Herr_BUCHWALD,,,ER,negativ,148499,CATMA_A1942619-D036-4DD3-8ED0-AE803A913189,7,Emotionen der Angst,negativ,148472,Angst,Ach zu Hülfe – zu Hülfe! ,"['Ach', 'zu', 'Hülfe', '–', 'zu', 'Hülfe', '!']"
861,,,,Ereignis,,ER,negativ,148846,CATMA_FC791A10-EFB8-446D-BCF3-F13A6DACA7AD_0,14,Emotionen des Leids,negativ,148779,Leid,"fällt in einen Sessel) Ach! Gott verzeih mirs, ich werde ohnmächtig","['fällt', 'in', 'einen', 'Sessel', ')', 'Ach', '!', 'Gott', 'verzeih', 'mirs', ',', 'ich', 'werde', 'ohnmächtig']"
862,,,,Ereignis,,ER,negativ,148930,CATMA_FC791A10-EFB8-446D-BCF3-F13A6DACA7AD_1,7,Emotionen des Leids,negativ,148895,Leid,ach Wasser – Schlagwasser – Balsam!,"['ach', 'Wasser', '–', 'Schlagwasser', '–', 'Balsam', '!']"
863,,,,,,ER,negativ,148892,CATMA_17301925-ABEE-4592-A89C-B83295C03CA3,8,Emotionen der Ablehnung,negativ,148848,Abscheu, der infame Mann – mich so zu prostituiren,"['der', 'infame', 'Mann', '–', 'mich', 'so', 'zu', 'prostituiren']"
864,,,,,,ER,negativ,149214,CATMA_98CB1223-220E-46C4-8D78-FF0231D8A43A,20,Emotionen der Ablehnung,negativ,149121,Abscheu," O pfui! lieber Himmel, was ist das? ihr wollt mich vergeben – Brandwein statt Wasser! – ","['O', 'pfui', '!', 'lieber', 'Himmel', ',', 'was', 'ist', 'das', '?', 'ihr', 'wollt', 'mich', 'vergeben', '–', 'Brandwein', 'statt', 'Wasser', '!', '–']"
865,,,unpersönlich,,,ER,positiv,149652,CATMA_12EE52A9-D4B5-4C27-AC4D-B6F4D85709C0,25,Emotionen der Freude,positiv,149570,Schadenfreude,"He! he! he! hab ichs nicht gesagt, das soll einen Spaß geben! – he! he! he! – ","['He', '!', 'he', '!', 'he', '!', 'hab', 'ichs', 'nicht', 'gesagt', ',', 'das', 'soll', 'einen', 'Spaß', 'geben', '!', '–', 'he', '!', 'he', '!', 'he', '!', '–']"
866,AMALIA_Blande,,,,,ER,negativ,150014,CATMA_00554AF1-E6D5-475C-8550-00EF86145486,6,Emotionen des Leids,negativ,149992,Leid, o! wüsten Sie alles! ,"['o', '!', 'wüsten', 'Sie', 'alles', '!']"
867,,Herr_BUCHWALD,,,,ER,positiv,150236,CATMA_49EC151C-AE38-4CB9-8F5B-9298B320E726,12,Emotionen der Zuneigung,positiv,150170,Liebe," genug sie lieben ihn, und Liebe muß zum Verzei-hen geneigt seyn","['genug', 'sie', 'lieben', 'ihn', ',', 'und', 'Liebe', 'muß', 'zum', 'Verzei-hen', 'geneigt', 'seyn']"
868,,,,,,ER,positiv,150360,CATMA_D0FE842E-ED23-4E54-B9E9-76766DE6BFA8,24,Emotionen der Zuneigung,positiv,150238,Liebe,"gnädige Frau auch ich verzeih’ meinem Weib, gab Ihrem Vorwort nach, und fin-de, daß die Versöhnung recht süsse schmeckt!","['gnädige', 'Frau', 'auch', 'ich', 'verzeih', '’', 'meinem', 'Weib', ',', 'gab', 'Ihrem', 'Vorwort', 'nach', ',', 'und', 'fin-de', ',', 'daß', 'die', 'Versöhnung', 'recht', 'süsse', 'schmeckt', '!']"
869,,,,,,ER,positiv,150523,CATMA_2EA4B293-0C4D-4F11-9A83-6A9A79C3EB39,14,Emotionen der Freude,positiv,150434,Freude,ieber rechtschaffener  Mann – wie lebhaft danke ich Ihnen für ihr warmes Interesse!,"['ieber', 'rechtschaffener', 'Mann', '–', 'wie', 'lebhaft', 'danke', 'ich', 'Ihnen', 'für', 'ihr', 'warmes', 'Interesse', '!']"
870,AMALIA_Blande,,,Ereignis,,ER,negativ,150587,CATMA_89ADF6BF-E9A1-4404-A035-3863E3901B7C,11,Emotionen des Leids,negativ,150524,Leid,aber der Vergleich des Zwistes mit ihrer Frau paßt hier nicht,"['aber', 'der', 'Vergleich', 'des', 'Zwistes', 'mit', 'ihrer', 'Frau', 'paßt', 'hier', 'nicht']"
871,,AMALIA_Blande,Herr_BUCHWALD,,,ER,positiv,150771,CATMA_186F9AF1-FB70-40A5-9FB7-0FF33A6F7485,15,Emotionen der Zuneigung,positiv,150684,Liebe,kann wohl leicht wieder gut gemacht werden – Ihre Frau hat ein unverdorbenes Herz! ,"['kann', 'wohl', 'leicht', 'wieder', 'gut', 'gemacht', 'werden', '–', 'Ihre', 'Frau', 'hat', 'ein', 'unverdorbenes', 'Herz', '!']"
872,,,,,,ER,positiv,150814,CATMA_9B8A55CA-AD33-4AB3-A88A-EE25B5F512C0_0,7,Emotionen der Zuneigung,positiv,150789,Verehrung, O! wie gütig Sie von mir,"['O', '!', 'wie', 'gütig', 'Sie', 'von', 'mir']"
873,,,,,,ER,positiv,150825,CATMA_9B8A55CA-AD33-4AB3-A88A-EE25B5F512C0_1,3,Emotionen der Zuneigung,positiv,150811,Verehrung,mir urtheilen!,"['mir', 'urtheilen', '!']"
874,Herr_BUCHWALD,,,,,ER,positiv,151048,CATMA_E413A3DB-73B2-46F3-B63A-C7AFBE026067,23,Emotionen der Zuneigung,positiv,150920,Liebe,doch wir sind versöhnt – kein unangenehmer Blick soll dich an un-sern Zwist mehr erinnern – du versprichst – und wirst halten.,"['doch', 'wir', 'sind', 'versöhnt', '–', 'kein', 'unangenehmer', 'Blick', 'soll', 'dich', 'an', 'un-sern', 'Zwist', 'mehr', 'erinnern', '–', 'du', 'versprichst', '–', 'und', 'wirst', 'halten', '.']"
875,,,,,,ER,negativ,151684,CATMA_267DEA4B-1390-449B-9D31-D4D4DE8D8538,24,Emotionen der Ablehnung,negativ,151555,Abscheu,"zieht er sich aber durch einen witzigen Einfall aus der Sache – dann rath ich Ihnen selbst, ihn mit Ihrer Verachtung zu strafen","['zieht', 'er', 'sich', 'aber', 'durch', 'einen', 'witzigen', 'Einfall', 'aus', 'der', 'Sache', '–', 'dann', 'rath', 'ich', 'Ihnen', 'selbst', ',', 'ihn', 'mit', 'Ihrer', 'Verachtung', 'zu', 'strafen']"
876,,Herr_BUCHWALD,AMALIA_Blande,,,ER,positiv,152313,CATMA_DCFCA6A9-A450-4190-807F-7E368D56BC00,24,Emotionen der Zuneigung,positiv,152205,Liebe, ist er nur einmal verwirrt – denn hat der Kopf nichts mehr zu sorgen – und das Herz ist in vollem Spiel!!,"['ist', 'er', 'nur', 'einmal', 'verwirrt', '–', 'denn', 'hat', 'der', 'Kopf', 'nichts', 'mehr', 'zu', 'sorgen', '–', 'und', 'das', 'Herz', 'ist', 'in', 'vollem', 'Spiel', '!', '!']"
877,PAUL,,,,,ER,negativ,152896,CATMA_6A453445-62F5-4A16-B356-6381583E5EF1,8,Emotionen des Leids,negativ,152856,Mitleid,Hier Herr Buchwald ist die arme Geißel! ,"['Hier', 'Herr', 'Buchwald', 'ist', 'die', 'arme', 'Geißel', '!']"
878,,,,,,ER,negativ,152974,CATMA_8847EDF4-2563-4154-987E-F12A606851A0,12,Emotionen des Leids,negativ,152914,Leid,". Thut mir leid gutes Weibchen, daß ihr so mitgespielet ward","['.', 'Thut', 'mir', 'leid', 'gutes', 'Weibchen', ',', 'daß', 'ihr', 'so', 'mitgespielet', 'ward']"
879,,,,,,ER,positiv,153065,CATMA_3B11CAF9-606F-400A-B700-189AD2274F9B,21,Emotionen der Zuneigung,positiv,152976,Liebe, aber ich suchte mein Weib – und da sah ich nicht – da hört ich nicht – ich fühlte nur!,"['aber', 'ich', 'suchte', 'mein', 'Weib', '–', 'und', 'da', 'sah', 'ich', 'nicht', '–', 'da', 'hört', 'ich', 'nicht', '–', 'ich', 'fühlte', 'nur', '!']"
880,,,,,,ER,positiv,153164,CATMA_74EA1A28-483B-4646-8FBC-034DA2EEAFC5,16,Emotionen der Freude,positiv,153078,Freude," Ich bin recht froh, daß ich in die Hände eines so rechtschaffenen Mannes gerathen bin","['Ich', 'bin', 'recht', 'froh', ',', 'daß', 'ich', 'in', 'die', 'Hände', 'eines', 'so', 'rechtschaffenen', 'Mannes', 'gerathen', 'bin']"
881,,,,,,ER,negativ,153812,CATMA_3ADCA215-1B51-4DDF-8CB4-1188DE885F84,15,Emotionen des Leids,negativ,153738,Mitleid,"Ich bedaure Sie, meine Liebe, wenn auch Sie der Baron hintergangen! – ","['Ich', 'bedaure', 'Sie', ',', 'meine', 'Liebe', ',', 'wenn', 'auch', 'Sie', 'der', 'Baron', 'hintergangen', '!', '–']"
882,,,,,,ER,positiv,153941,CATMA_B22B59E4-0883-41E5-A905-1E94ACF8859F,18,Emotionen der Zuneigung,positiv,153833,Verehrung,"ich bin in Ihrem Verdacht unschuldig, ich kenne den Herrn Baron nur von ei-ner sehr rechtschaffenen Seite ","['ich', 'bin', 'in', 'Ihrem', 'Verdacht', 'unschuldig', ',', 'ich', 'kenne', 'den', 'Herrn', 'Baron', 'nur', 'von', 'ei-ner', 'sehr', 'rechtschaffenen', 'Seite']"
883,EVERL,,,,,ER,positiv,154090,CATMA_113F3DF9-CC80-4160-9995-52E913C3DE7B,23,Emotionen der Zuneigung,positiv,153950,Verehrung,"der keine andere Absicht hatte, als meinem Manne durch diese komische Geschichte die Augen über seine eigenen Thorheiten öffnen zu wollen.","['der', 'keine', 'andere', 'Absicht', 'hatte', ',', 'als', 'meinem', 'Manne', 'durch', 'diese', 'komische', 'Geschichte', 'die', 'Augen', 'über', 'seine', 'eigenen', 'Thorheiten', 'öffnen', 'zu', 'wollen', '.']"
884,,,,,,ER,positiv,154194,CATMA_7777FB3A-1108-4E79-AB26-F807917729ED,18,Emotionen der Zuneigung,positiv,154091,Verehrung,"Der Zufall, der mich in die Hände dieses recht-schaffenen Mannes (auf Herrn Buchwald zeigend) führte ","['Der', 'Zufall', ',', 'der', 'mich', 'in', 'die', 'Hände', 'dieses', 'recht-schaffenen', 'Mannes', '(', 'auf', 'Herrn', 'Buchwald', 'zeigend', ')', 'führte']"
885,,,,,,ER,positiv,154387,CATMA_D637DF64-902C-49ED-A7F7-48EAABFBB703,12,Emotionen der Freude,positiv,154321,Freude,Ihre Offenherzigkeit meine Liebe ist mir Bürge für die Wahrheit! –,"['Ihre', 'Offenherzigkeit', 'meine', 'Liebe', 'ist', 'mir', 'Bürge', 'für', 'die', 'Wahrheit', '!', '–']"
886,Herr_BUCHWALD,,,,,ER,positiv,155270,CATMA_9602F33C-9FE3-436E-85BC-969009D51F3C,8,Emotionen der Zuneigung,positiv,155234,Liebe,Du denkst ja an unsere Versöhnung!! ,"['Du', 'denkst', 'ja', 'an', 'unsere', 'Versöhnung', '!', '!']"
887,AMALIA_Blande,,,,,ER,negativ,155818,CATMA_2F8A6205-16DB-404C-80D6-2C8184B87851,43,Emotionen des Leids,negativ,155593,Leid,"Ja wenns nur um einen Liebhaber zu thun wäre, wie der gute ehrliche Mann glaubt, was wäre die ganze Sache mehr als Spaß? – aber einen verlornen Ehemann wieder zurückzu-rufen, davon guter Buchwald, träumst du wohl nichts! ","['Ja', 'wenns', 'nur', 'um', 'einen', 'Liebhaber', 'zu', 'thun', 'wäre', ',', 'wie', 'der', 'gute', 'ehrliche', 'Mann', 'glaubt', ',', 'was', 'wäre', 'die', 'ganze', 'Sache', 'mehr', 'als', 'Spaß', '?', '–', 'aber', 'einen', 'verlornen', 'Ehemann', 'wieder', 'zurückzu-rufen', ',', 'davon', 'guter', 'Buchwald', ',', 'träumst', 'du', 'wohl', 'nichts', '!']"
888,,,,,,ER,negativ,156501,CATMA_C8DCDCD1-7AE1-4A35-8FBF-20229E4CA5A1_0,38,Emotionen des Leids,negativ,156299,Leid,"Da schlägt mir mein Herz wie einem Missethäter, der sein Todesurtheil erwartet – und im Grunde ists doch weiter nichts mehr als mein Abschied, den ich vielleicht zu erwarten habe! – Mein Abschied? –","['Da', 'schlägt', 'mir', 'mein', 'Herz', 'wie', 'einem', 'Missethäter', ',', 'der', 'sein', 'Todesurtheil', 'erwartet', '–', 'und', 'im', 'Grunde', 'ists', 'doch', 'weiter', 'nichts', 'mehr', 'als', 'mein', 'Abschied', ',', 'den', 'ich', 'vielleicht', 'zu', 'erwarten', 'habe', '!', '–', 'Mein', 'Abschied', '?', '–']"
889,,,,,,ER,negativ,156667,CATMA_C8DCDCD1-7AE1-4A35-8FBF-20229E4CA5A1_1,8,Emotionen des Leids,negativ,156634,Leid, aber diesmal ist mir’s nicht so ,"['aber', 'diesmal', 'ist', 'mir', '’', 's', 'nicht', 'so']"
890,,,,,,ER,negativ,157246,CATMA_56270BC9-4791-4B60-ABB7-0B4065EF5827,107,Emotionen des Leids,negativ,156669,Leid,"es ist ein gewisses et-was in mir, was mich ganz umgestimmt hat, ich denke immer an die Baronin – mir entschlüpft alle Augenblicke ihr Namen – ich seufze sogar! – ich vergleiche alles, was ich schön nennen will mit ihr – kurz ich fühle alle möglichen Symptomen eines ächten Liebesfiebers – denn ich glaube, wenn die Baronin wüßte, daß ich verheurathet wäre, und sie verlangte, ich sollte zu meinem Weibe nach Hau-se kehren – ich könnte sogar diesen tollen Streich begehen – Wahrlich daraus erkenn ich – daß ich das erstemal in meinem Leben ernstlich verliebt bin! –","['es', 'ist', 'ein', 'gewisses', 'et-was', 'in', 'mir', ',', 'was', 'mich', 'ganz', 'umgestimmt', 'hat', ',', 'ich', 'denke', 'immer', 'an', 'die', 'Baronin', '–', 'mir', 'entschlüpft', 'alle', 'Augenblicke', 'ihr', 'Namen', '–', 'ich', 'seufze', 'sogar', '!', '–', 'ich', 'vergleiche', 'alles', ',', 'was', 'ich', 'schön', 'nennen', 'will', 'mit', 'ihr', '–', 'kurz', 'ich', 'fühle', 'alle', 'möglichen', 'Symptomen', 'eines', 'ächten', 'Liebesfiebers', '–', 'denn', 'ich', 'glaube', ',', 'wenn', 'die', 'Baronin', 'wüßte', ',', 'daß', 'ich', 'verheurathet', 'wäre', ',', 'und', 'sie', 'verlangte', ',', 'ich', 'sollte', 'zu', 'meinem', 'Weibe', 'nach', 'Hau-se', 'kehren', '–', 'ich', 'könnte', 'sogar', 'diesen', 'tollen', 'Streich', 'begehen', '–', 'Wahrlich', 'daraus', 'erkenn', 'ich', '–', 'daß', 'ich', 'das', 'erstemal', 'in', 'meinem', 'Leben', 'ernstlich', 'verliebt', 'bin', '!', '–']"
891,,,,,,ER,positiv,157249,CATMA_9EF9FACF-90A6-4F66-80D4-BAE7C77237EE,107,Emotionen der Zuneigung,positiv,156669,Liebe,"es ist ein gewisses et-was in mir, was mich ganz umgestimmt hat, ich denke immer an die Baronin – mir entschlüpft alle Augenblicke ihr Namen – ich seufze sogar! – ich vergleiche alles, was ich schön nennen will mit ihr – kurz ich fühle alle möglichen Symptomen eines ächten Liebesfiebers – denn ich glaube, wenn die Baronin wüßte, daß ich verheurathet wäre, und sie verlangte, ich sollte zu meinem Weibe nach Hau-se kehren – ich könnte sogar diesen tollen Streich begehen – Wahrlich daraus erkenn ich – daß ich das erstemal in meinem Leben ernstlich verliebt bin! – ","['es', 'ist', 'ein', 'gewisses', 'et-was', 'in', 'mir', ',', 'was', 'mich', 'ganz', 'umgestimmt', 'hat', ',', 'ich', 'denke', 'immer', 'an', 'die', 'Baronin', '–', 'mir', 'entschlüpft', 'alle', 'Augenblicke', 'ihr', 'Namen', '–', 'ich', 'seufze', 'sogar', '!', '–', 'ich', 'vergleiche', 'alles', ',', 'was', 'ich', 'schön', 'nennen', 'will', 'mit', 'ihr', '–', 'kurz', 'ich', 'fühle', 'alle', 'möglichen', 'Symptomen', 'eines', 'ächten', 'Liebesfiebers', '–', 'denn', 'ich', 'glaube', ',', 'wenn', 'die', 'Baronin', 'wüßte', ',', 'daß', 'ich', 'verheurathet', 'wäre', ',', 'und', 'sie', 'verlangte', ',', 'ich', 'sollte', 'zu', 'meinem', 'Weibe', 'nach', 'Hau-se', 'kehren', '–', 'ich', 'könnte', 'sogar', 'diesen', 'tollen', 'Streich', 'begehen', '–', 'Wahrlich', 'daraus', 'erkenn', 'ich', '–', 'daß', 'ich', 'das', 'erstemal', 'in', 'meinem', 'Leben', 'ernstlich', 'verliebt', 'bin', '!', '–']"
892,WELLBACH_Lindenthal,,,,,ER,positiv,157432,CATMA_70288B2D-9525-46EC-9241-97896F996D7A,6,Emotionen der Freude,positiv,157408,Freude,. Endlich daß du kömmst!,"['.', 'Endlich', 'daß', 'du', 'kömmst', '!']"
893,WELLBACH_Lindenthal,,,,,ER,negativ,157630,CATMA_7E105A92-0AB8-4243-9208-F8CDF8A37D0D,9,Emotionen des Leids,negativ,157580,Leid, Du weists also schon? – Unangenehme Nachrichten? ,"['Du', 'weists', 'also', 'schon', '?', '–', 'Unangenehme', 'Nachrichten', '?']"
894,,,,,,ER,negativ,157756,CATMA_035A52DE-8721-449F-8138-BF5E9C51405E,20,Emotionen des Leids,negativ,157640,Mitleid,"Ich denke, daß wenn man einen Brief mit Thränen siegelt, der Inhalt nicht viel Tröstliches ver-sprechen könne – ","['Ich', 'denke', ',', 'daß', 'wenn', 'man', 'einen', 'Brief', 'mit', 'Thränen', 'siegelt', ',', 'der', 'Inhalt', 'nicht', 'viel', 'Tröstliches', 'ver-sprechen', 'könne', '–']"
895,WELLBACH_Lindenthal,,,,,ER,negativ,157809,CATMA_DB46E7B2-C144-45E6-A8F4-115ACEFB9723,10,Emotionen des Leids,negativ,157765,Mitleid,Mit Thränen sagst du – sie hat also geweint?,"['Mit', 'Thränen', 'sagst', 'du', '–', 'sie', 'hat', 'also', 'geweint', '?']"
896,,WELLBACH_Lindenthal,,,,ER,negativ,157809,CATMA_806E8994-DC75-4A93-85D6-E492C112D546,5,Emotionen des Leids,negativ,157787,Leid, sie hat also geweint?,"['sie', 'hat', 'also', 'geweint', '?']"
897,,,,,,ER,negativ,158018,CATMA_143A2EBA-6CD9-4337-AB6B-0590E0D9F46E,39,Emotionen des Leids,negativ,157819,Mitleid," Geweint – geweint – nicht mit Thränen gespielt, wirklich geweint – und so gab sie mir den Brief – sagte mir ein Lebewohl, das vielleicht sogar Sie gerührt hätte, und ließ mich betäubt stehen! – ","['Geweint', '–', 'geweint', '–', 'nicht', 'mit', 'Thränen', 'gespielt', ',', 'wirklich', 'geweint', '–', 'und', 'so', 'gab', 'sie', 'mir', 'den', 'Brief', '–', 'sagte', 'mir', 'ein', 'Lebewohl', ',', 'das', 'vielleicht', 'sogar', 'Sie', 'gerührt', 'hätte', ',', 'und', 'ließ', 'mich', 'betäubt', 'stehen', '!', '–']"
898,AMALIA_Blande,PAUL,,,,ER,negativ,157886,CATMA_8E6D4BB2-D4E4-4D19-BE96-E33C928DAB19,12,Emotionen des Leids,negativ,157820,Leid,"Geweint – geweint – nicht mit Thränen gespielt, wirklich geweint –","['Geweint', '–', 'geweint', '–', 'nicht', 'mit', 'Thränen', 'gespielt', ',', 'wirklich', 'geweint', '–']"
899,,,,,,ER,negativ,158012,CATMA_5F79D242-5960-4AC7-BF24-B75F884CDAF3,5,Emotionen des Leids,negativ,157984,Leid,und ließ mich betäubt stehen,"['und', 'ließ', 'mich', 'betäubt', 'stehen']"
900,WELLBACH_Lindenthal,,,,,ER,negativ,158111,CATMA_ED566F23-938D-470D-92D7-72B2FAC79C04,13,Emotionen des Leids,negativ,158052,Leid,(gerührt) Hm! hm! sonderbar – wahrlich ein sonderbares Weib,"['(', 'gerührt', ')', 'Hm', '!', 'hm', '!', 'sonderbar', '–', 'wahrlich', 'ein', 'sonderbares', 'Weib']"
901,AMALIA_Blande,,,,,ER,negativ,158210,CATMA_80CDE369-7EB0-48C3-BCAB-3DA50BFB9AC1,5,Emotionen des Leids,negativ,158187,Mitleid,"„Den Thoren bemitleide,","['„', 'Den', 'Thoren', 'bemitleide', ',']"
902,,,,,,ER,negativ,158239,CATMA_D37694FE-4A03-4B34-B2CE-1610A7EE3983,4,Emotionen der Ablehnung,negativ,158210,Abscheu, den Betrüger verabscheue ich,"['den', 'Betrüger', 'verabscheue', 'ich']"
903,,,,,,ER,negativ,158310,CATMA_7EF66019-A69A-4380-9582-20F734131F6B,9,Emotionen des Leids,negativ,158243,Mitleid,Ich habe Sie heute  unter beiden Gestalten kennen gelernet ,"['Ich', 'habe', 'Sie', 'heute', 'unter', 'beiden', 'Gestalten', 'kennen', 'gelernet']"
904,,,,,,ER,negativ,158310,CATMA_6763E4EA-64F0-44D9-8B44-3D922399AAB3,9,Emotionen der Ablehnung,negativ,158243,Abscheu,Ich habe Sie heute  unter beiden Gestalten kennen gelernet ,"['Ich', 'habe', 'Sie', 'heute', 'unter', 'beiden', 'Gestalten', 'kennen', 'gelernet']"
905,,,,,,ER,negativ,158385,CATMA_1FB3D379-1B36-4AAE-AF87-C02EC4CFB20C,12,Emotionen des Leids,negativ,158312,Leid,"Nehmen Sie das Herz zurück, das Sie einer Unglücklichen schenken wollen","['Nehmen', 'Sie', 'das', 'Herz', 'zurück', ',', 'das', 'Sie', 'einer', 'Unglücklichen', 'schenken', 'wollen']"
906,,,,,,ER,negativ,158487,CATMA_3456BF38-8F9D-439F-8760-C31EF5A87D10,18,Emotionen der Angst,negativ,158386,Verzweiflung, und das einer verzweifeln-den Gattin gehört – der nichts zu wünschen übrig bleibt als der Tod!“ ,"['und', 'das', 'einer', 'verzweifeln-den', 'Gattin', 'gehört', '–', 'der', 'nichts', 'zu', 'wünschen', 'übrig', 'bleibt', 'als', 'der', 'Tod', '!', '“']"
907,WELLBACH_Lindenthal,,,,,ER,Emotionale Bewegtheit,158545,CATMA_B2F49D4F-E00D-4BF5-B648-86D92231C481,8,Emotionale Bewegtheit,Emotionale Bewegtheit,158511,Emotionale Bewegtheit,erstaunt) Gattin? – also entdeckt?,"['erstaunt', ')', 'Gattin', '?', '–', 'also', 'entdeckt', '?']"
908,,,,,,ER,negativ,158636,CATMA_58A2467A-76A5-458C-95B9-BFAB2453CCB3,15,Emotionen der Ablehnung,negativ,158559,Ärger, Ha Schurke! – du hast mich verrathen – hast meine Geschichte erzählt! – ,"['Ha', 'Schurke', '!', '–', 'du', 'hast', 'mich', 'verrathen', '–', 'hast', 'meine', 'Geschichte', 'erzählt', '!', '–']"
909,,,,,,ER,negativ,158826,CATMA_B6D9E824-2643-41BB-96C2-39196639F64D,29,Emotionen der Ablehnung,negativ,158694,Ärger," ha Bestie sollsts auch büssen! – mit diesen Händen will ich dich erwürgen! – (er fällt über ihn her, dieser aber macht sich los) ","['ha', 'Bestie', 'sollsts', 'auch', 'büssen', '!', '–', 'mit', 'diesen', 'Händen', 'will', 'ich', 'dich', 'erwürgen', '!', '–', '(', 'er', 'fällt', 'über', 'ihn', 'her', ',', 'dieser', 'aber', 'macht', 'sich', 'los', ')']"
910,,,,,,ER,negativ,159025,CATMA_AE42669A-6945-4C71-8519-C24204C9F9A1,11,Emotionen der Ablehnung,negativ,158975,Ärger," So handelst du mit mir, mit deinem Herrn? Schurke","['So', 'handelst', 'du', 'mit', 'mir', ',', 'mit', 'deinem', 'Herrn', '?', 'Schurke']"
911,WELLBACH_Lindenthal,,,,,ER,negativ,159174,CATMA_949BB347-54B1-46A6-818B-F53FC683FF73,7,Emotionen der Ablehnung,negativ,159138,Abscheu,Kerl du bist aus meinem Dienst! ,"['Kerl', 'du', 'bist', 'aus', 'meinem', 'Dienst', '!']"
912,WELLBACH_Lindenthal,,,,,ER,negativ,159354,CATMA_EAF641FF-C275-4301-91C2-84823BF58979,6,Emotionen der Ablehnung,negativ,159327,Abscheu,Wo geht der Stockfisch hin?,"['Wo', 'geht', 'der', 'Stockfisch', 'hin', '?']"
913,WELLBACH_Lindenthal,,,,,ER,Emotionale Bewegtheit,159601,CATMA_CDBC1814-B285-4A35-B0F0-24E57A1E06AF,7,Emotionale Bewegtheit,Emotionale Bewegtheit,159574,Emotionale Bewegtheit,(heftig) die Baronin reist?,"['(', 'heftig', ')', 'die', 'Baronin', 'reist', '?']"
914,,,,,,ER,negativ,159801,CATMA_C4C8AAA7-64F5-49D9-AAB5-3413DEC71FC6_0,18,Emotionen des Leids,negativ,159733,Leid,Reist! – reist! – nein das halt ich nicht aus! – die Baronin reist! ,"['Reist', '!', '–', 'reist', '!', '–', 'nein', 'das', 'halt', 'ich', 'nicht', 'aus', '!', '–', 'die', 'Baronin', 'reist', '!']"
915,,,,,,ER,negativ,159972,CATMA_C4C8AAA7-64F5-49D9-AAB5-3413DEC71FC6_1,26,Emotionen des Leids,negativ,159836,Leid,"nein sie muß mir vergeben – ich will hin zu ihr, will ihr alles gestehen – will ihr versprechen zu mei-nem Weibe zurückzukehren – will","['nein', 'sie', 'muß', 'mir', 'vergeben', '–', 'ich', 'will', 'hin', 'zu', 'ihr', ',', 'will', 'ihr', 'alles', 'gestehen', '–', 'will', 'ihr', 'versprechen', 'zu', 'mei-nem', 'Weibe', 'zurückzukehren', '–', 'will']"
916,AMALIA_Blande,,,,,ER,negativ,159836,CATMA_D58A6464-A7E0-467B-BCAA-03C7DD1E4316,7,Emotionen der Ablehnung,negativ,159802,Abscheu," verabscheut mich, und reist! – ","['verabscheut', 'mich', ',', 'und', 'reist', '!', '–']"
917,,,,,,ER,negativ,160178,CATMA_92513064-E83D-4A67-A906-2E1B4A2E1A4D,31,Emotionen des Leids,negativ,160029,Leid, bitt Sie auf den Knieen daß sie bleibt – nur bis Morgen bleibt; o! ich will ja gerne meine Beschämung dul-den – nur hassen soll sie mich nicht! ,"['bitt', 'Sie', 'auf', 'den', 'Knieen', 'daß', 'sie', 'bleibt', '–', 'nur', 'bis', 'Morgen', 'bleibt', ';', 'o', '!', 'ich', 'will', 'ja', 'gerne', 'meine', 'Beschämung', 'dul-den', '–', 'nur', 'hassen', 'soll', 'sie', 'mich', 'nicht', '!']"
918,,,,,,ER,negativ,160359,CATMA_D647A515-459C-4B7A-A654-68430509B08F,15,Emotionen der Ablehnung,negativ,160293,Ärger,. Zum Teufel! zur Baronin sollst du gehen – das hab ich gesagt. ,"['.', 'Zum', 'Teufel', '!', 'zur', 'Baronin', 'sollst', 'du', 'gehen', '–', 'das', 'hab', 'ich', 'gesagt', '.']"
919,WELLBACH_Lindenthal,,,,,ER,Emotionale Bewegtheit,161140,CATMA_E48679CE-B73F-433C-A8B4-2866230F9A92,7,Emotionale Bewegtheit,Emotionale Bewegtheit,161116,Emotionale Bewegtheit, Einen Brief? – von wem?,"['Einen', 'Brief', '?', '–', 'von', 'wem', '?']"
