,file,start,end,text,pre1_base_polarity,pre1_main_emotion_class,pre1_tag_type
1924,GerDracor/schiller-die-piccolomini.xml,116887,116978,Und die Depeschen – Hat der Generalleutnant Sogleich nach Wien geschickt mit dem Gefangnen.,negative,emotions of joy,fear
1925,GerDracor/schiller-die-piccolomini.xml,116979,116991,Nun endlich!,positive,emotions of joy,joy
1926,GerDracor/schiller-die-piccolomini.xml,116992,117000,endlich!,positive,emotions of joy,joy
1927,GerDracor/schiller-die-piccolomini.xml,117001,117028,Das ist eine große Zeitung!,positive,emotions of joy,joy
1928,GerDracor/schiller-die-piccolomini.xml,117029,117113,"Der Mann ist uns ein kostbares Gefäß, Das wichtge Dinge einschließt – Fand man viel?",positive,emotions of affection,love
1929,GerDracor/schiller-die-piccolomini.xml,117114,117154,An sechs Pakete mit Graf Terzkys Wappen.,positive,emotions of affection,emotional movement
1930,GerDracor/schiller-die-piccolomini.xml,117155,117182,Keins von des Fürsten Hand?,emotional movement,emotions of affection,emotional movement
1931,GerDracor/schiller-die-piccolomini.xml,117183,117204,"Nicht, daß ich wüßte.",negative,emotional movement,emotional movement
1932,GerDracor/schiller-die-piccolomini.xml,117205,117220,Und der Sesina?,emotional movement,emotional movement,emotional movement
1933,GerDracor/schiller-die-piccolomini.xml,117221,117287,"Der tat sehr erschrocken, Als man ihm sagt', es ginge nacher Wien.",negative,emotional movement,emotional movement
1934,GerDracor/schiller-die-piccolomini.xml,117288,117371,"Graf Altring aber sprach ihm guten Mut ein, Wenn er nur alles wollte frei bekennen.",positive,emotions of affection,friendship
1935,GerDracor/schiller-die-piccolomini.xml,117372,117402,Ist Altringer bei Eurem Herrn?,emotional movement,emotional movement,emotional movement
1936,GerDracor/schiller-die-piccolomini.xml,117403,117436,"Ich hörte, Er läge krank zu Linz.",negative,emotions of suffering,suffering
1937,GerDracor/schiller-die-piccolomini.xml,117437,117501,Schon seit drei Tagen Ist er zu Frauenberg beim Generalleutnant.,negative,emotions of affection,joy
1938,GerDracor/schiller-die-piccolomini.xml,117503,117583,"Erlesnes Volk, und lassen Euch entbieten, Daß sie von Euch Befehle nur erwarten.",negative,emotions of rejection,admiration
1939,GerDracor/schiller-die-piccolomini.xml,117584,117623,In wenig Tagen kann sich viel ereignen.,emotional movement,emotional movement,emotional movement
1940,GerDracor/schiller-die-piccolomini.xml,117624,117643,Wann müßt Ihr fort?,negative,emotions of rejection,anger
1941,GerDracor/schiller-die-piccolomini.xml,117644,117668,Ich wart auf Eure Ordre.,negative,emotions of rejection,emotional movement
1942,GerDracor/schiller-die-piccolomini.xml,117669,117689,Bleibt biszum Abend.,negative,emotional movement,anger
1943,GerDracor/schiller-die-piccolomini.xml,117690,117695,Wohl.,positive,emotions of suffering,joy
1944,GerDracor/schiller-die-piccolomini.xml,117696,117707,Will gehen.,negative,emotions of fear,fear
1945,GerDracor/schiller-die-piccolomini.xml,117708,117730,Sah Euch doch niemand?,positive,emotions of rejection,emotional movement
1946,GerDracor/schiller-die-piccolomini.xml,117731,117743,Kein Mensch.,negative,emotions of suffering,"hate, disgust"
1947,GerDracor/schiller-die-piccolomini.xml,117744,117817,"Die Kapuziner ließen mich Durchs Klosterpförtchen ein, so wie gewöhnlich.",positive,emotions of joy,anger
1948,GerDracor/schiller-die-piccolomini.xml,117818,117864,"Geht, ruht Euch aus und haltet Euch verborgen.",negative,emotions of rejection,emotional movement
1949,GerDracor/schiller-die-piccolomini.xml,117865,117906,Ich denk Euch noch vor Abend abzufertgen.,negative,emotions of suffering,despair
1950,GerDracor/schiller-die-piccolomini.xml,117907,118065,"Die Sachen liegen der Entwicklung nah, Und eh der Tag, der eben jetzt am Himmel Verhängnisvoll heranbricht, untergeht, Muß ein entscheidend Los gefallen sein.",negative,emotions of suffering,suffering
1951,GerDracor/schiller-die-piccolomini.xml,118066,118082,Kornett geht ab.,negative,emotions of rejection,emotional movement
1952,GerDracor/schiller-die-piccolomini.xml,118083,118101,Beide Piccolomini.,positive,emotions of affection,joy
1953,GerDracor/schiller-die-piccolomini.xml,118102,118121,"Was nun, mein Sohn?",negative,emotional movement,fear
1954,GerDracor/schiller-die-piccolomini.xml,118122,118201,"Jetzt werden wir bald klar sein, – Denn alles, weiß ich, ging durch den Sesina.",negative,emotions of joy,emotional movement
1955,GerDracor/schiller-die-piccolomini.xml,118202,118313,"der während des ganzen vorigen Auftritts in einem heftigen, innern Kampf
              gestanden, entschlossen.",emotional movement,emotions of fear,fear
1956,GerDracor/schiller-die-piccolomini.xml,118314,118361,Ich will auf kürzerm Weg mir Licht verschaffen.,negative,emotions of fear,emotional movement
1957,GerDracor/schiller-die-piccolomini.xml,118362,118371,Leb wohl!,negative,emotions of suffering,suffering
1958,GerDracor/schiller-die-piccolomini.xml,118372,118378,Wohin?,emotional movement,emotional movement,emotional movement
1959,GerDracor/schiller-die-piccolomini.xml,118379,118388,Bleib da!,negative,emotions of rejection,anger
1960,GerDracor/schiller-die-piccolomini.xml,118389,118401,Zum Fürsten.,positive,emotions of affection,admiration
1961,GerDracor/schiller-die-piccolomini.xml,118402,118413,erschrickt.,emotional movement,emotions of fear,fear
1962,GerDracor/schiller-die-piccolomini.xml,118414,118418,Was?,emotional movement,emotional movement,emotional movement
1963,GerDracor/schiller-die-piccolomini.xml,118419,118433,zurückkommend.,emotional movement,emotional movement,emotional movement
1964,GerDracor/schiller-die-piccolomini.xml,118434,118530,"Wenn du geglaubt, ich werde eine Rolle In deinem Spiele spielen, hast du dich In mir verrechnet.",negative,emotions of rejection,anger
1965,GerDracor/schiller-die-piccolomini.xml,118531,118555,Mein Weg muß gerad sein.,negative,emotions of joy,emotional movement
1966,GerDracor/schiller-die-piccolomini.xml,118556,118724,"Ich kann nicht wahr sein mit der Zunge, mit  Als seinem Freunde traut, und mein Gewissen Damit beschwichtigen, daß ers auf  Gefahr tut, daß mein Mund ihn nicht belogen.",negative,emotions of rejection,anger
1967,GerDracor/schiller-die-piccolomini.xml,118725,118766,"Wofür mich einer kauft, das muß ich sein.",negative,emotions of rejection,anger
1968,GerDracor/schiller-die-piccolomini.xml,118767,118788,– Ich geh zum Herzog.,positive,emotional movement,anger
1969,GerDracor/schiller-die-piccolomini.xml,118789,118928,"Heut noch werd ich ihn Auffordern, seinen Leumund vor der Welt Zu retten, eure künstlichen Gewebe Mit einem graden Schritte zu durchreißen.",negative,emotions of rejection,anger
1970,GerDracor/schiller-die-piccolomini.xml,118929,118945,Das wolltest du?,positive,emotions of rejection,anger
1971,GerDracor/schiller-die-piccolomini.xml,118946,118959,Das will ich.,positive,emotions of joy,Schadenfreude
1972,GerDracor/schiller-die-piccolomini.xml,118960,118974,Zweifle nicht.,negative,emotions of affection,suffering
1973,GerDracor/schiller-die-piccolomini.xml,118975,119011,"Ich habe mich in dir verrechnet, ja.",negative,emotions of rejection,anger
1974,GerDracor/schiller-die-piccolomini.xml,119012,119261,"Ich rechnete auf einen weisen Sohn, Der die wohltätgen Hände würde segnen, Die ihn zurück vom Abgrund ziehn – und einen Verblendeten entdeck ich, den zwei Augen Zum Toren machten, Leidenschaft umnebelt, Den selbst des Tages volles Licht nicht heilt.",negative,emotions of rejection,"hate, disgust"
1975,GerDracor/schiller-die-piccolomini.xml,119262,119273,Befrag ihn!,negative,emotional movement,anger
1976,GerDracor/schiller-die-piccolomini.xml,119274,119278,Geh!,negative,emotions of rejection,fear
1977,GerDracor/schiller-die-piccolomini.xml,119279,119359,"Sei unbesonnen gnug, Ihm deines Vaters, deines Kaisers Geheimnis preis zu geben.",positive,emotions of rejection,fear
1978,GerDracor/schiller-die-piccolomini.xml,119360,119407,Nötge mich Zu einem lauten Bruche vor der Zeit!,negative,emotions of fear,suffering
1979,GerDracor/schiller-die-piccolomini.xml,119408,119654,"Und jetzt, nachdem ein Wunderwerk des Himmels Bis heute mein Geheimnis hat beschützt, Des Argwohns helle Blicke eingeschläfert, Laß michs erleben, daß mein eigner Sohn Mit unbedachtsam rasendem Beginnen Der Staatskunst mühevolles Werk vernichtet.",negative,emotions of rejection,"hate, disgust"
1980,GerDracor/schiller-die-piccolomini.xml,119655,119657,O!,emotional movement,emotions of suffering,emotional movement
1981,GerDracor/schiller-die-piccolomini.xml,119658,119699,"diese Staatskunst, wie verwünsch ich sie!",negative,emotions of rejection,"hate, disgust"
1982,GerDracor/schiller-die-piccolomini.xml,119700,119817,"Ihr werdet ihn durch eure Staatskunst noch Zu einem Schritte treiben – Ja, ihr könntet ihn, Weil ihr ihn schuldig  O!",negative,emotions of rejection,anger
1983,GerDracor/schiller-die-piccolomini.xml,119818,119939,"das kann nicht gut endigen – und, mag sichs Entscheiden wie es will, ich sehe ahnend Die unglückselige Entwicklung nahen.",negative,emotions of suffering,suffering
1984,GerDracor/schiller-die-piccolomini.xml,119940,120165,"– Denn dieser Königliche, wenn er fällt,  Und wie ein Schiff, das mitten auf dem Weltmeer In Brand gerät mit einem Mal, und berstend Auffliegt, und alle Mannschaft, die es trug, Ausschüttet plötzlich zwischen Meer und Himmel.",negative,emotions of suffering,despair
1985,GerDracor/schiller-die-piccolomini.xml,120166,120248,"Wird er uns alle, die wir an sein Glück Befestigt sind, in seinen Fall hinabziehn.",negative,emotions of suffering,suffering
1986,GerDracor/schiller-die-piccolomini.xml,120249,120276,"Halte du es, wie du willst!",negative,emotions of rejection,anger
1987,GerDracor/schiller-die-piccolomini.xml,120277,120333,"Doch mir vergönne, Daß ich auf meine Weise mich betrage.",positive,emotions of affection,joy
1988,GerDracor/schiller-die-piccolomini.xml,120334,120474,"Rein muß es bleiben zwischen mir und ihm, Und eh der Tag sich neigt, muß sichs erklären, Ob ich den Freund, ob ich den Vater soll entbehren.",positive,emotions of affection,friendship
1989,GerDracor/schiller-die-piccolomini.xml,120475,120510,"Indem er abgeht, fällt der Vorhang.",negative,emotions of fear,suffering
