,file,start,end,text,pre1_base_polarity,pre1_main_emotion_class,pre1_tag_type
1042,GerDracor/grillparzer-ein-treuer-diener-seines-herrn.xml,43260,43331,"Ich weiß wohl, was sie sagen: Seht den Alten, Er freit ein junges Weib.",positive,emotions of joy,joy
1043,GerDracor/grillparzer-ein-treuer-diener-seines-herrn.xml,43332,43359,"Er täuscht, man zwingt sie.",negative,emotions of rejection,anger
1044,GerDracor/grillparzer-ein-treuer-diener-seines-herrn.xml,43360,43410,"Sag, Erny, selbst, wardst du getäuscht, gezwungen?",negative,emotions of suffering,suffering
1045,GerDracor/grillparzer-ein-treuer-diener-seines-herrn.xml,43411,43419,Von wem?,emotional movement,emotional movement,emotional movement
1046,GerDracor/grillparzer-ein-treuer-diener-seines-herrn.xml,43420,43429,und wann?,emotional movement,emotional movement,emotional movement
1047,GerDracor/grillparzer-ein-treuer-diener-seines-herrn.xml,43430,43618,"Als Nemaret, dein Vater, Im Tod zusammenfügte unsre Hände, Der blühnden Tochter und des Jugendfreundes, Dem Schutz dich anvertrauend eines Gatten, Wer zögerte, dein rasches Wort zu nehmen?",positive,emotions of affection,love
1048,GerDracor/grillparzer-ein-treuer-diener-seines-herrn.xml,43619,43644,Wer schob die Heirat auf?,emotional movement,emotional movement,emotional movement
1049,GerDracor/grillparzer-ein-treuer-diener-seines-herrn.xml,43645,43707,"Wer bat, beschwor dich, Dein Alter zu bedenken, und das seine?",negative,emotions of rejection,emotional movement
1050,GerDracor/grillparzer-ein-treuer-diener-seines-herrn.xml,43708,43767,"Allein du wolltest, und er fügte sich, Weiß Gott, wie gern.",negative,emotions of joy,love
1051,GerDracor/grillparzer-ein-treuer-diener-seines-herrn.xml,43768,43798,Wenns nun dich reut – Bancban!,negative,emotions of rejection,anger
1052,GerDracor/grillparzer-ein-treuer-diener-seines-herrn.xml,43799,43890,"So lag der Prinz vor mir auf seinen Knien, So werf ich mich vor dich hin, ach, und schwöre.",negative,emotions of affection,love
1053,GerDracor/grillparzer-ein-treuer-diener-seines-herrn.xml,43891,43940,"Was fällt dir ein, zu knien vor mir und schwören?",negative,emotions of rejection,anger
1054,GerDracor/grillparzer-ein-treuer-diener-seines-herrn.xml,43941,43967,Dein Wort sei ja und nein!,positive,emotions of affection,love
1055,GerDracor/grillparzer-ein-treuer-diener-seines-herrn.xml,43968,44030,"weißt du dich schuldlos, Tritt hin vor mich und sag: Ich bins!",positive,emotions of suffering,joy
1056,GerDracor/grillparzer-ein-treuer-diener-seines-herrn.xml,44031,44040,Hörst du?,positive,emotions of joy,anger
1057,GerDracor/grillparzer-ein-treuer-diener-seines-herrn.xml,44041,44065,"Ich bins, bin schuldlos!",negative,emotions of joy,joy
1058,GerDracor/grillparzer-ein-treuer-diener-seines-herrn.xml,44066,44090,– und sieh mir ins Auge!,negative,emotions of suffering,love
1059,GerDracor/grillparzer-ein-treuer-diener-seines-herrn.xml,44091,44101,Nichts da!,negative,emotions of suffering,emotional movement
1060,GerDracor/grillparzer-ein-treuer-diener-seines-herrn.xml,44102,44132,Den Blick nicht auf den Boden!,negative,emotions of rejection,suffering
1061,GerDracor/grillparzer-ein-treuer-diener-seines-herrn.xml,44133,44157,"Hier, Auf mich dein Aug!",positive,emotions of affection,love
1062,GerDracor/grillparzer-ein-treuer-diener-seines-herrn.xml,44158,44190,"– Ja so, es schwimmt in Tränen?!",negative,emotions of suffering,suffering
1063,GerDracor/grillparzer-ein-treuer-diener-seines-herrn.xml,44191,44236,"Mißhandeln, Kind, mißhandeln wollt ich nicht!",negative,emotions of rejection,anger
1064,GerDracor/grillparzer-ein-treuer-diener-seines-herrn.xml,44237,44363,"Senk nur die Stirne, leg sie an dies Herz, Und was du weißt, das flüstre leis ihm zu, Es wird dich hören, wie es dir verzeiht!",negative,emotions of affection,suffering
1065,GerDracor/grillparzer-ein-treuer-diener-seines-herrn.xml,44364,44373,Verzeihn?,negative,emotions of suffering,suffering
1066,GerDracor/grillparzer-ein-treuer-diener-seines-herrn.xml,44374,44390,"O, bittres Wort!",negative,emotions of suffering,suffering
1067,GerDracor/grillparzer-ein-treuer-diener-seines-herrn.xml,44391,44485,"Nu, Kind, wer weiß, Vielleicht dich bitten selbst, daß du verzeihst, Was Törichtes ich sprach.",negative,emotions of suffering,suffering
1068,GerDracor/grillparzer-ein-treuer-diener-seines-herrn.xml,44486,44546,"Es ist mein Fehler, Mein alter Fehler: stets der Mund voran!",negative,emotions of rejection,suffering
1069,GerDracor/grillparzer-ein-treuer-diener-seines-herrn.xml,44547,44560,aufgerichtet.,emotional movement,emotional movement,emotional movement
1070,GerDracor/grillparzer-ein-treuer-diener-seines-herrn.xml,44561,44569,Bancban!,negative,emotions of rejection,anger
1071,GerDracor/grillparzer-ein-treuer-diener-seines-herrn.xml,44570,44586,Vor allem wisse!,negative,emotions of affection,friendship
1072,GerDracor/grillparzer-ein-treuer-diener-seines-herrn.xml,44587,44655,Kein Gedanke Von Unrecht kam in meinen armen Sinn; Nur daß – o Gott!,negative,emotions of suffering,suffering
1073,GerDracor/grillparzer-ein-treuer-diener-seines-herrn.xml,44656,44666,Mein Gott!,negative,emotions of fear,fear
1074,GerDracor/grillparzer-ein-treuer-diener-seines-herrn.xml,44667,44689,"Schämst du dich, Kind?",negative,emotions of rejection,anger
1075,GerDracor/grillparzer-ein-treuer-diener-seines-herrn.xml,44690,44707,Das ist dir nütz!,positive,emotions of joy,joy
1076,GerDracor/grillparzer-ein-treuer-diener-seines-herrn.xml,44708,44735,Schäm dich an meiner Brust!,negative,emotions of rejection,anger
1077,GerDracor/grillparzer-ein-treuer-diener-seines-herrn.xml,44736,44818,"So recht, den Kopf im Winkel eingeduckt, Die Augen zu, recht wie der Vogel Strauß.",positive,emotions of suffering,suffering
1078,GerDracor/grillparzer-ein-treuer-diener-seines-herrn.xml,44819,44843,Und so laß sprechen uns.,negative,emotions of rejection,joy
1079,GerDracor/grillparzer-ein-treuer-diener-seines-herrn.xml,44844,44860,– Du guter Gott!,negative,emotions of fear,fear
1080,GerDracor/grillparzer-ein-treuer-diener-seines-herrn.xml,44861,44951,"Ich möchte singen, jubeln, jauchzen, schrein, Daß sie mir blieb, daß ich sie nicht verlor.",positive,emotions of joy,joy
1081,GerDracor/grillparzer-ein-treuer-diener-seines-herrn.xml,44952,44986,Nun also denn: Der Prinz war hier?,emotional movement,emotions of joy,emotional movement
1082,GerDracor/grillparzer-ein-treuer-diener-seines-herrn.xml,44987,44994,Ach ja!,negative,emotional movement,emotional movement
1083,GerDracor/grillparzer-ein-treuer-diener-seines-herrn.xml,44995,45008,War ungestüm?,emotional movement,emotional movement,emotional movement
1084,GerDracor/grillparzer-ein-treuer-diener-seines-herrn.xml,45009,45022,aufgerichtet.,emotional movement,emotional movement,emotional movement
