,file,start,end,text,pre1_base_polarity,pre1_main_emotion_class,pre1_tag_type
467,TextGrid/-Carolus_Stuardus.xml,36858,37165,"Brich an gewündschtes Licht / wir sind des Lebens sat / Vnd schaun den König an / der selbst ein Creutz betrat Verhast von seinem Volck / verlacht von seinen Scharen Verkennt von Ländern die auff ihn vertröstet waren / Den Freund / wie uns verkaufft, Vnd kränckt umb Frembde Schuld / und biß zum Tode plagt.",negative,emotions of suffering,suffering
468,TextGrid/-Carolus_Stuardus.xml,37166,37279,Der Höchste / wehrter Fürst / wol Ihn den Tag anblicken / Wir gläuben daß Er werd' uns / seinen Knecht erquicken.,positive,emotions of affection,admiration
469,TextGrid/-Carolus_Stuardus.xml,37280,37325,Drückt ihre Majestät noch ein verborgen Leid?,negative,emotions of suffering,compassion
470,TextGrid/-Carolus_Stuardus.xml,37326,37425,Wir finden uns getrost / und zu der Noth bereit / Hat sie der kurtzen Nacht genossen sonder Sorgen?,positive,emotions of joy,joy
471,TextGrid/-Carolus_Stuardus.xml,37426,37481,Wir haben was geruht / doch wündschend nach dem Morgen.,positive,emotions of joy,suffering
472,TextGrid/-Carolus_Stuardus.xml,37482,37509,Die Zeit fällt zimlich eng.,negative,emotions of fear,emotional movement
473,TextGrid/-Carolus_Stuardus.xml,37510,37539,Es ist mein Fürst noch früh'.,positive,emotional movement,emotional movement
474,TextGrid/-Carolus_Stuardus.xml,37540,37592,Vns nicht / die wir beschwert mit überhäuffter Müh'.,negative,emotions of suffering,suffering
475,TextGrid/-Carolus_Stuardus.xml,37593,37649,Gott wendet Müh in Lust / und hilfft offt sonder Mittel.,positive,emotions of joy,admiration
