,file,start,end,text,pre1_base_polarity,pre1_main_emotion_class,pre1_tag_type
0,GerDracor/lessing-der-freigeist.xml,0,24, Die Szene ist ein Saal.,negative,emotional movement,emotional movement
1,GerDracor/lessing-der-freigeist.xml,25,32,Adrast.,negative,emotions of suffering,emotional movement
2,GerDracor/lessing-der-freigeist.xml,33,42,Theophan.,negative,emotional movement,emotional movement
3,GerDracor/lessing-der-freigeist.xml,43,193,"Werden Sie es übel nehmen, Adrast, wenn ich mich endlich über den stolzen Kaltsinn
              beklage, den Sie nicht aufhören gegen mich zu äußern?",negative,emotions of rejection,anger
4,GerDracor/lessing-der-freigeist.xml,194,282,"Schon seit Monaten sind wir in
              Einem Hause, und warten auf einerlei Glück.",positive,emotions of joy,joy
5,GerDracor/lessing-der-freigeist.xml,283,349,"Zwei liebenswürdige Schwestern sollen es
              uns machen.",positive,emotions of affection,admiration
6,GerDracor/lessing-der-freigeist.xml,350,376,"Bedenken Sie doch, Adrast!",negative,emotions of suffering,fear
7,GerDracor/lessing-der-freigeist.xml,377,544,"können wir noch dringender eingeladen werden,
              uns zu lieben, und eine Freundschaft unter uns zu stiften, wie sie unter Brüdern sein
              sollte?",positive,emotions of affection,friendship
8,GerDracor/lessing-der-freigeist.xml,545,584,Wie oft bin ich nicht darauf bestanden?,positive,emotions of rejection,anger
9,GerDracor/lessing-der-freigeist.xml,585,654,"– – Eben so oft haben Sie gesehen, daß ich mich nicht einlassen will.",negative,emotions of rejection,suffering
10,GerDracor/lessing-der-freigeist.xml,655,668,Freundschaft?,emotional movement,emotions of affection,friendship
11,GerDracor/lessing-der-freigeist.xml,683,706,Freundschaft unter uns?,positive,emotions of affection,friendship
12,GerDracor/lessing-der-freigeist.xml,707,760,"– – Wissen Sie, muß ich fragen, was Freundschaft ist?",positive,emotional movement,friendship
13,GerDracor/lessing-der-freigeist.xml,761,776,Ob ich es weiß?,emotional movement,emotional movement,emotional movement
14,GerDracor/lessing-der-freigeist.xml,777,830,"Alle Fragen bestürzen, deren wir nicht gewärtig sind.",emotional movement,emotions of fear,fear
15,GerDracor/lessing-der-freigeist.xml,831,850,"Gut, Sie wissen es.",negative,emotions of rejection,joy
16,GerDracor/lessing-der-freigeist.xml,851,934,"Aber meine
              Art zu denken, und die Ihrige, diese kennen Sie doch auch?",negative,emotions of rejection,emotional movement
17,GerDracor/lessing-der-freigeist.xml,935,952,Ich verstehe Sie.,negative,emotions of suffering,emotional movement
18,GerDracor/lessing-der-freigeist.xml,953,986,Also sollen wir wohl Feinde sein?,negative,emotions of rejection,anger
19,GerDracor/lessing-der-freigeist.xml,987,1019,Sie haben mich schön verstanden!,positive,emotions of joy,joy
20,GerDracor/lessing-der-freigeist.xml,1020,1027,Feinde?,emotional movement,emotional movement,emotional movement
21,GerDracor/lessing-der-freigeist.xml,1028,1049,Ist denn kein Mittel?,negative,emotional movement,emotional movement
22,GerDracor/lessing-der-freigeist.xml,1050,1122,"Muß denn der Mensch
              eines von beiden, hassen, oder lieben?",positive,emotions of affection,"hate, disgust"
23,GerDracor/lessing-der-freigeist.xml,1123,1164,Gleichgültig wollen wir einander bleiben.,emotional movement,emotions of affection,friendship
24,GerDracor/lessing-der-freigeist.xml,1165,1231,"Und
              ich weiß, eigentlich wünschen Sie dieses selbst.",positive,emotions of affection,admiration
25,GerDracor/lessing-der-freigeist.xml,1232,1299,"Lernen Sie wenigstens nur die
              Aufrichtigkeit von mir.",negative,emotions of affection,friendship
26,GerDracor/lessing-der-freigeist.xml,1300,1315,Ich bin bereit.,negative,emotions of fear,joy
27,GerDracor/lessing-der-freigeist.xml,1316,1397,"Werden Sie mich aber diese Tugend in aller ihrer Lauterkeit
              lehren?",negative,emotions of rejection,admiration
28,GerDracor/lessing-der-freigeist.xml,1398,1495,"Erst fragen Sie sich selbst, ob sie Ihnen in aller ihrer Lauterkeit gefallen
              würde?",positive,emotional movement,emotional movement
29,GerDracor/lessing-der-freigeist.xml,1496,1502,Gewiß.,negative,emotions of fear,joy
30,GerDracor/lessing-der-freigeist.xml,1503,1639,"Und Ihnen zu zeigen, ob Ihr künftiger Schüler einige Fähigkeit dazu hat,
              wollen Sie mich wohl einen Versuch machen lassen?",positive,emotions of rejection,anger
31,GerDracor/lessing-der-freigeist.xml,1640,1651,Recht gern.,positive,emotions of joy,joy
32,GerDracor/lessing-der-freigeist.xml,1652,1700,Wo nur mein Versuch nicht ein Meisterstück wird.,negative,emotions of suffering,suffering
33,GerDracor/lessing-der-freigeist.xml,1701,1822,"Hören Sie also, Adrast – – Aber
              erlauben Sie mir, daß ich mit einer Schmeichelei gegen mich selbst anfange.",positive,emotional movement,anger
34,GerDracor/lessing-der-freigeist.xml,1823,1962,"Ich habe
              von je her einigen Wert auf meine Freundschaft gelegt; ich bin vorsichtig, ich bin
              karg damit gewesen.",positive,emotions of affection,friendship
35,GerDracor/lessing-der-freigeist.xml,1963,2079,"Sie sind der erste, dem ich sie angeboten habe; und Sie sind der
              einzige, dem ich sie aufdringen will.",positive,emotions of affection,friendship
36,GerDracor/lessing-der-freigeist.xml,2080,2172,"– – Umsonst sagt mir Ihr verächtlicher Blick,
              daß es mir nicht gelingen solle.",negative,emotions of rejection,"hate, disgust"
37,GerDracor/lessing-der-freigeist.xml,2173,2201,"Gewiß, es soll mir gelingen.",positive,emotions of joy,joy
38,GerDracor/lessing-der-freigeist.xml,2202,2411,"Ihr eigen Herz ist mir
              Bürge; Ihr eigen Herz, Adrast, welches unendlich besser ist, als es Ihr Witz, der sich
              in gewisse groß scheinende Meinungen verliebt hat, vielleicht wünschet.",positive,emotions of affection,friendship
39,GerDracor/lessing-der-freigeist.xml,2412,2548,"Ich hasse die Lobsprüche, Theophan, und besonders die, welche meinem Herzen auf
              Unkosten meines Verstandes gegeben werden.",negative,emotions of rejection,"hate, disgust"
40,GerDracor/lessing-der-freigeist.xml,2549,2860,"Ich weiß eigentlich nicht, was das für
              Schwachheiten sein müssen, (Schwachheiten aber müssen es sein,) derentwegen Ihnen mein
              Herz so wohlgefällt; das aber weiß ich, daß ich nicht eher ruhen werde, als bis ich
              sie, durch Hülfe meines Verstandes, daraus verdrungen habe.",negative,emotions of rejection,joy
41,GerDracor/lessing-der-freigeist.xml,2861,2973,"Ich habe die Probe meiner Aufrichtigkeit kaum angefangen, und Ihre Empfindlichkeit
              ist schon rege.",emotional movement,emotional movement,emotional movement
42,GerDracor/lessing-der-freigeist.xml,2974,3002,Ich werde nicht weit kommen.,negative,emotions of fear,suffering
43,GerDracor/lessing-der-freigeist.xml,3003,3026,So weit als Sie wollen.,positive,emotions of rejection,anger
44,GerDracor/lessing-der-freigeist.xml,3027,3047,Fahren Sie nur fort.,negative,emotions of rejection,anger
45,GerDracor/lessing-der-freigeist.xml,3048,3057,Wirklich?,negative,emotions of suffering,emotional movement
46,GerDracor/lessing-der-freigeist.xml,3058,3111,"– – Ihr Herz also ist das beste, das man finden kann.",positive,emotions of affection,love
47,GerDracor/lessing-der-freigeist.xml,3112,3465,"Es ist zu gut, Ihrem
              Geiste zu dienen, den das Neue, das Besondere geblendet hat, den ein Anschein von
              Gründlichkeit zu glänzenden Irrtümern dahinreißt, und der, aus Begierde bemerkt zu
              werden, Sie mit aller Gewalt zu etwas machen will, was nur Feinde der Tugend, was nur
              Bösewichter sein sollten.",positive,emotions of rejection,"hate, disgust"
48,GerDracor/lessing-der-freigeist.xml,3466,3696,"Nennen Sie es, wie Sie wollen: Freidenker, starker Geist,
              Deist; ja, wenn Sie ehrwürdige Benennungen mißbrauchen wollen, nennen Sie es
              Philosoph: es ist ein Ungeheuer, es ist die Schande der Menschheit.",negative,emotions of rejection,"hate, disgust"
49,GerDracor/lessing-der-freigeist.xml,3697,4108,"Und Sie, Adrast,
              den die Natur zu einer Zierde derselben bestimmte, der nur seinen eignen Empfindungen
              folgen dürfte, um es zu sein; Sie, mit einer solchen Sie vergessen sich, Theophan, und wenn ich Sie nicht unterbreche, so glauben Sie
              endlich gar, daß Sie sich an dem Platze befinden, auf welchem Ihres gleichen ganze
              Stunden ungestört schwatzen dürfen.",negative,emotions of suffering,emotional movement
50,GerDracor/lessing-der-freigeist.xml,4109,4354,"Nein, Adrast, Sie unterbrechen keinen überlästigen Prediger; besinnen Sie sich nur:
              Sie unterbrechen bloß einen Freund, – – wider Ihren Willen nenne ich mich so, – – der
              eine Probe seiner Freimütigkeit ablegen sollte.",negative,emotional movement,anger
51,GerDracor/lessing-der-freigeist.xml,4355,4569,"Und eine Probe seiner Schmeichelei abgeleget hat; – aber einer verdeckten
              Schmeichelei, einer Schmeichelei, die eine gewisse Bitterkeit annimmt, um destoweniger
              Schmeichelei zu scheinen.",positive,emotions of rejection,admiration
52,GerDracor/lessing-der-freigeist.xml,4570,4627,"– – Sie werden machen, daß ich Sie endlich auch verachte.",negative,emotions of rejection,"hate, disgust"
53,GerDracor/lessing-der-freigeist.xml,4628,4789,"–
              – Wenn Sie die Freimütigkeit kennten, so würden Sie mir alles unter die Augen gesagt
              haben, was Sie in Ihrem Herzen von mir denken.",positive,emotions of affection,love
54,GerDracor/lessing-der-freigeist.xml,4790,4905,"Ihr Mund würde mir keine gute Seite
              geliehen haben, die mir Ihre innere Überzeugung nicht zugestehet.",negative,emotions of rejection,admiration
55,GerDracor/lessing-der-freigeist.xml,4906,5105,"Sie würden mich
              gerade weg einen Ruchlosen gescholten haben, der sich der Religion nur deswegen zu
              entziehen suche, damit er seinen Lüsten desto sicherer nachhängen könne.",negative,emotions of rejection,"hate, disgust"
56,GerDracor/lessing-der-freigeist.xml,5106,5247,"Um sich
              pathetischer auszudrücken, würden Sie mich einen Höllenbrand, einen eingefleischten
              Teufel genannt haben.",negative,emotions of rejection,"hate, disgust"
57,GerDracor/lessing-der-freigeist.xml,5248,5464,"Sie würden keine Verwünschungen gespart, kurz, Sie würden sich
              so erwiesen haben, wie sich ein Theolog gegen die Verächter seines Aberglaubens, und
              also auch seines Ansehens, erweisen muß.",negative,emotions of rejection,anger
58,GerDracor/lessing-der-freigeist.xml,5465,5478,Ich erstaune.,emotional movement,emotional movement,emotional movement
59,GerDracor/lessing-der-freigeist.xml,5479,5496,Was für Begriffe!,negative,emotions of rejection,emotional movement
60,GerDracor/lessing-der-freigeist.xml,5497,5555,"Begriffe, die ich von tausend Beispielen abgesondert habe.",negative,emotions of rejection,emotional movement
61,GerDracor/lessing-der-freigeist.xml,5556,5598,"– – Doch wir kommen zu
              weit.",negative,emotions of suffering,fear
62,GerDracor/lessing-der-freigeist.xml,5599,5706,"Ich weiß, was ich weiß, und habe längst gelernt, die Larve von dem Gesichte zu
              unterscheiden.",negative,emotions of rejection,anger
63,GerDracor/lessing-der-freigeist.xml,5707,5802,"Es ist eine Karnevalserfahrung: Je schöner die erste, desto häßlicher
              das andere.",positive,emotions of suffering,"hate, disgust"
64,GerDracor/lessing-der-freigeist.xml,5803,6007,"Sie wollen damit sagen – – Ich will nichts damit sagen, als daß ich noch zu wenig Grund habe, die Allgemeinheit
              meines Urteils von den Gliedern Ihres Standes, um Ihret Willen einzuschränken.",negative,emotions of rejection,anger
65,GerDracor/lessing-der-freigeist.xml,6008,6155,"Ich
              habe mich nach den Ausnahmen zu lange vergebens umgesehen, als daß ich hoffen könnte,
              die erste an Ihnen zu finden.",negative,emotions of suffering,suffering
66,GerDracor/lessing-der-freigeist.xml,6156,6374,"Ich müßte Sie länger, ich müßte Sie unter verschiedenen
              Umständen gekannt haben, wenn – – Wenn Sie meinem Gesichte die Gerechtigkeit widerfahren lassen sollten, es für keine
              Larve zu halten.",emotional movement,emotional movement,love
67,GerDracor/lessing-der-freigeist.xml,6375,6380,Wohl!,positive,emotions of suffering,joy
68,GerDracor/lessing-der-freigeist.xml,6381,6486,"Aber wie können Sie kürzer dazu gelangen, als wenn Sie mich
              Ihres nähern Umganges würdigen?",positive,emotions of affection,admiration
69,GerDracor/lessing-der-freigeist.xml,6487,6577,"Machen Sie mich zu Ihrem Freunde, stellen Sie mich auf
              die Probe – – Sachte!",positive,emotions of affection,friendship
70,GerDracor/lessing-der-freigeist.xml,6578,6672,"die Probe käme zu spät, wenn ich Sie bereits zu meinem Freunde angenommen
              hätte.",positive,emotions of affection,friendship
71,GerDracor/lessing-der-freigeist.xml,6673,6714,"Ich habe geglaubt, sie müsse vorhergehen.",negative,emotions of affection,love
72,GerDracor/lessing-der-freigeist.xml,6715,6818,"Es gibt Grade in der Freundschaft, Adrast; und ich verlange den vertrautesten noch
              nicht.",positive,emotions of affection,friendship
73,GerDracor/lessing-der-freigeist.xml,6819,6877,"Kurz, auch zu dem niedrigsten können Sie nicht fähig sein.",negative,emotions of rejection,admiration
74,GerDracor/lessing-der-freigeist.xml,6878,6909,Ich kann nicht dazu fähig sein?,negative,emotional movement,emotional movement
75,GerDracor/lessing-der-freigeist.xml,6910,6937,Wo liegt die Unmöglichkeit?,emotional movement,emotions of fear,emotional movement
76,GerDracor/lessing-der-freigeist.xml,6938,7237,"Kennen Sie, Theophan, wohl ein Buch, welches das Buch aller Bücher sein soll; welches
              alle unsere Pflichten enthalten, welches uns zu allen Tugenden die sichersten
              Vorschriften erteilen soll, und welches der Freundschaft gleichwohl mit keinem Worte
              gedenkt?",positive,emotions of rejection,anger
77,GerDracor/lessing-der-freigeist.xml,7238,7261,Kennen Sie dieses Buch?,negative,emotional movement,emotional movement
78,GerDracor/lessing-der-freigeist.xml,7262,7290,"Ich sehe Sie kommen, Adrast.",emotional movement,emotions of suffering,fear
79,GerDracor/lessing-der-freigeist.xml,7291,7352,"Welchem  Abgeborgt, oder selbst erfunden: es ist gleich viel.",emotional movement,emotions of affection,emotional movement
80,GerDracor/lessing-der-freigeist.xml,7353,7435,"Es muß ein kleiner Geist sein,
              der sich Wahrheiten zu borgen schämt.",negative,emotions of rejection,"hate, disgust"
81,GerDracor/lessing-der-freigeist.xml,7436,7447,Wahrheiten!,negative,emotions of rejection,anger
82,GerDracor/lessing-der-freigeist.xml,7448,7499,– – Sind Ihre übrigen Wahrheiten von gleicher Güte?,positive,emotions of affection,admiration
83,GerDracor/lessing-der-freigeist.xml,7500,7555,"Können Sie mich einen
              Augenblick anhören?",negative,emotional movement,emotional movement
84,GerDracor/lessing-der-freigeist.xml,7556,7572,Wieder predigen?,negative,emotional movement,anger
85,GerDracor/lessing-der-freigeist.xml,7573,7602,Zwingen Sie mich nicht darzu?,negative,emotions of rejection,anger
86,GerDracor/lessing-der-freigeist.xml,7603,7750,"Oder wollen Sie, daß man Ihre seichten Spöttereien
              unbeantwortet lassen soll, damit es scheine, als könne man nicht darauf antworten?",positive,emotions of rejection,anger
87,GerDracor/lessing-der-freigeist.xml,7751,7792,Und was können Sie denn darauf antworten?,emotional movement,emotional movement,emotional movement
88,GerDracor/lessing-der-freigeist.xml,7793,7800,Dieses.,negative,emotions of suffering,suffering
89,GerDracor/lessing-der-freigeist.xml,7801,7916,"Sagen Sie mir, ist die Liebe unter der Freundschaft, oder die Freundschaft
              unter der Liebe begriffen?",positive,emotions of affection,friendship
90,GerDracor/lessing-der-freigeist.xml,7917,7940,Notwendig das letztere.,negative,emotions of suffering,suffering
91,GerDracor/lessing-der-freigeist.xml,7941,8068,"Derjenige also, der die Liebe in
              ihrem allerweitesten Umfange gebietet, gebietet der nicht auch die Freundschaft?",positive,emotions of affection,friendship
92,GerDracor/lessing-der-freigeist.xml,8069,8326,"Ich
              sollte es glauben; und es ist so wenig wahr, daß unser Gesetzgeber die Freundschaft
              seines Gebotes nicht würdig geschätzt habe, daß er vielmehr seine Lehre zu einer
              Freundschaft gegen die ganze Welt gemacht hat.",positive,emotions of affection,friendship
93,GerDracor/lessing-der-freigeist.xml,8327,8362,Sie bürden ihm Ungereimtheiten auf.,negative,emotional movement,suffering
94,GerDracor/lessing-der-freigeist.xml,8363,8397,Freundschaft gegen die ganze Welt?,positive,emotions of affection,friendship
95,GerDracor/lessing-der-freigeist.xml,8398,8410,Was ist das?,negative,emotional movement,emotional movement
96,GerDracor/lessing-der-freigeist.xml,8425,8474,Mein Freund muß kein Freund der ganzen Welt sein.,positive,emotions of affection,friendship
97,GerDracor/lessing-der-freigeist.xml,8475,8766,"Und also ist Ihnen wohl nichts Freundschaft, als jene Übereinstimmung der
              Temperamente, jene angeborne Harmonie der Gemüter, jener heimliche Zug gegen einander,
              jene unsichtbare Kette, die zwei einerlei denkende, einerlei wollende Seelen
              verknüpfet?",positive,emotions of affection,friendship
98,GerDracor/lessing-der-freigeist.xml,8767,8803,"Ja, nur dieses ist mir Freundschaft.",positive,emotions of affection,friendship
99,GerDracor/lessing-der-freigeist.xml,8804,8815,Nur dieses?,emotional movement,emotional movement,emotional movement
100,GerDracor/lessing-der-freigeist.xml,8816,8851,Sie widersprechen sich also selbst.,emotional movement,emotions of rejection,anger
101,GerDracor/lessing-der-freigeist.xml,8852,8854,O!,emotional movement,emotions of suffering,emotional movement
102,GerDracor/lessing-der-freigeist.xml,8855,8958,"daß Ihr Leute doch überall Widersprüche findet, außer nur da nicht, wo sie
              wirklich sind!",negative,emotions of rejection,anger
103,GerDracor/lessing-der-freigeist.xml,8959,8976,Überlegen Sie es.,emotional movement,emotional movement,emotional movement
104,GerDracor/lessing-der-freigeist.xml,8977,9270,"Wenn diese, ohne Zweifel nicht willkürliche, Übereinstimmung der
              Seelen, diese in uns liegende Harmonie mit einem andern einzelnen Wesen allein die
              wahre Freundschaft ausmacht: wie können Sie verlangen, daß sie der Gegenstand eines
              Gesetzes sein soll?",positive,emotions of affection,friendship
105,GerDracor/lessing-der-freigeist.xml,9271,9378,"Wo sie ist, darf sie nicht geboten werden; und wo sie nicht ist,
              da wird sie umsonst geboten.",negative,emotions of affection,love
106,GerDracor/lessing-der-freigeist.xml,9379,9504,"Und wie können Sie es unserm Lehrer zur Last legen, daß
              er die Freundschaft in diesem Verstande übergangen hat?",negative,emotions of rejection,friendship
107,GerDracor/lessing-der-freigeist.xml,9505,9760,"Er hat uns eine edlere
              Freundschaft befohlen, welche jenes blinden Hanges, den auch die unvernünftigen Tiere
              nicht missen, entbehren kann: eine Freundschaft, die sich nach erkannten
              Vollkommenheiten  O Geschwätze!",positive,emotions of affection,friendship
108,GerDracor/lessing-der-freigeist.xml,9761,9890,"Ich muß Ihnen dieses sagen, Adrast, ob Sie es gleich eben so wohl wissen könnten, als
              ich; und auch wissen sollten.",negative,emotions of rejection,anger
109,GerDracor/lessing-der-freigeist.xml,9891,10189,"Was würden Sie selbst von mir denken, wenn ich den
              Verdacht nicht mit aller Gewalt von mir abzulenken suchte, als mache mich die Religion
              zu einem Verächter der Freundschaft, die Religion, die Sie nur allzugern aus einem
              wichtigen Grunde verachten möchten?",negative,emotions of rejection,"hate, disgust"
110,GerDracor/lessing-der-freigeist.xml,10190,10324,"– – Sehen Sie mich nicht so geringschätzig an;
              wenden Sie sich nicht auf eine so beleidigende Art von mir – – bei Seite.",negative,emotions of rejection,anger
111,GerDracor/lessing-der-freigeist.xml,10325,10346,Das Pfaffengeschmeiß!,negative,emotions of rejection,anger
112,GerDracor/lessing-der-freigeist.xml,10347,10360,– – Ich sehe.,emotional movement,emotional movement,emotional movement
113,GerDracor/lessing-der-freigeist.xml,10361,10498,"Sie gebrauchen Zeit, den ersten Widerwillen zu unterdrücken, den eine
              widerlegte Lieblingsmeinung natürlicher Weise erregt.",negative,emotions of rejection,anger
114,GerDracor/lessing-der-freigeist.xml,10499,10524,– Ich will Sie verlassen.,negative,emotions of suffering,despair
115,GerDracor/lessing-der-freigeist.xml,10525,10625,"Ich
              erfuhr itzt ohnedem, daß einer von meinen Anverwandten mit der Post angelangt sei.",negative,emotions of joy,joy
116,GerDracor/lessing-der-freigeist.xml,10626,10717,"Ich
              gehe ihm entgegen, und werde die Ehre haben Ihnen denselben vorzustellen.",positive,emotions of joy,admiration
117,GerDracor/lessing-der-freigeist.xml,10718,10764,– – Daß ich ihn nimmermehr wiedersehen dürfte!,negative,emotions of affection,suffering
118,GerDracor/lessing-der-freigeist.xml,10765,10834,"Welcher von euch Schwarzröcken wäre
              auch kein Heuchler?",negative,emotions of rejection,"hate, disgust"
119,GerDracor/lessing-der-freigeist.xml,10835,10881,– – Priestern habe ich mein Unglück zu danken.,negative,emotions of suffering,suffering
120,GerDracor/lessing-der-freigeist.xml,10882,10981,"Sie haben mich
              gedrückt, verfolgt, so nahe sie auch das Blut mit mir verbunden hatte.",negative,emotions of suffering,suffering
121,GerDracor/lessing-der-freigeist.xml,10982,11051,"Hassen will ich
              dich, Theophan, und alle deines Ordens!",negative,emotions of rejection,"hate, disgust"
122,GerDracor/lessing-der-freigeist.xml,11052,11137,"Muß ich denn auch hier in die Verwandtschaft
              der Geistlichkeit geraten?",negative,emotional movement,emotional movement
123,GerDracor/lessing-der-freigeist.xml,11138,11248,"– – Er, dieser Schleicher, dieser blöde Verleugner seines
              Verstandes, soll mein Schwager werden?",negative,emotions of rejection,emotional movement
124,GerDracor/lessing-der-freigeist.xml,11249,11286,– – Und mein Schwager durch Julianen?,emotional movement,emotional movement,emotional movement
125,GerDracor/lessing-der-freigeist.xml,11287,11318,"– Durch
              Julianen?",emotional movement,emotional movement,emotional movement
126,GerDracor/lessing-der-freigeist.xml,11319,11373,– Welch grausames Geschick verfolgt mich doch überall!,negative,emotions of suffering,suffering
127,GerDracor/lessing-der-freigeist.xml,11374,11470,"Ein alter Freund
              meines verstorbenen Vaters trägt mir eine von seinen Töchtern an.",positive,emotions of affection,love
128,GerDracor/lessing-der-freigeist.xml,11471,11547,"Ich eile herbei, und
              muß zu spät kommen, und muß die, Lisidor.",negative,emotions of fear,emotional movement
129,GerDracor/lessing-der-freigeist.xml,11548,11555,Adrast.,negative,emotions of suffering,emotional movement
130,GerDracor/lessing-der-freigeist.xml,11556,11570,Da haben wirs!,positive,emotions of joy,joy
131,GerDracor/lessing-der-freigeist.xml,11571,11599,"Schon wieder allein, Adrast?",negative,emotions of suffering,emotional movement
132,GerDracor/lessing-der-freigeist.xml,11600,11674,"Sagen Sie mir, müssen die Philosophen so
              zu Winkel kriechen?",negative,emotions of rejection,anger
133,GerDracor/lessing-der-freigeist.xml,11675,11808,"Ich wollte doch lieber sonst was sein – – Und, wenn ich recht
              gehört habe, so sprachen Sie ja wohl gar mit sich selber?",negative,emotional movement,emotional movement
134,GerDracor/lessing-der-freigeist.xml,11809,11816,"Nu, nu!",positive,emotions of rejection,anger
135,GerDracor/lessing-der-freigeist.xml,11817,11951,"es ist schon wahr:
              ihr Herren Grillenfänger könnt freilich mit niemand Klügerm reden, als mit euch
              selber.",negative,emotions of rejection,anger
136,GerDracor/lessing-der-freigeist.xml,11952,12005,Aber gleichwohl ist unser einer auch kein Katzenkopf.,positive,emotions of affection,love
137,GerDracor/lessing-der-freigeist.xml,12006,12072,"Ich schwatze eins mit,
              es mag sein, von was es will.",negative,emotions of rejection,anger
138,GerDracor/lessing-der-freigeist.xml,12073,12116,"Verzeihen Sie – – Je, mit Seinem Verzeihen!",negative,emotions of suffering,suffering
139,GerDracor/lessing-der-freigeist.xml,12117,12217,"Er hat mir ja noch nichts zuwider getan – – Ich habe gern,
              wenn die Leute lustig sind.",positive,emotions of joy,joy
140,GerDracor/lessing-der-freigeist.xml,12218,12432,"Und ich will kein ehrlicher Mann sein, wenn ich mir nicht
              eine rechte Freude darauf eingebildet habe, den Wildfang, wie sie Ihn sonst zu Hause
              nannten, zu meinem Schwiegersohne zu haben.",positive,emotions of joy,"hate, disgust"
