,file,start,end,text,pre1_base_polarity,pre1_main_emotion_class,pre1_tag_type
1580,GerDracor/goethe-der-grosskophta.xml,94185,94280,"Ich
              habe kein Interesse mehr, und Sie verlangen, daß ich es an Ihnen nehmen soll?",negative,emotions of rejection,suffering
1581,GerDracor/goethe-der-grosskophta.xml,94281,94417,"Meine
              Zutraulichkeit ist auf das schändlichste mißhandelt worden, und Sie wollen, daß ich
              Ihnen trauen soll?",negative,emotions of rejection,suffering
1582,GerDracor/goethe-der-grosskophta.xml,94418,94468,"Ihnen, einer doppelten, dreifachen Schauspielerin?",positive,emotional movement,admiration
1583,GerDracor/goethe-der-grosskophta.xml,94469,94659,"Welch ein Glück,
              daß ich diesen Abend hieher kam und Ihnen nicht Zeit ließ, sich vorzubereiten, die
              Maske anzulegen, mit der Sie auch mich zu hintergehen dachten!",positive,emotions of joy,suffering
1584,GerDracor/goethe-der-grosskophta.xml,94660,94685,Ich bin ganz unglücklich!,negative,emotions of suffering,suffering
1585,GerDracor/goethe-der-grosskophta.xml,94686,94696,Eilen Sie!,negative,emotions of fear,fear
1586,GerDracor/goethe-der-grosskophta.xml,94697,94716,Entfernen Sie sich!,negative,emotions of rejection,anger
1587,GerDracor/goethe-der-grosskophta.xml,94717,94727,Man kommt!,positive,emotions of joy,joy
1588,GerDracor/goethe-der-grosskophta.xml,94728,94760,"Ich gehe, Sie nie wiederzusehen!",negative,emotions of rejection,suffering
1589,GerDracor/goethe-der-grosskophta.xml,94761,94772,Die Nichte.,negative,emotions of suffering,emotional movement
1590,GerDracor/goethe-der-grosskophta.xml,94773,94785,Der Marquis.,positive,emotional movement,admiration
1591,GerDracor/goethe-der-grosskophta.xml,94786,94803,halb in der Türe.,negative,emotions of suffering,emotional movement
1592,GerDracor/goethe-der-grosskophta.xml,94804,94828,"Sind Sie allein, Nichte?",emotional movement,emotions of suffering,emotional movement
1593,GerDracor/goethe-der-grosskophta.xml,94829,94842,Nur ein Wort!,negative,emotions of affection,emotional movement
1594,GerDracor/goethe-der-grosskophta.xml,94843,94944,"indem der Marquis wieder zur Tür hinaussieht, betrachtet sie sich geschwind im
              Spiegel.",positive,emotional movement,emotional movement
1595,GerDracor/goethe-der-grosskophta.xml,94945,94978,"Ich sehe verweint, verworren aus!",emotional movement,emotional movement,emotional movement
1596,GerDracor/goethe-der-grosskophta.xml,94979,94998,Was werd ich sagen?,negative,emotions of fear,anger
1597,GerDracor/goethe-der-grosskophta.xml,94999,95038,sie umarmend und fest an sich drückend.,positive,emotions of affection,love
1598,GerDracor/goethe-der-grosskophta.xml,95039,95062,"Süßes, holdes Geschöpf!",positive,emotions of affection,love
1599,GerDracor/goethe-der-grosskophta.xml,95063,95081,ihn zurückhaltend.,emotional movement,emotional movement,emotional movement
1600,GerDracor/goethe-der-grosskophta.xml,95082,95108,"Um Gottes willen, Marquis!",emotional movement,emotions of fear,fear
1601,GerDracor/goethe-der-grosskophta.xml,95109,95146,"Wir sind allein, fürchten Sie nichts!",negative,emotions of fear,fear
1602,GerDracor/goethe-der-grosskophta.xml,95147,95171,sich von ihm losmachend.,negative,emotions of rejection,"hate, disgust"
1603,GerDracor/goethe-der-grosskophta.xml,95172,95199,Die Marquise erwartet mich.,positive,emotions of joy,joy
1604,GerDracor/goethe-der-grosskophta.xml,95201,95210,Beiseite.,negative,emotional movement,emotional movement
1605,GerDracor/goethe-der-grosskophta.xml,95211,95225,Was haben Sie?,emotional movement,emotional movement,emotional movement
1606,GerDracor/goethe-der-grosskophta.xml,95226,95254,Sie sehen ganz verstört aus.,emotional movement,emotional movement,emotional movement
1607,GerDracor/goethe-der-grosskophta.xml,95255,95264,Ach Gott!,negative,emotions of fear,fear
1608,GerDracor/goethe-der-grosskophta.xml,95265,95351,"Die Zumutungen meiner Tante – Du dauerst mich, liebes Kind; aber ich will dich retten.",negative,emotions of suffering,compassion
1609,GerDracor/goethe-der-grosskophta.xml,95352,95423,"Sie wissen doch, heute nacht soll ich die Rolle der Prinzessin spielen.",positive,emotions of joy,joy
1610,GerDracor/goethe-der-grosskophta.xml,95424,95459,"Es ist
              erschrecklich!",negative,emotions of suffering,compassion
1611,GerDracor/goethe-der-grosskophta.xml,95460,95471,Kommen Sie!,positive,emotions of joy,joy
1612,GerDracor/goethe-der-grosskophta.xml,95473,95550,"Sie sieht sich inzwischen furchtsam nach der
                Garderobetür um.",negative,emotions of fear,fear
1613,GerDracor/goethe-der-grosskophta.xml,95551,95604,"Bleiben Sie, bleiben Sie, eben deswegen bin ich hier!",negative,emotions of joy,joy
1614,GerDracor/goethe-der-grosskophta.xml,95605,95692,"Spielen Sie heute nacht Ihre
              Rolle nur gut, Sie haben nichts zu besorgen.",negative,emotions of fear,fear
1615,GerDracor/goethe-der-grosskophta.xml,95693,95717,So lassen Sie uns gehen.,negative,emotions of suffering,suffering
1616,GerDracor/goethe-der-grosskophta.xml,95718,95777,Nein doch; ich wollte Ihnen sagen – Dazu ist's morgen Zeit.,negative,emotional movement,anger
1617,GerDracor/goethe-der-grosskophta.xml,95778,95789,Keineswegs!,negative,emotions of rejection,anger
1618,GerDracor/goethe-der-grosskophta.xml,95790,95856,"Sie scheinen diese Abenteuer weniger zu fürchten, als Sie sollten.",negative,emotions of fear,fear
1619,GerDracor/goethe-der-grosskophta.xml,95857,95866,wie oben.,negative,emotional movement,anger
1620,GerDracor/goethe-der-grosskophta.xml,95867,95903,Ich bin in der größten Verlegenheit!,negative,emotions of fear,fear
1621,GerDracor/goethe-der-grosskophta.xml,95904,95983,"Es steht Ihnen noch etwas Seltsames diese Nacht bevor, an das Sie nicht denken.",emotional movement,emotions of suffering,emotional movement
1622,GerDracor/goethe-der-grosskophta.xml,95984,95993,Was denn?,emotional movement,emotional movement,emotional movement
1623,GerDracor/goethe-der-grosskophta.xml,95994,96015,Sie erschrecken mich!,negative,emotions of fear,fear
1624,GerDracor/goethe-der-grosskophta.xml,96016,96049,Daß Sie mit mir wegreisen werden.,negative,emotions of rejection,Schadenfreude
1625,GerDracor/goethe-der-grosskophta.xml,96050,96060,Mit Ihnen?,emotional movement,emotional movement,emotional movement
1626,GerDracor/goethe-der-grosskophta.xml,96061,96109,Und das sagen Sie mit einer Art von Widerwillen?,negative,emotions of rejection,anger
1627,GerDracor/goethe-der-grosskophta.xml,96110,96145,"Ich weiß nicht, was ich sagen soll.",emotional movement,emotional movement,emotional movement
1628,GerDracor/goethe-der-grosskophta.xml,96146,96177,Ich werde Sie leicht aufklären.,negative,emotions of joy,anger
1629,GerDracor/goethe-der-grosskophta.xml,96178,96262,"Die Maskerade, zu der Sie angezogen sind, ist nicht
              ein bloßer Scherz.",negative,emotions of rejection,"hate, disgust"
1630,GerDracor/goethe-der-grosskophta.xml,96263,96458,"Meine Frau hat im Namen der Prinzessin den Domherrn um einen
              wichtigen Dienst ersucht, und Sie sollen die Dankbarkeit der Fürstin gegen den
              betrogenen Mann ausdrücken.",negative,emotions of suffering,admiration
1631,GerDracor/goethe-der-grosskophta.xml,96459,96484,wie oben in Verlegenheit.,negative,emotional movement,emotional movement
1632,GerDracor/goethe-der-grosskophta.xml,96485,96514,Ich soll ihm eine Rose geben.,positive,emotions of affection,admiration
1633,GerDracor/goethe-der-grosskophta.xml,96515,96563,Eine würdige Belohnung für einen solchen Dienst!,positive,emotions of affection,joy
1634,GerDracor/goethe-der-grosskophta.xml,96564,96736,"Denn zu nichts Geringerem hat sich
              die blinde Leidenschaft des Domherrn bereden lassen, als das schöne Halsband von den
              Hofjuwelieren zu kaufen.",positive,emotions of affection,love
1635,GerDracor/goethe-der-grosskophta.xml,96737,96750,Das Halsband?,emotional movement,emotional movement,emotional movement
1636,GerDracor/goethe-der-grosskophta.xml,96751,96816,"Das wir gestern so sehr bewunderten, als wir diesen Ring kauften.",positive,emotions of affection,admiration
1637,GerDracor/goethe-der-grosskophta.xml,96817,96838,Es ist nicht möglich!,negative,emotions of fear,suffering
1638,GerDracor/goethe-der-grosskophta.xml,96839,96899,"So gewiß, daß ich schon einen Teil davon in der Tasche habe.",positive,emotions of affection,joy
1639,GerDracor/goethe-der-grosskophta.xml,96900,96904,Sie?,emotional movement,emotional movement,emotional movement
1640,GerDracor/goethe-der-grosskophta.xml,96905,96925,Was soll das heißen?,emotional movement,emotional movement,emotional movement
1641,GerDracor/goethe-der-grosskophta.xml,96926,96947,– Man könnte horchen.,negative,emotions of rejection,anger
1642,GerDracor/goethe-der-grosskophta.xml,96948,96969,So treten Sie hieher!,negative,emotions of rejection,anger
1643,GerDracor/goethe-der-grosskophta.xml,96971,97000,Er nähert sich der Garderobe.,negative,emotional movement,fear
1644,GerDracor/goethe-der-grosskophta.xml,97001,97049,welche bisher die größte Verlegenheit verborgen.,negative,emotions of fear,fear
1645,GerDracor/goethe-der-grosskophta.xml,97050,97082,Welche gefährliche Unternehmung!,negative,emotions of rejection,fear
1646,GerDracor/goethe-der-grosskophta.xml,97083,97128,"Wir müssen jetzt nicht sorgen, sondern wagen.",positive,emotions of fear,fear
1647,GerDracor/goethe-der-grosskophta.xml,97129,97153,Ich wünsche Ihnen Glück!,positive,emotions of joy,joy
1648,GerDracor/goethe-der-grosskophta.xml,97154,97185,"Nein, du sollst es mir bringen!",negative,emotions of rejection,anger
1649,GerDracor/goethe-der-grosskophta.xml,97186,97231,Du sollst und mußt meine Reisegefährtin sein.,positive,emotions of affection,friendship
1650,GerDracor/goethe-der-grosskophta.xml,97232,97272,Sie wollen mich dieser Gefahr aussetzen?,negative,emotions of fear,fear
1651,GerDracor/goethe-der-grosskophta.xml,97273,97323,"Die Gefahr ist weit größer, wenn du zurückbleibst.",negative,emotions of fear,fear
1652,GerDracor/goethe-der-grosskophta.xml,97324,97423,"Meine Frau ist verwegen genug, das
              Märchen, solang es nur gehen will, durchzuspielen.",negative,emotions of rejection,"hate, disgust"
1653,GerDracor/goethe-der-grosskophta.xml,97424,97516,"– Bis der erste Zahlungstermin
              kommt, ja noch weiter, ist sie ziemlich sicher.",positive,emotions of affection,joy
1654,GerDracor/goethe-der-grosskophta.xml,97517,97569,"Indes kann ich dich nicht hier
              lassen.",negative,emotions of rejection,anger
1655,GerDracor/goethe-der-grosskophta.xml,97570,97637,"Bedenken Sie – Ich weiß nicht, wie ich dein Betragen erklären soll.",negative,emotional movement,anger
1656,GerDracor/goethe-der-grosskophta.xml,97638,97712,"Wär es möglich, daß man mir
              schon dein Herz entwendet hätte?",negative,emotions of suffering,love
1657,GerDracor/goethe-der-grosskophta.xml,97713,97742,"– Nein, es ist nicht möglich!",negative,emotions of fear,suffering
1658,GerDracor/goethe-der-grosskophta.xml,97743,97796,"Du bist verlegen, aber
              nicht verändert.",negative,emotional movement,emotional movement
