,file,start,end,text,pre1_base_polarity,pre1_main_emotion_class,pre1_tag_type
143,GerDracor/weidmann-der-dorfbarbier.xml,6814,6857,"Geh', lasse Hans zur Ader, Und das war gut.",positive,emotions of rejection,joy
144,GerDracor/weidmann-der-dorfbarbier.xml,6858,6976,"Ich dacht', in großen Massen Find'st du da Blut; Ich ließ ihm hundert Tassen,  Hans entging der Athem, Wie wunderlich!",negative,emotions of suffering,suffering
145,GerDracor/weidmann-der-dorfbarbier.xml,6977,7027,"Es war nicht mehr zu rathen, Drum trollt ich mich.",negative,emotions of rejection,suffering
146,GerDracor/weidmann-der-dorfbarbier.xml,7028,7079,"Mein Hans drauf' mußte wandern, Wohl ihm – er ruht!",negative,emotions of suffering,suffering
147,GerDracor/weidmann-der-dorfbarbier.xml,7080,7125,"Sein Weib nahm einen Andern, Und das war gut.",positive,emotions of joy,joy
148,GerDracor/weidmann-der-dorfbarbier.xml,7126,7217,Der Schulz der kriegte Schaden Grad an der Hand Ich sollt ihm etwas rathen Wider den Brand.,negative,emotions of suffering,suffering
149,GerDracor/weidmann-der-dorfbarbier.xml,7218,7256,Ich dacht' ist gehüpft wie gesprungen.,positive,emotions of joy,joy
150,GerDracor/weidmann-der-dorfbarbier.xml,7257,7273,Weg mit dem Arm.,negative,emotions of suffering,anger
151,GerDracor/weidmann-der-dorfbarbier.xml,7274,7322,"Der Kerl hat gräßlich g'sungen, Daß Gott erbarm.",negative,emotions of suffering,"hate, disgust"
152,GerDracor/weidmann-der-dorfbarbier.xml,7323,7433,"Er schrie voll Wuth und Jammer, Mir starrt das Blut; Ich schlug ihn mit dem Hammer Auf'n Kopf und das war gut.",negative,emotions of rejection,anger
153,GerDracor/weidmann-der-dorfbarbier.xml,7434,7533,"Was schreist Du denn Du Lümmel, Schrie ich voll Wuth, Du kommst ja eh'r in Himmel, Und das war gut.",negative,emotions of rejection,anger
154,GerDracor/weidmann-der-dorfbarbier.xml,7534,7643,"Wen rühren nicht die Leiden Die mir die Liebe beut, Ich soll den Theuren meiden :| Dem ich mein Herz geweiht.",negative,emotions of suffering,suffering
155,GerDracor/weidmann-der-dorfbarbier.xml,7644,7698,|: O Liebe heil' mein Herz :| Und ende meinen Schmerz.,negative,emotions of suffering,suffering
156,GerDracor/weidmann-der-dorfbarbier.xml,7699,7713,|:  tritt auf.,emotional movement,emotional movement,emotional movement
157,GerDracor/weidmann-der-dorfbarbier.xml,7714,7769,"Da ist sie, ich will ihr ein wenig auf den Puls fühlen.",emotional movement,emotional movement,emotional movement
158,GerDracor/weidmann-der-dorfbarbier.xml,7771,7776,Laut.,emotional movement,emotional movement,emotional movement
159,GerDracor/weidmann-der-dorfbarbier.xml,7777,7817,"Recht gut, daß Sie mich an den erinnern.",positive,emotions of joy,joy
160,GerDracor/weidmann-der-dorfbarbier.xml,7818,7936,"Seine Besuche werden mir lästig; d'rum, Herr
            Lux, bitte ich Sie, lassen Sie sich nicht ferner mit ihm ein.",negative,emotions of rejection,anger
161,GerDracor/weidmann-der-dorfbarbier.xml,7937,8001,"Ich habe nie einen
            Gedanken auf den Menschen gehabt.",negative,emotions of rejection,"hate, disgust"
162,GerDracor/weidmann-der-dorfbarbier.xml,8002,8102,"Er schwatzt mir verliebte Possen vor, die ich aber als
            ein albernes Geschmätz betrachte.",positive,emotions of rejection,love
163,GerDracor/weidmann-der-dorfbarbier.xml,8103,8165,"Komm' her, Du Schmuck meines Hauses, Du Ehre meiner Erziehung!",negative,emotions of affection,joy
164,GerDracor/weidmann-der-dorfbarbier.xml,8166,8250,"Durch meine weisen
            Lehren hab' ich Dich zu diesem Meisterstück gebildet.",positive,emotions of affection,admiration
165,GerDracor/weidmann-der-dorfbarbier.xml,8251,8312,"Freue Dich, Deine Tugend erhält
            heute ihren Lohn!",positive,emotions of joy,joy
166,GerDracor/weidmann-der-dorfbarbier.xml,8313,8383,"In diesem Augenblicke will ich Dir mein Herz entdecken, sei glücklich!",positive,emotions of joy,joy
167,GerDracor/weidmann-der-dorfbarbier.xml,8396,8452,"Höre die vortheilhaften Gedanken, die ich für Dich hege.",positive,emotional movement,love
168,GerDracor/weidmann-der-dorfbarbier.xml,8453,8510,"Ich habe Dich zu meinem
            Ehegesponst erkieset.",positive,emotions of rejection,love
169,GerDracor/weidmann-der-dorfbarbier.xml,8511,8629,Ich bin bewundert und geschätzt Bei Kleinen und bei Großen; Ich bin die Krone und der Schmuck Von meinen Zeitgenossen.,positive,emotions of affection,admiration
170,GerDracor/weidmann-der-dorfbarbier.xml,8630,8697,"Das Weib, das meine Hand begehrt, Ist glücklich und beneidenswerth!",positive,emotions of joy,joy
171,GerDracor/weidmann-der-dorfbarbier.xml,8698,8726,"Du lächelst, kleiner Schelm?",positive,emotions of joy,joy
172,GerDracor/weidmann-der-dorfbarbier.xml,8727,8761,"Was gilt's, Du riechst den Braten?",negative,emotions of rejection,Schadenfreude
173,GerDracor/weidmann-der-dorfbarbier.xml,8762,8792,"Wer, meinst Du, ist die Braut?",emotional movement,emotional movement,emotional movement
174,GerDracor/weidmann-der-dorfbarbier.xml,8793,8820,Ich kann es nicht errathen.,emotional movement,emotions of fear,emotional movement
175,GerDracor/weidmann-der-dorfbarbier.xml,8821,8859,Vielleicht ein Fräulein aus der Stadt?,emotional movement,emotional movement,emotional movement
176,GerDracor/weidmann-der-dorfbarbier.xml,8860,8880,den Kopf schüttelnd.,negative,emotional movement,emotional movement
177,GerDracor/weidmann-der-dorfbarbier.xml,8881,8914,Die sind zu pfiffig und zu platt.,negative,emotions of rejection,anger
178,GerDracor/weidmann-der-dorfbarbier.xml,8915,8951,Vielleicht ein Mädchen von dem Land.,emotional movement,emotional movement,"hate, disgust"
179,GerDracor/weidmann-der-dorfbarbier.xml,8952,8966,ihr zunickend.,positive,emotions of affection,love
180,GerDracor/weidmann-der-dorfbarbier.xml,8967,8999,Nur die erhält einst meine Hand!,positive,emotions of affection,love
181,GerDracor/weidmann-der-dorfbarbier.xml,9000,9024,Ist's Görgen's Käthchen?,emotional movement,emotional movement,emotional movement
182,GerDracor/weidmann-der-dorfbarbier.xml,9025,9030,Nein!,emotional movement,emotions of rejection,emotional movement
183,GerDracor/weidmann-der-dorfbarbier.xml,9031,9055,Des Schulzen's Nettchen?,positive,emotions of joy,emotional movement
184,GerDracor/weidmann-der-dorfbarbier.xml,9056,9061,Nein!,emotional movement,emotions of rejection,emotional movement
185,GerDracor/weidmann-der-dorfbarbier.xml,9062,9083,Die fromme Ernestine?,emotional movement,emotional movement,emotional movement
186,GerDracor/weidmann-der-dorfbarbier.xml,9084,9089,Nein!,emotional movement,emotions of rejection,emotional movement
187,GerDracor/weidmann-der-dorfbarbier.xml,9090,9112,Die reiche Wilhelmine?,emotional movement,emotional movement,emotional movement
188,GerDracor/weidmann-der-dorfbarbier.xml,9113,9118,Nein!,emotional movement,emotions of rejection,emotional movement
189,GerDracor/weidmann-der-dorfbarbier.xml,9119,9168,"Ich sinne hin und her, Ich weiß sonst keine mehr.",emotional movement,emotional movement,emotional movement
190,GerDracor/weidmann-der-dorfbarbier.xml,9169,9198,Wer sollt' es denn wohl sein?,negative,emotional movement,anger
191,GerDracor/weidmann-der-dorfbarbier.xml,9199,9212,sich blähend.,negative,emotions of suffering,emotional movement
192,GerDracor/weidmann-der-dorfbarbier.xml,9213,9238,"Erstaune, Kind, und höre!",emotional movement,emotional movement,emotional movement
193,GerDracor/weidmann-der-dorfbarbier.xml,9239,9264,Nur Dir gebührt die Ehre!,negative,emotions of affection,admiration
194,GerDracor/weidmann-der-dorfbarbier.xml,9265,9317,"Nur Dir bin ich bescheert, Nur Du bist meiner werth.",positive,emotions of affection,love
195,GerDracor/weidmann-der-dorfbarbier.xml,9318,9333,beide für sich.,positive,emotions of rejection,anger
196,GerDracor/weidmann-der-dorfbarbier.xml,9334,9393,"Listig muß ich mich verstellen, Sonst ist's um mich gethan.",negative,emotions of rejection,fear
197,GerDracor/weidmann-der-dorfbarbier.xml,9394,9458,"Alter Fuchs, Dich muß ich prellen Und nur Joseph wird mein Mann.",negative,emotions of rejection,anger
198,GerDracor/weidmann-der-dorfbarbier.xml,9459,9576,"Seht sie schlägt die Augen nieder, Ihre Wange färbt die Scham, Ach wie zittern ihre Glieder, Ach, das arme gute Lamm.",negative,emotions of suffering,compassion
199,GerDracor/weidmann-der-dorfbarbier.xml,9577,9584,zu Lux.,positive,emotional movement,emotional movement
200,GerDracor/weidmann-der-dorfbarbier.xml,9585,9656,"Ich – Herr – Lux – bin – so – verlegen, Daß – ich – mich – erholen muß.",negative,emotions of suffering,emotional movement
201,GerDracor/weidmann-der-dorfbarbier.xml,9657,9669,mit Salbung.,negative,emotions of affection,suffering
202,GerDracor/weidmann-der-dorfbarbier.xml,9670,9734,"Auf Dich strömt des Himmels Segen, Schätzchen gib mir einen Kuß!",positive,emotions of affection,love
203,GerDracor/weidmann-der-dorfbarbier.xml,9735,9770,Umarmt das sich sträubende Suschen.,positive,emotions of suffering,joy
204,GerDracor/weidmann-der-dorfbarbier.xml,9771,9891,"Glücklich sind nur solche Ehen, Wo das Herz das Jawort spricht, Aber die aus Zwang geschehen, Das ist wahre Liebe nicht.",positive,emotions of joy,joy
205,GerDracor/weidmann-der-dorfbarbier.xml,9892,9899,Dialog.,emotional movement,emotional movement,emotional movement
206,GerDracor/weidmann-der-dorfbarbier.xml,9900,9918,Du bist erstaunt!?,emotional movement,emotional movement,emotional movement
207,GerDracor/weidmann-der-dorfbarbier.xml,9919,10035,"Ja, Du kannst mit Recht der Vorsehung danken, die Dich gewürdigt
            hat, das Weib des großen Lux zu werden.",positive,emotions of affection,joy
208,GerDracor/weidmann-der-dorfbarbier.xml,10036,10146,"Mädchen, Du sollst: glänzen, wie der Sirius am
            Nordpol und wohnen  Joseph tritt
              ein.",positive,emotions of affection,joy
209,GerDracor/weidmann-der-dorfbarbier.xml,10147,10197,"Ach, da kommt der überlästige Mensch schon wieder.",negative,emotions of rejection,"hate, disgust"
210,GerDracor/weidmann-der-dorfbarbier.xml,10198,10236,Geht in's Zimmer und holt einen Brief.,emotional movement,emotional movement,emotional movement
211,GerDracor/weidmann-der-dorfbarbier.xml,10237,10273,O mit dem will ich bald fertig sein!,negative,emotions of rejection,anger
212,GerDracor/weidmann-der-dorfbarbier.xml,10274,10373,"Ich kann nicht vor diesem Hause vorübergehen, ohne meinen lieben Herrn Lux zu
            begrüßen.",positive,emotions of affection,joy
213,GerDracor/weidmann-der-dorfbarbier.xml,10374,10422,"Suschen gibt Joseph den Brief, Joseph winkt ihr.",negative,emotions of rejection,anger
214,GerDracor/weidmann-der-dorfbarbier.xml,10423,10428,kalt.,negative,emotions of suffering,suffering
215,GerDracor/weidmann-der-dorfbarbier.xml,10429,10462,"Schönen Dank, ich habe Geschäfte.",positive,emotions of joy,joy
216,GerDracor/weidmann-der-dorfbarbier.xml,10463,10530,"Wo man eintritt, spricht Alles nur von dem weltberühmten Herrn Lux.",positive,emotions of affection,admiration
217,GerDracor/weidmann-der-dorfbarbier.xml,10531,10547,wird freundlich.,positive,emotions of joy,joy
218,GerDracor/weidmann-der-dorfbarbier.xml,10548,10555,Wie so?,emotional movement,emotional movement,emotional movement
219,GerDracor/weidmann-der-dorfbarbier.xml,10556,10589,"Ich gehe gleich, Jungfer Suschen!",negative,emotions of joy,joy
220,GerDracor/weidmann-der-dorfbarbier.xml,10590,10631,"ich weiß wohl, daß ich Ihnen verhaßt bin.",negative,emotions of rejection,"hate, disgust"
221,GerDracor/weidmann-der-dorfbarbier.xml,10632,10729,"Ich will
            nur hier mit Herrn Lux, der die Zierde der Arzneikunst ist, ein wenig reden.",positive,emotions of affection,admiration
222,GerDracor/weidmann-der-dorfbarbier.xml,10730,10821,"– Das neue
            Wunder mit dem Dorfschneider hat alle Menschen in Erstaunen gesetzt.",emotional movement,emotions of joy,emotional movement
223,GerDracor/weidmann-der-dorfbarbier.xml,10822,10861,"Alle Bauern essen
            Schinken.",negative,emotions of rejection,anger
224,GerDracor/weidmann-der-dorfbarbier.xml,10862,11001,"So lange ich auf der Universität war, habe ich nie von einem Arzt gehört, der
            so viele außerordentliche Kuren verrichtet hätte.",emotional movement,emotions of affection,admiration
225,GerDracor/weidmann-der-dorfbarbier.xml,11002,11047,Es ist eine besondere Gabe der Natur – Genie!,positive,emotions of affection,admiration
226,GerDracor/weidmann-der-dorfbarbier.xml,11048,11119,"– Es hat Studium gekostet, bis ich es
            soweit gebracht habe.",negative,emotions of suffering,suffering
227,GerDracor/weidmann-der-dorfbarbier.xml,11120,11163,Joseph ist indessen zu Suschen geschlichen.,negative,emotions of rejection,fear
228,GerDracor/weidmann-der-dorfbarbier.xml,11164,11198,"sieht, das Lux sich zu ihr wendet.",positive,emotional movement,love
229,GerDracor/weidmann-der-dorfbarbier.xml,11199,11241,O quälen Sie mich nicht mit Ihren Briefen!,negative,emotions of rejection,suffering
230,GerDracor/weidmann-der-dorfbarbier.xml,11242,11318,"Fort mit diesem Geschmiere; ich will nichts
            lesen, nichts hören!",negative,emotions of rejection,anger
231,GerDracor/weidmann-der-dorfbarbier.xml,11319,11378,Gibt Joseph ihren eigenen Brief und läuft in das Vorzimmer.,negative,emotions of rejection,emotional movement
232,GerDracor/weidmann-der-dorfbarbier.xml,11379,11440,"Danken Sie es meiner guten Laune, sonst –  Die Bauern kommen.",negative,emotions of joy,joy
233,GerDracor/weidmann-der-dorfbarbier.xml,11441,11466,Gott grüße Euch in Ehren!,positive,emotions of affection,joy
234,GerDracor/weidmann-der-dorfbarbier.xml,11467,11518,"Die Bärte uns zu scheeren, Erscheinen wir bei Euch.",negative,emotions of rejection,"hate, disgust"
235,GerDracor/weidmann-der-dorfbarbier.xml,11519,11604,"Beliebt Euch nur zu setzen, Ich muß mein Messer wetzen, Dann putz' ich Euch sogleich.",negative,emotions of rejection,anger
236,GerDracor/weidmann-der-dorfbarbier.xml,11605,11615,Bei Seite.,negative,emotional movement,emotional movement
237,GerDracor/weidmann-der-dorfbarbier.xml,11616,11674,"Verwünscht sei doch der Geck, Er geht mir nicht vom Fleck.",negative,emotions of rejection,"hate, disgust"
238,GerDracor/weidmann-der-dorfbarbier.xml,11675,11731,Das Liebeln muß ich enden; Mir geht es nicht von Händen.,positive,emotions of affection,love
239,GerDracor/weidmann-der-dorfbarbier.xml,11732,11737,Laut.,emotional movement,emotional movement,emotional movement
240,GerDracor/weidmann-der-dorfbarbier.xml,11738,11764,"Herr Joseph, leb' Er wohl!",negative,emotions of suffering,suffering
241,GerDracor/weidmann-der-dorfbarbier.xml,11765,11774,Für sich.,positive,emotions of suffering,emotional movement
242,GerDracor/weidmann-der-dorfbarbier.xml,11775,11800,Daß Dich der Teufel hol'!,negative,emotions of rejection,anger
243,GerDracor/weidmann-der-dorfbarbier.xml,11801,11825,Ich gehe schon Herr Lux!,negative,emotions of fear,fear
244,GerDracor/weidmann-der-dorfbarbier.xml,11826,11835,für sich.,positive,emotions of joy,emotional movement
245,GerDracor/weidmann-der-dorfbarbier.xml,11836,11862,Verdammter schlauer Fuchs!,negative,emotions of rejection,anger
246,GerDracor/weidmann-der-dorfbarbier.xml,11863,11872,für sich.,positive,emotions of joy,emotional movement
247,GerDracor/weidmann-der-dorfbarbier.xml,11873,11896,Verdammter alter Fuchs!,negative,emotions of rejection,anger
248,GerDracor/weidmann-der-dorfbarbier.xml,11897,11906,drängend.,negative,emotional movement,emotional movement
249,GerDracor/weidmann-der-dorfbarbier.xml,11907,11938,"Herr Lux, wir haben keine Zeit.",negative,emotions of rejection,emotional movement
250,GerDracor/weidmann-der-dorfbarbier.xml,11939,11979,"Gleich, gleich, ich bin ja schon bereit.",negative,emotions of joy,joy
251,GerDracor/weidmann-der-dorfbarbier.xml,11980,11989,Für sich.,positive,emotions of suffering,emotional movement
252,GerDracor/weidmann-der-dorfbarbier.xml,11990,12020,"Seht, wie er heimlich spricht.",negative,emotions of rejection,anger
253,GerDracor/weidmann-der-dorfbarbier.xml,12021,12026,Laut.,emotional movement,emotional movement,emotional movement
254,GerDracor/weidmann-der-dorfbarbier.xml,12027,12066,Jetzt find' ich mein Barbierzeug nicht.,negative,emotions of suffering,suffering
255,GerDracor/weidmann-der-dorfbarbier.xml,12067,12083,leise zu Joseph.,negative,emotional movement,suffering
256,GerDracor/weidmann-der-dorfbarbier.xml,12084,12141,"Ich soll Dich künftig meiden, Das soll niemals gescheh'n.",negative,emotions of rejection,anger
257,GerDracor/weidmann-der-dorfbarbier.xml,12142,12153,zu Suschen.,negative,emotional movement,emotional movement
258,GerDracor/weidmann-der-dorfbarbier.xml,12154,12216,"Dein Anblick bringt mir Freuden, Ich kann nicht von Dir geh'n.",positive,emotions of joy,joy
259,GerDracor/weidmann-der-dorfbarbier.xml,12217,12237,"Herr Lux, mein Bart!",negative,emotions of suffering,emotional movement
260,GerDracor/weidmann-der-dorfbarbier.xml,12238,12246,suchend.,emotional movement,emotional movement,emotional movement
261,GerDracor/weidmann-der-dorfbarbier.xml,12247,12259,Mein Messer!,negative,emotions of fear,fear
262,GerDracor/weidmann-der-dorfbarbier.xml,12260,12269,– gleich!,negative,emotional movement,emotional movement
263,GerDracor/weidmann-der-dorfbarbier.xml,12270,12306,Das ist doch ein verdammter Streich!,negative,emotions of rejection,anger
264,GerDracor/weidmann-der-dorfbarbier.xml,12307,12316,drängend.,negative,emotional movement,emotional movement
265,GerDracor/weidmann-der-dorfbarbier.xml,12317,12335,Wir haben Session!,positive,emotions of joy,joy
266,GerDracor/weidmann-der-dorfbarbier.xml,12336,12357,Verfluchte Konfusion!,negative,emotions of fear,emotional movement
267,GerDracor/weidmann-der-dorfbarbier.xml,12358,12384,Potz Narren und kein End'!,negative,emotions of joy,Schadenfreude
268,GerDracor/weidmann-der-dorfbarbier.xml,12385,12415,"Seht, wie der Kopf ihm brennt.",negative,emotional movement,suffering
269,GerDracor/weidmann-der-dorfbarbier.xml,12416,12428,kommt eilig.,emotional movement,emotional movement,emotional movement
270,GerDracor/weidmann-der-dorfbarbier.xml,12429,12448,"Zu Hülfe, zu Hülfe!",negative,emotions of fear,fear
271,GerDracor/weidmann-der-dorfbarbier.xml,12449,12466,"o Jammer, o Noth!",negative,emotions of suffering,compassion
272,GerDracor/weidmann-der-dorfbarbier.xml,12467,12511,Die Bauern zerschlagen und raufen fich todt.,negative,emotions of rejection,suffering
273,GerDracor/weidmann-der-dorfbarbier.xml,12512,12531,in Eile auftretend.,emotional movement,emotional movement,emotional movement
274,GerDracor/weidmann-der-dorfbarbier.xml,12532,12614,"Geschwinde, geschwinde, o sehet doch nach, O laufet, es lieget ein Todter im Bach.",negative,emotions of fear,fear
275,GerDracor/weidmann-der-dorfbarbier.xml,12615,12647,Das Wirthshaus schwimmt im Blut.,negative,emotions of suffering,Schadenfreude
276,GerDracor/weidmann-der-dorfbarbier.xml,12648,12687,"Man rauft, und das war gut, ungeduldig.",negative,emotional movement,joy
277,GerDracor/weidmann-der-dorfbarbier.xml,12688,12713,"Zum Teufel, uns're Bärte!",negative,emotions of rejection,anger
278,GerDracor/weidmann-der-dorfbarbier.xml,12714,12725,außer sich.,negative,emotional movement,emotional movement
279,GerDracor/weidmann-der-dorfbarbier.xml,12726,12748,"O Plage, o Beschwerde!",negative,emotions of suffering,suffering
280,GerDracor/weidmann-der-dorfbarbier.xml,12749,12772,Ich muß barbieret sein.,negative,emotions of rejection,anger
281,GerDracor/weidmann-der-dorfbarbier.xml,12773,12782,verwirrt.,emotional movement,emotional movement,emotional movement
282,GerDracor/weidmann-der-dorfbarbier.xml,12783,12811,Da schlag' der Donner drein!,negative,emotions of fear,emotional movement
283,GerDracor/weidmann-der-dorfbarbier.xml,12812,12856,"Hier soll ich barbieren, dort Todte kuriren.",negative,emotions of suffering,suffering
284,GerDracor/weidmann-der-dorfbarbier.xml,12857,12897,Hier einen seciren und dorten klystiren.,negative,emotions of rejection,anger
285,GerDracor/weidmann-der-dorfbarbier.xml,12898,12922,Ich werde noch ein Narr.,negative,emotions of rejection,"hate, disgust"
