,file,start,end,text,pre1_base_polarity,pre1_main_emotion_class,pre1_tag_type
897,GerDracor/krueger-die-geistlichen-auf-dem-lande.xml,75803,75851,Das ist für solchen gelehrten Mann nicht nöthig.,negative,emotions of rejection,admiration
898,GerDracor/krueger-die-geistlichen-auf-dem-lande.xml,75852,75953,"So verbieten sie es dem Herrn Muffel gleichfalls, sonst – – – Die Schande werde ich mir nicht anthun.",negative,emotions of rejection,anger
899,GerDracor/krueger-die-geistlichen-auf-dem-lande.xml,75954,75998,"Nun, so wollen wir sie beyde alleine lassen.",negative,emotions of suffering,compassion
900,GerDracor/krueger-die-geistlichen-auf-dem-lande.xml,75999,76096,"Ich werde unterdessen für sie beten,
              Herr Tempelstolz; Herr Muffel soll mir helfen.",negative,emotions of affection,compassion
901,GerDracor/krueger-die-geistlichen-auf-dem-lande.xml,76097,76149,"O ja ich will recht eyfrig für ihn beten,  Für sich.",positive,emotions of affection,joy
902,GerDracor/krueger-die-geistlichen-auf-dem-lande.xml,76150,76216,Und du Wilhelmine folge ja den Vermahnungen des Herrn Tempelstolz.,negative,emotions of rejection,anger
903,GerDracor/krueger-die-geistlichen-auf-dem-lande.xml,76217,76225,Geht ab.,negative,emotions of rejection,emotional movement
904,GerDracor/krueger-die-geistlichen-auf-dem-lande.xml,76226,76235,für sich.,positive,emotions of joy,emotional movement
905,GerDracor/krueger-die-geistlichen-auf-dem-lande.xml,76236,76357,"Wenn der verzweifelte Kerl nur nicht solche Streiche mit ihr macht, als ich mit
              Cathrinen in der Betstunde.",negative,emotions of rejection,compassion
906,GerDracor/krueger-die-geistlichen-auf-dem-lande.xml,76358,76366,Geht ab.,negative,emotions of rejection,emotional movement
907,GerDracor/krueger-die-geistlichen-auf-dem-lande.xml,76367,76400,"Tempelstolz, Fräulein Wilhelmine.",positive,emotions of affection,joy
908,GerDracor/krueger-die-geistlichen-auf-dem-lande.xml,76401,76456,"geht auf und nieder spatzieren, als in tiefen Gedanken.",negative,emotional movement,emotional movement
909,GerDracor/krueger-die-geistlichen-auf-dem-lande.xml,76457,76613,"Nun, mein Herr Tempelstolz, sie werden mir viel zu sagen haben, aber sie werden mir
              einen Gefallen thun, wann sie nicht lange damit verziehen.",positive,emotions of rejection,anger
910,GerDracor/krueger-die-geistlichen-auf-dem-lande.xml,76614,76754,"Ich bin sehr begierig,
              entweder von ihnen überwunden zu werden, oder sie in ihren Meynungen schamroth zu
              machen.",negative,emotions of fear,admiration
911,GerDracor/krueger-die-geistlichen-auf-dem-lande.xml,76755,77006,"Nun, weil sie denn noch so verwegen bey ihrem Irrthume seyn, so sollen sie hiermit
              wissen – – – doch ich will mich noch auf die rechte Art bedenken, wie man solche
              Feinde der Kirche, als die Philosophen sind, angreifen muß.",negative,emotions of rejection,anger
912,GerDracor/krueger-die-geistlichen-auf-dem-lande.xml,77008,77081,"Geht auf und
                nieder, und thut, als ob es ihm sauer würde.",negative,emotions of suffering,anger
913,GerDracor/krueger-die-geistlichen-auf-dem-lande.xml,77082,77132,"Oder soll ich den Anfang machen, Herr Tempelstolz?",emotional movement,emotional movement,anger
914,GerDracor/krueger-die-geistlichen-auf-dem-lande.xml,77133,77142,für sich.,positive,emotions of joy,emotional movement
915,GerDracor/krueger-die-geistlichen-auf-dem-lande.xml,77143,77216,Ich will ihr gleich mit Nachdruck und mit der Schärfe ins Gewissen reden.,negative,emotions of rejection,anger
916,GerDracor/krueger-die-geistlichen-auf-dem-lande.xml,77218,77259,"Zu
                Wilhelmine pathetisch.",negative,emotions of affection,suffering
917,GerDracor/krueger-die-geistlichen-auf-dem-lande.xml,77260,77302,Sie haben mich dazu noch nicht überführet.,negative,emotions of rejection,anger
918,GerDracor/krueger-die-geistlichen-auf-dem-lande.xml,77303,77307,Was?,emotional movement,emotional movement,emotional movement
919,GerDracor/krueger-die-geistlichen-auf-dem-lande.xml,77308,77333,sie wollen es nicht thun?,negative,emotions of rejection,anger
920,GerDracor/krueger-die-geistlichen-auf-dem-lande.xml,77334,77386,Auf ihrem Befehle beruht diese wichtige Sache nicht.,negative,emotions of rejection,anger
921,GerDracor/krueger-die-geistlichen-auf-dem-lande.xml,77387,77451,"Nun, so übergebe ich sie dem Satanas, dem Beelzebub, dem Teufel!",negative,emotions of rejection,"hate, disgust"
922,GerDracor/krueger-die-geistlichen-auf-dem-lande.xml,77452,77490,Und nun hat der ganze Proceß ein Ende?,negative,emotions of joy,suffering
923,GerDracor/krueger-die-geistlichen-auf-dem-lande.xml,77491,77494,Ja.,positive,emotions of joy,anger
