,file,start,end,text,pre1_base_polarity,pre1_main_emotion_class,pre1_tag_type
1669,GerDracor/grabbe-kaiser-heinrich-der-sechste.xml,137459,137478,Kanns nicht ändern.,positive,emotions of suffering,suffering
1670,GerDracor/grabbe-kaiser-heinrich-der-sechste.xml,137479,137507,Mir auch schmerzt Der Magen.,negative,emotions of suffering,suffering
1671,GerDracor/grabbe-kaiser-heinrich-der-sechste.xml,137508,137666,"Aber bei dem Himmel und Der Hölle, – eh ich diese Veste, die Der Kaiser mir anvertraut, des Hungers halber Dem Feinde übergebe, zehr Ich diese meine Hand auf!",negative,emotions of affection,admiration
1672,GerDracor/grabbe-kaiser-heinrich-der-sechste.xml,137667,137677,Übergeben!,negative,emotions of suffering,emotional movement
1673,GerDracor/grabbe-kaiser-heinrich-der-sechste.xml,137678,137697,Sag nicht das Wort!,negative,emotions of rejection,anger
1674,GerDracor/grabbe-kaiser-heinrich-der-sechste.xml,137698,137741,– Was ist denn Hunger gegen Gefangenschaft?,negative,emotional movement,emotional movement
1675,GerDracor/grabbe-kaiser-heinrich-der-sechste.xml,137742,137843,"– Und blüht in diesem grauen Und wüsten Baue eine Blume nicht, Die ihn zur lieblichsten Oase wandelt?",positive,emotions of affection,suffering
1676,GerDracor/grabbe-kaiser-heinrich-der-sechste.xml,137844,137869,Du meinst das Kaiserkind!,emotional movement,emotions of joy,emotional movement
1677,GerDracor/grabbe-kaiser-heinrich-der-sechste.xml,137870,137886,Wen anders denn?,emotional movement,emotions of rejection,anger
1678,GerDracor/grabbe-kaiser-heinrich-der-sechste.xml,137887,137971,"Wer sähe wohl sein blaues Auge blinken, Und glaubte nicht vom Himmelstau zu trinken?",negative,emotions of suffering,fear
1679,GerDracor/grabbe-kaiser-heinrich-der-sechste.xml,137972,138008,Fürwahr es ist ein wundersames Kind.,emotional movement,emotions of joy,emotional movement
1680,GerDracor/grabbe-kaiser-heinrich-der-sechste.xml,138009,138147,"Es kann Nicht reden, doch sein Blick spricht schon und  Zeig meinen Leuten es, wenn sie verzagen, Und jubelnd werden sie die Not ertragen!",positive,emotions of joy,joy
1681,GerDracor/grabbe-kaiser-heinrich-der-sechste.xml,138148,138257,"Hauptmann von Schwarzeneck, Albert, Wolfgang und andere Krieger, worunter auch
              Franken, kommen.",negative,emotions of joy,admiration
1682,GerDracor/grabbe-kaiser-heinrich-der-sechste.xml,138258,138303,"Ha, abgelöste Wachen – – Regt der Feind sich?",emotional movement,emotional movement,emotional movement
1683,GerDracor/grabbe-kaiser-heinrich-der-sechste.xml,138304,138408,"Herr, er schreit wie ein mißgeborner Löwe – Der König Tancred ist eben bei ihm
              angekommen.",negative,emotions of joy,emotional movement
1684,GerDracor/grabbe-kaiser-heinrich-der-sechste.xml,138409,138427,Mit vielem Geleit?,positive,emotional movement,joy
1685,GerDracor/grabbe-kaiser-heinrich-der-sechste.xml,138428,138581,"Ich habe unter den normannischen Vorposten Bekannte, die mir manches verraten; sie
              deuteten mir an, er hätte nur zweihundert Mann bei sich.",negative,emotions of rejection,Schadenfreude
1686,GerDracor/grabbe-kaiser-heinrich-der-sechste.xml,138582,138600,Das ist sonderbar.,emotional movement,emotional movement,emotional movement
1687,GerDracor/grabbe-kaiser-heinrich-der-sechste.xml,138601,138652,Werden sie ihm schon ebenso treulos wie dem Kaiser?,positive,emotions of fear,emotional movement
1688,GerDracor/grabbe-kaiser-heinrich-der-sechste.xml,138653,138692,"– – – Sonst
              nichts Neues?",emotional movement,emotional movement,emotional movement
1689,GerDracor/grabbe-kaiser-heinrich-der-sechste.xml,138693,138718,"Ja, die Pest ist auch da.",negative,emotions of rejection,"hate, disgust"
1690,GerDracor/grabbe-kaiser-heinrich-der-sechste.xml,138719,138722,Wo?,emotional movement,emotional movement,emotional movement
1691,GerDracor/grabbe-kaiser-heinrich-der-sechste.xml,138723,138765,Bei dem Ruprecht und noch ein paar andern.,positive,emotions of joy,anger
1692,GerDracor/grabbe-kaiser-heinrich-der-sechste.xml,138766,139146,"Der Arzt zog Handschuh an, als er sie  Ich will ihn lehren, seine Pflicht mit bloßen Händen, und nicht in Handschuhen zu tun
              – Daß für die Kranken gesorgt wird, – das letzte Essen, der letzte Wein unserer Keller
              werde für sie gebraucht – Straf mich Gott, ich wollt, ich hätte die Pest auch – Man bekommt dabei zu verzehren,
              wie ein König.",negative,emotions of rejection,suffering
1693,GerDracor/grabbe-kaiser-heinrich-der-sechste.xml,139147,139212,"Nenn es nicht Pest, es wird eine andere leichtere Krankheit sein.",negative,emotions of suffering,"hate, disgust"
1694,GerDracor/grabbe-kaiser-heinrich-der-sechste.xml,139213,139541,"Bewahre – Pest ists nicht – es ist nur ein kleines Leiden, welches das Gesicht
              bräunt, die Augen heraustreibt, den Hals zusammenschnürt wie nichts Gutes, und jeden
              ansteckt, der dem Kranken nahe kommt – Kurz, es ist eine tötende Schwäche, – wie sie
                 Werde mir nicht zu beißig, Konrad.",negative,emotions of suffering,suffering
1695,GerDracor/grabbe-kaiser-heinrich-der-sechste.xml,139542,139677,"Das mußt du mir nicht verdenken, Feldherr – Hunger macht beißig – Brot hab ich nicht
              mehr, – so muß ich an Worten beißen.",negative,emotions of rejection,suffering
1696,GerDracor/grabbe-kaiser-heinrich-der-sechste.xml,139678,139794,"Der Kaiser hat euch Jahre lang ernährt und besoldet, dafür lernt auch ein paar Monate
              für ihn hungern.",negative,emotions of rejection,admiration
1697,GerDracor/grabbe-kaiser-heinrich-der-sechste.xml,139795,139863,"Bei Gott, es ist schwerer für ihn zu hungern als für ihn zu sterben.",negative,emotions of suffering,suffering
1698,GerDracor/grabbe-kaiser-heinrich-der-sechste.xml,139864,140023,"Ja, Herr, das Sterben ist bald vorüber, aber der Hunger ist wie ein lebendiges Tier,
              Tag und Nacht, beim Wachen und beim Traum munter und nagend.",negative,emotions of suffering,suffering
1699,GerDracor/grabbe-kaiser-heinrich-der-sechste.xml,140024,140059,"Ihr seht, ich leide Mangel wie ihr.",negative,emotions of suffering,suffering
1700,GerDracor/grabbe-kaiser-heinrich-der-sechste.xml,140060,140114,"Das zeigt die Größe unserer Not, hilft uns aber nicht.",negative,emotions of suffering,suffering
1701,GerDracor/grabbe-kaiser-heinrich-der-sechste.xml,140115,140293,"Nun, redet, tadelt, wie ihr immer wollt, Doch  Geht ab, Achmet bleibt mit verschränkten Armen stehen und hört, bisweilen darüber
              lächelnd, das folgende Gespräch an.",positive,emotions of joy,joy
1702,GerDracor/grabbe-kaiser-heinrich-der-sechste.xml,140294,140334,"Hauptmann, du fluchst ja gar nicht mehr.",negative,emotions of rejection,anger
1703,GerDracor/grabbe-kaiser-heinrich-der-sechste.xml,140335,140375,"Donnerwetter, ich halte den Atem an mir.",positive,emotional movement,emotional movement
1704,GerDracor/grabbe-kaiser-heinrich-der-sechste.xml,140376,140436,"Er hilft immer doch etwas den Magen zu
              füllen.",positive,emotions of joy,anger
1705,GerDracor/grabbe-kaiser-heinrich-der-sechste.xml,140437,140534,"Das war eine andere Zeit, Herr Hauptmann, als wir am Vesuve noch die Tränen
              hatten.",negative,emotions of suffering,suffering
1706,GerDracor/grabbe-kaiser-heinrich-der-sechste.xml,140535,140557,"Hast keine mehr, Kerl?",negative,emotions of rejection,anger
1707,GerDracor/grabbe-kaiser-heinrich-der-sechste.xml,140558,140635,"Fort das letzte Tröpfchen, alles trocken – Element, auch nicht einmal Tränen!",negative,emotions of suffering,compassion
