,file,start,end,text,pre1_base_polarity,pre1_main_emotion_class,pre1_tag_type
798,GerDracor/lessing-miss-sara-sampson.xml,56180,56212,"wie schnell sind Sie, Mellefont!",negative,emotions of joy,emotional movement
799,GerDracor/lessing-miss-sara-sampson.xml,56213,56332,"Ich werde die Lady erwarten; und mich der
              Ehre ihres Besuchs, so viel möglich, würdig zu erzeigen suchen.",positive,emotions of affection,admiration
800,GerDracor/lessing-miss-sara-sampson.xml,56333,56366,"Sind Sie
              zufrieden?",positive,emotions of joy,joy
801,GerDracor/lessing-miss-sara-sampson.xml,56367,56417,"Ach, Miß, lassen Sie mich meinen Ehrgeiz gestehen.",negative,emotions of suffering,suffering
802,GerDracor/lessing-miss-sara-sampson.xml,56418,56487,"Ich möchte gern gegen die ganze
              Welt mit Ihnen prahlen.",positive,emotions of joy,admiration
803,GerDracor/lessing-miss-sara-sampson.xml,56488,56669,"Und wenn ich auf den Besitz einer solchen Person nicht eitel
              wäre, so würde ich mir selbst vorwerfen, daß ich den Wert derselben nicht zu schätzen
              wüßte.",positive,emotions of affection,"hate, disgust"
804,GerDracor/lessing-miss-sara-sampson.xml,56670,56718,"Ich gehe, und bringe die Lady sogleich zu Ihnen.",positive,emotions of rejection,fear
805,GerDracor/lessing-miss-sara-sampson.xml,56720,56729,Gehet ab.,negative,emotions of rejection,despair
806,GerDracor/lessing-miss-sara-sampson.xml,56730,56737,allein.,negative,emotions of suffering,suffering
807,GerDracor/lessing-miss-sara-sampson.xml,56738,56874,"Wenn es nur keine von den stolzen Weibern ist, die voll von ihrer Tugend, über alle
              Schwachheiten erhaben zu sein glauben.",positive,emotions of rejection,"hate, disgust"
808,GerDracor/lessing-miss-sara-sampson.xml,56875,57065,"Sie machen uns mit einem einzigen verächtlichen
              Blicke den Prozeß, und ein zweideutiges Achselzucken ist das ganze Mitleiden, das wir
              ihnen zu verdienen scheinen.",negative,emotions of suffering,compassion
809,GerDracor/lessing-miss-sara-sampson.xml,57066,57075,Waitwell.,emotional movement,emotional movement,emotional movement
810,GerDracor/lessing-miss-sara-sampson.xml,57076,57081,Sara.,emotional movement,emotional movement,emotional movement
811,GerDracor/lessing-miss-sara-sampson.xml,57082,57101,zwischen der Szene.,emotional movement,emotional movement,emotional movement
812,GerDracor/lessing-miss-sara-sampson.xml,57102,57155,"Nur hier herein, wenn Er selbst mit ihr sprechen muß.",negative,emotions of rejection,compassion
813,GerDracor/lessing-miss-sara-sampson.xml,57156,57173,die sich umsieht.,emotional movement,emotional movement,emotional movement
814,GerDracor/lessing-miss-sara-sampson.xml,57174,57206,Wer muß selbst mit mir sprechen?,negative,emotions of rejection,anger
815,GerDracor/lessing-miss-sara-sampson.xml,57207,57222,– Wen seh' ich?,emotional movement,emotional movement,emotional movement
816,GerDracor/lessing-miss-sara-sampson.xml,57223,57238,Ist es möglich?,emotional movement,emotions of fear,emotional movement
817,GerDracor/lessing-miss-sara-sampson.xml,57239,57254,"Waitwell, dich?",negative,emotional movement,emotional movement
818,GerDracor/lessing-miss-sara-sampson.xml,57255,57351,"Was für ein glücklicher Mann bin ich, daß ich endlich unsere Miß Sara wieder
              sehe!",positive,emotions of joy,joy
819,GerDracor/lessing-miss-sara-sampson.xml,57352,57357,Gott!,negative,emotions of fear,fear
820,GerDracor/lessing-miss-sara-sampson.xml,57358,57373,was bringst du?,negative,emotions of rejection,anger
821,GerDracor/lessing-miss-sara-sampson.xml,57374,57482,"Ich hör' es schon, ich hör' es schon, du bringst mir die
              Nachricht von dem Tode meines Vaters!",negative,emotions of fear,suffering
822,GerDracor/lessing-miss-sara-sampson.xml,57483,57551,"Er ist hin, der vortrefflichste Mann, der beste
              Vater!",negative,emotions of affection,suffering
823,GerDracor/lessing-miss-sara-sampson.xml,57552,57626,"Er ist hin, und ich, ich bin die Elende, die seinen Tod beschleuniget hat.",negative,emotions of suffering,suffering
824,GerDracor/lessing-miss-sara-sampson.xml,57627,57631,Ach!,negative,emotions of suffering,suffering
825,GerDracor/lessing-miss-sara-sampson.xml,57632,58054,"Miß – – Sage mir, geschwind sage mir, daß die letzten Augenblicke seines Lebens ihm durch
              mein Andenken nicht schwerer wurden; daß er mich vergessen hatte; daß er eben so ruhig
              starb als er sich sonst in meinen Armen zu sterben versprach; daß er sich meiner auch
              nicht einmal in seinem letzten Gebete erinnerte – – Hören Sie doch auf, sich mit so falschen Vorstellungen zu plagen!",negative,emotions of suffering,suffering
826,GerDracor/lessing-miss-sara-sampson.xml,58055,58144,"Er lebt ja noch,
              Ihr Vater; er lebt ja noch, der rechtschaffne Sir William.",positive,emotions of joy,joy
827,GerDracor/lessing-miss-sara-sampson.xml,58145,58158,Lebt er noch?,negative,emotions of fear,emotional movement
828,GerDracor/lessing-miss-sara-sampson.xml,58159,58185,"Ist es wahr, lebt er noch?",emotional movement,emotional movement,emotional movement
829,GerDracor/lessing-miss-sara-sampson.xml,58186,58188,O!,emotional movement,emotions of suffering,emotional movement
830,GerDracor/lessing-miss-sara-sampson.xml,58189,58253,"daß er noch lange leben, und glücklich
              leben möge!",positive,emotions of joy,joy
831,GerDracor/lessing-miss-sara-sampson.xml,58254,58256,O!,emotional movement,emotions of suffering,emotional movement
832,GerDracor/lessing-miss-sara-sampson.xml,58257,58308,daß ihm Gott die Hälfte meiner Jahre zulegen wolle!,positive,emotions of affection,love
833,GerDracor/lessing-miss-sara-sampson.xml,58309,58320,Die Hälfte?,emotional movement,emotional movement,emotional movement
834,GerDracor/lessing-miss-sara-sampson.xml,58321,58481,"– Ich
              Undankbare, wenn ich ihm nicht mit allen, so viel mir deren bestimmt sind, auch nur
              einige Augenblicke zu erkaufen bereit bin!",negative,emotions of rejection,"hate, disgust"
835,GerDracor/lessing-miss-sara-sampson.xml,58482,58814,"Aber nun sage mir wenigstens, Waitwell, daß
              es ihm nicht hart fällt, ohne mich zu leben; daß es ihm leicht geworden ist, eine
              Tochter aufzugeben, die ihre Tugend so leicht aufgeben können; daß ihn meine Flucht
              erzürnet, aber nicht gekränkt hat, daß er mich verwünschet, aber nicht betauert.",negative,emotions of suffering,anger
836,GerDracor/lessing-miss-sara-sampson.xml,58815,58967,"Ach, Sir William ist noch immer der zärtliche Vater, so wie sein Sarchen noch immer
              die zärtliche Tochter ist, die sie beide gewesen sind.",positive,emotions of affection,love
837,GerDracor/lessing-miss-sara-sampson.xml,58968,58981,Was sagst du?,emotional movement,emotional movement,emotional movement
838,GerDracor/lessing-miss-sara-sampson.xml,58982,59130,"Du bist ein Bote des Unglücks, des schrecklichsten Unglücks unter
              allen, die mir meine feindselige Einbildung jemals vorgestellet hat!",negative,emotions of suffering,suffering
839,GerDracor/lessing-miss-sara-sampson.xml,59131,59177,"Er ist noch der
              zärtliche Vater?",emotional movement,emotions of affection,love
840,GerDracor/lessing-miss-sara-sampson.xml,59178,59203,So liebt er mich ja noch?,positive,emotions of affection,love
841,GerDracor/lessing-miss-sara-sampson.xml,59204,59231,So muß er mich ja beklagen?,negative,emotions of suffering,suffering
842,GerDracor/lessing-miss-sara-sampson.xml,59232,59298,"Nein, nein, das
              tut er nicht; das kann er nicht tun!",negative,emotions of rejection,anger
843,GerDracor/lessing-miss-sara-sampson.xml,59299,59422,"Siehst du denn nicht, wie unendlich jeder
              Seufzer, den er um mich verlöre, meine Verbrechen vergrößern würde?",negative,emotions of suffering,suffering
844,GerDracor/lessing-miss-sara-sampson.xml,59423,59627,"Müßte mir nicht
              die Gerechtigkeit des Himmels jede seiner Tränen, die ich ihm auspreßte, so anrechnen,
              als ob ich bei jeder derselben mein Laster und meinen Undank wiederholte?",negative,emotions of suffering,compassion
845,GerDracor/lessing-miss-sara-sampson.xml,59628,59676,"Ich erstarre
              über diesen Gedanken.",negative,emotions of suffering,emotional movement
846,GerDracor/lessing-miss-sara-sampson.xml,59677,59698,Tränen koste ich ihm?,negative,emotions of suffering,suffering
847,GerDracor/lessing-miss-sara-sampson.xml,59699,59706,Tränen?,emotional movement,emotions of suffering,suffering
848,GerDracor/lessing-miss-sara-sampson.xml,59707,59769,"Und es sind andre Tränen, als
              Tränen der Freude?",positive,emotions of joy,suffering
849,GerDracor/lessing-miss-sara-sampson.xml,59770,59803,"– Widersprich mir doch, Waitwell!",negative,emotions of rejection,anger
850,GerDracor/lessing-miss-sara-sampson.xml,59804,59948,"Aufs höchste hat er einige
              leichte Regungen des Bluts für mich gefühlet; einige von den geschwind  indem er sich die Augen wischt.",positive,emotions of suffering,suffering
851,GerDracor/lessing-miss-sara-sampson.xml,59949,59995,"Nein, Miß, dazu hat er es nicht kommen lassen.",negative,emotions of suffering,suffering
852,GerDracor/lessing-miss-sara-sampson.xml,59996,60000,Ach!,negative,emotions of suffering,suffering
853,GerDracor/lessing-miss-sara-sampson.xml,60001,60055,dein Mund sagt nein; und deine eignen Tränen sagen ja.,positive,emotions of affection,suffering
854,GerDracor/lessing-miss-sara-sampson.xml,60056,60108,"Nehmen Sie diesen Brief, Miß; er ist von ihm selbst.",negative,emotions of affection,suffering
855,GerDracor/lessing-miss-sara-sampson.xml,60109,60117,Von wem?,emotional movement,emotional movement,emotional movement
856,GerDracor/lessing-miss-sara-sampson.xml,60118,60135,von meinem Vater?,emotional movement,emotional movement,emotional movement
857,GerDracor/lessing-miss-sara-sampson.xml,60136,60144,an mich?,emotional movement,emotional movement,emotional movement
858,GerDracor/lessing-miss-sara-sampson.xml,60145,60230,"Ja, nehmen Sie ihn nur; Sie werden mehr daraus sehen können, als ich zu sagen vermag.",positive,emotions of affection,love
859,GerDracor/lessing-miss-sara-sampson.xml,60245,60311,"Er hätte einem andern, als mir, dieses Geschäfte auftragen sollen.",negative,emotions of rejection,anger
860,GerDracor/lessing-miss-sara-sampson.xml,60312,60408,"Ich versprach mir
              Freude davon; aber Sie verwandeln mir diese Freude in Betrübnis.",negative,emotions of suffering,suffering
861,GerDracor/lessing-miss-sara-sampson.xml,60409,60437,"Gib nur, ehrlicher Waitwell!",negative,emotions of rejection,compassion
862,GerDracor/lessing-miss-sara-sampson.xml,60438,60552,"– Doch nein, ich will ihn nicht eher nehmen, als bis du
              mir sagst, was ungefähr darin enthalten ist.",positive,emotions of rejection,anger
863,GerDracor/lessing-miss-sara-sampson.xml,60553,60583,Was kann darin enthalten sein?,emotional movement,emotional movement,emotional movement
864,GerDracor/lessing-miss-sara-sampson.xml,60584,60604,Liebe und Vergebung.,positive,emotions of affection,love
865,GerDracor/lessing-miss-sara-sampson.xml,60605,60611,Liebe?,positive,emotions of affection,love
866,GerDracor/lessing-miss-sara-sampson.xml,60612,60622,Vergebung?,emotional movement,emotional movement,emotional movement
867,GerDracor/lessing-miss-sara-sampson.xml,60623,60822,"Und vielleicht ein aufrichtiges Betauern, daß er die Rechte der väterlichen Gewalt
              gegen ein Kind brauchen wollen, für welches nur die Vorrechte der väterlichen Huld
              sind.",negative,emotions of suffering,suffering
868,GerDracor/lessing-miss-sara-sampson.xml,60823,60861,So behalte nur deinen grausamen Brief!,negative,emotions of rejection,"hate, disgust"
869,GerDracor/lessing-miss-sara-sampson.xml,60862,60872,Grausamen?,negative,emotions of suffering,suffering
870,GerDracor/lessing-miss-sara-sampson.xml,60873,60966,"fürchten Sie nichts; Sie erhalten völlige Freiheit über Ihr Herz und Ihre
              Hand.",positive,emotions of fear,love
871,GerDracor/lessing-miss-sara-sampson.xml,60967,61004,"Und das ist es eben, was ich fürchte.",negative,emotions of fear,fear
872,GerDracor/lessing-miss-sara-sampson.xml,61005,61088,"Einen Vater, wie ihn, zu betrüben: dazu habe
              ich noch den Mut gehabt.",negative,emotions of suffering,suffering
873,GerDracor/lessing-miss-sara-sampson.xml,61089,61350,"Allein ihn durch eben diese Betrübnis, ihn durch seine Liebe,
              der ich entsagt, dahin gebracht zu sehen, daß er sich alles gefallen läßt, wozu mich
              eine unglückliche Leidenschaft verleitet: das Waitwell, das würde ich nicht ausstehen.",negative,emotions of suffering,suffering
874,GerDracor/lessing-miss-sara-sampson.xml,61365,61589,"Wenn sein Brief alles enthielte, was ein aufgebrachter Vater, in solchem Falle
              Heftiges und Hartes vorbringen kann, so würde ich ihn zwar mit Schaudern lesen, aber
              ich würde ihn doch lesen können.",negative,emotions of rejection,anger
875,GerDracor/lessing-miss-sara-sampson.xml,61590,61702,"Ich würde gegen seinen Zorn noch einen Schatten von
              Verteidigung aufzubringen wissen, um ihn  Ach!",negative,emotions of rejection,anger
876,GerDracor/lessing-miss-sara-sampson.xml,61703,61854,"Miß, Sie werden sich diesen Vorwurf noch weniger machen dürfen, wenn Sie jetzt
              seine Liebe wieder ergreifen, die ja alles vergessen will.",positive,emotions of affection,love
877,GerDracor/lessing-miss-sara-sampson.xml,61855,61879,"Du irrst dich, Waitwell.",emotional movement,emotions of joy,emotional movement
878,GerDracor/lessing-miss-sara-sampson.xml,61880,61976,"Sein sehnliches Verlangen nach mir, verführt ihn vielleicht,
              zu allem ja zu sagen.",negative,emotions of affection,love
879,GerDracor/lessing-miss-sara-sampson.xml,61977,62115,"Kaum aber würde dieses Verlangen ein wenig beruhiget sein, so
              würde er sich, seiner Schwäche wegen, vor sich selbst schämen.",negative,emotions of rejection,"hate, disgust"
880,GerDracor/lessing-miss-sara-sampson.xml,62116,62317,"Ein finsterer Unwille
              würde sich seiner bemeistern, und er würde mich nie ansehen können, ohne mich heimlich
              anzuklagen, wie viel ich ihm abzutrotzen mich unterstanden habe.",negative,emotions of rejection,anger
881,GerDracor/lessing-miss-sara-sampson.xml,62318,62606,"Ja, wenn es in meinem
              Vermögen stünde, ihm bei der äußersten Gewalt, die er sich meinetwegen antut, das
              Bitterste zu ersparen; wenn in dem Augenblicke, da er mir alles erlauben wollte, ich
              ihm alles aufopfern könnte: so wäre es ganz etwas anders.",negative,emotions of suffering,suffering
882,GerDracor/lessing-miss-sara-sampson.xml,62607,62856,"Ich wollte den Brief mit
              Vergnügen von deinen Händen nehmen, die Stärke der väterlichen Liebe darin bewundern,
              und ohne sie zu mißbrauchen, mich als eine reuende und gehorsame Tochter zu seinen
              Füßen werfen.",positive,emotions of joy,joy
883,GerDracor/lessing-miss-sara-sampson.xml,62857,62875,Aber kann ich das?,emotional movement,emotions of fear,fear
884,GerDracor/lessing-miss-sara-sampson.xml,62876,63009,"Ich würde es tun müssen, was er mir erlaubte, ohne
              mich daran zu kehren, wie teuer ihm diese Erlaubnis zu stehen komme.",negative,emotions of rejection,anger
885,GerDracor/lessing-miss-sara-sampson.xml,63010,63411,"Und wenn ich dann
              am vergnügtesten darüber sein wollte, würde es mir plötzlich einfallen, daß er mein
              Vergnügen äußerlich nur zu teilen scheine, und in sich selbst vielleicht seufze; kurz,
              daß er mich mit Entsagung seiner eignen Glückseligkeit glücklich gemacht habe – Und es
              auf diese Art zu sein wünschen, trauest du mir das wohl zu, Waitwell?",positive,emotions of suffering,joy
886,GerDracor/lessing-miss-sara-sampson.xml,63412,63465,"Gewiß ich weiß nicht, was ich hierauf antworten soll.",emotional movement,emotional movement,emotional movement
887,GerDracor/lessing-miss-sara-sampson.xml,63466,63500,Es ist nichts darauf zu antworten.,negative,emotional movement,emotional movement
888,GerDracor/lessing-miss-sara-sampson.xml,63501,63544,Bringe deinen Brief also nur wieder zurück.,negative,emotions of rejection,anger
889,GerDracor/lessing-miss-sara-sampson.xml,63545,63666,"Wenn
              mein Vater durch mich unglücklich sein muß; so will ich selbst auch unglücklich
              bleiben.",negative,emotions of suffering,suffering
890,GerDracor/lessing-miss-sara-sampson.xml,63667,63878,"Ganz allein ohne ihn unglücklich zu sein, das ist es, was ich jetzt stündlich
              von dem Himmel bitte; glücklich aber ohne ihn ganz allein zu sein, davon will ich
              durchaus nichts wissen.",negative,emotions of suffering,suffering
891,GerDracor/lessing-miss-sara-sampson.xml,63879,63895,etwas bei Seite.,emotional movement,emotional movement,emotional movement
892,GerDracor/lessing-miss-sara-sampson.xml,63896,64012,"Ich glaube wahrhaftig, ich werde das gute Kind hintergehen müssen, damit es den Brief
              doch nur lieset.",negative,emotions of rejection,suffering
893,GerDracor/lessing-miss-sara-sampson.xml,64013,64041,Was sprichst du da für dich?,emotional movement,emotions of rejection,emotional movement
894,GerDracor/lessing-miss-sara-sampson.xml,64042,64195,"Ich sage mir selbst, daß ich einen sehr ungeschickten Einfall gehabt hätte, Sie, Miß,
              zur Lesung des Briefes desto geschwinder zu vermögen.",negative,emotions of rejection,anger
895,GerDracor/lessing-miss-sara-sampson.xml,64196,64203,Wie so?,emotional movement,emotional movement,emotional movement
896,GerDracor/lessing-miss-sara-sampson.xml,64204,64236,Ich konnte so weit nicht denken.,emotional movement,emotional movement,emotional movement
897,GerDracor/lessing-miss-sara-sampson.xml,64237,64313,"Sie überlegen freilich alles genauer, als es unser
              einer kann.",emotional movement,emotional movement,anger
898,GerDracor/lessing-miss-sara-sampson.xml,64314,64599,"Ich wollte Sie nicht erschrecken; der Brief ist vielleicht nur allzu hart;
              und wenn ich gesagt habe, daß nichts als Liebe und Vergebung darin enthalten sei, so
              hätte ich sagen sollen, daß ich nichts als dieses darin enthalten zu sein
              wünschte.",negative,emotions of affection,emotional movement
899,GerDracor/lessing-miss-sara-sampson.xml,64600,64613,Ist das wahr?,negative,emotions of fear,emotional movement
900,GerDracor/lessing-miss-sara-sampson.xml,64614,64639,– Nun so gib mir ihn her.,negative,emotions of rejection,despair
901,GerDracor/lessing-miss-sara-sampson.xml,64640,64659,Ich will ihn lesen.,positive,emotions of joy,joy
902,GerDracor/lessing-miss-sara-sampson.xml,64660,64898,"Wenn man den Zorn eines
              Vaters unglücklicher Weise verdient hat, so muß man wenigstens gegen diesen
              väterlichen Zorn so viel Achtung haben, daß er ihn nach allen Gefallen gegen uns
              auslassen kann.",negative,emotions of rejection,anger
903,GerDracor/lessing-miss-sara-sampson.xml,64899,64985,"Ihn zu vereiteln suchen, heißt Beleidigungen mit Geringschätzung
              häufen.",negative,emotions of rejection,"hate, disgust"
904,GerDracor/lessing-miss-sara-sampson.xml,64986,65035,Ich werde ihn nach aller seiner Stärke empfinden.,negative,emotions of affection,love
905,GerDracor/lessing-miss-sara-sampson.xml,65036,65148,"Du siehst, ich zittre schon
              – Aber ich soll auch zittern; und ich will lieber zittern, als weinen.",negative,emotions of suffering,fear
906,GerDracor/lessing-miss-sara-sampson.xml,65149,65191,"–  Sie
                erbricht den Brief.",negative,emotional movement,suffering
907,GerDracor/lessing-miss-sara-sampson.xml,65192,65203,Sie lieset.,negative,emotions of rejection,suffering
908,GerDracor/lessing-miss-sara-sampson.xml,65204,65253,"Ach, Miß, verzeihen Sie doch einem alten Knechte.",negative,emotions of suffering,compassion
909,GerDracor/lessing-miss-sara-sampson.xml,65254,65360,"Ja gewiß, ich glaube es ist in
              meinem Leben das erstemal, daß ich mit Vorsatz betrogen habe.",negative,emotions of suffering,suffering
910,GerDracor/lessing-miss-sara-sampson.xml,65361,65502,"Wer einmal betriegt,
              Miß, und aus einer so guten Absicht betriegt, der ist ja deswegen noch kein alter
              Betrieger.",positive,emotions of affection,love
911,GerDracor/lessing-miss-sara-sampson.xml,65503,65526,"Das geht mir nahe, Miß.",negative,emotions of suffering,compassion
912,GerDracor/lessing-miss-sara-sampson.xml,65527,65613,"Ich weiß wohl, die gute Absicht entschuldigt nicht
              immer; aber was  Wie?",emotional movement,emotional movement,emotional movement
913,GerDracor/lessing-miss-sara-sampson.xml,65614,65643,auch du willst ihn verlassen?,negative,emotions of suffering,emotional movement
914,GerDracor/lessing-miss-sara-sampson.xml,65644,65704,"Werde ich denn nicht müssen, wenn Sie den Brief nicht lesen?",negative,emotions of suffering,anger
915,GerDracor/lessing-miss-sara-sampson.xml,65705,65744,"Lesen Sie ihn doch
              immer.",positive,emotions of joy,joy
916,GerDracor/lessing-miss-sara-sampson.xml,65745,65876,"Lassen Sie doch immer den ersten vorsätzlichen Betrug, den ich mir vorzuwerfen
              habe, nicht ohne gute Wirkung bleiben.",negative,emotions of rejection,anger
917,GerDracor/lessing-miss-sara-sampson.xml,65877,65977,"Sie werden ihn desto eher vergessen, und ich
              werde mir ihn desto eher vergeben können.",negative,emotions of suffering,suffering
918,GerDracor/lessing-miss-sara-sampson.xml,65978,66153,"Ich bin ein gemeiner einfältiger Mann, der
              Ihnen Ihre Ursachen, warum Sie den Brief nicht lesen können, oder wollen, freilich so
              muß gelten lassen.",negative,emotions of rejection,anger
919,GerDracor/lessing-miss-sara-sampson.xml,66154,66260,"Ob sie wahr sind, weiß ich nicht; aber so recht natürlich scheinen
              sie mir wenigstens nicht.",emotional movement,emotional movement,emotional movement
920,GerDracor/lessing-miss-sara-sampson.xml,66261,66439,"Ich dächte nun so, Miß: ein Vater, dächte ich, ist doch
              immer ein Vater; und ein Kind kann wohl einmal fehlen, es bleibt deswegen doch ein
              gutes Kind.",positive,emotions of affection,love
921,GerDracor/lessing-miss-sara-sampson.xml,66440,66586,"Wenn der Vater den Fehler verzeiht, so kann ja das Kind sich wohl wieder
              so aufführen, daß er auch gar nicht mehr daran denken darf.",negative,emotions of rejection,anger
922,GerDracor/lessing-miss-sara-sampson.xml,66587,66696,"Und wer erinnert sich denn
              gern an etwas, wovon er lieber wünscht, es wäre gar nicht geschehen?",negative,emotions of suffering,suffering
923,GerDracor/lessing-miss-sara-sampson.xml,66697,66939,"Es ist, Miß, als
              ob Sie nur immer an Ihren Fehler dächten, und glaubten, es wäre genug, wenn Sie den in
              Ihrer Einbildung vergrößerten, und sich selbst mit solchen vergrößerten Vorstellungen
              marterten.",negative,emotions of suffering,suffering
924,GerDracor/lessing-miss-sara-sampson.xml,66940,67059,"Aber ich sollte meinen, Sie müßten auch daran denken, wie Sie das, was
              geschehen ist, wieder gut machten.",negative,emotions of suffering,compassion
925,GerDracor/lessing-miss-sara-sampson.xml,67060,67172,"Und wie wollen Sie es denn wieder gut machen, wenn
              Sie sich selbst alle Gelegenheit dazu benehmen?",negative,emotions of rejection,compassion
926,GerDracor/lessing-miss-sara-sampson.xml,67173,67299,"Kann es Ihnen denn sauer werden, den
              andern Schritt zu tun, wenn so ein lieber Vater schon den ersten getan hat?",emotional movement,emotions of affection,compassion
927,GerDracor/lessing-miss-sara-sampson.xml,67300,67366,Was für Schwerter gehen aus deinem einfältigen Munde in mein Herz!,negative,emotions of rejection,"hate, disgust"
928,GerDracor/lessing-miss-sara-sampson.xml,67367,67452,"– Eben das kann
              ich nicht aushalten, daß er den ersten Schritt tun muß.",negative,emotions of suffering,suffering
929,GerDracor/lessing-miss-sara-sampson.xml,67453,67476,Und was willst du denn?,emotional movement,emotions of rejection,emotional movement
930,GerDracor/lessing-miss-sara-sampson.xml,67477,67526,"Tut er
              denn nur den ersten Schritt?",emotional movement,emotions of fear,emotional movement
931,GerDracor/lessing-miss-sara-sampson.xml,67527,67581,Er muß sie alle tun: ich kann ihm keinen entgegen tun.,negative,emotions of affection,anger
932,GerDracor/lessing-miss-sara-sampson.xml,67582,67671,"So
              weit ich mich von ihm entfernet, so weit muß er sich zu mir herablassen.",negative,emotions of affection,love
933,GerDracor/lessing-miss-sara-sampson.xml,67672,67892,"Wenn er mir
              vergibt, so muß er mein ganzes Verbrechen vergeben, und sich noch dazu gefallen
              lassen, die Folgen desselben vor seinen Augen  Ich weiß nicht, Miß, ob ich dieses so recht verstehe.",negative,emotional movement,suffering
934,GerDracor/lessing-miss-sara-sampson.xml,67893,68115,"Aber mich deucht, Sie wollen
              sagen, er müsse Ihnen gar zu viel vergeben, und weil ihm das nicht anders, als sehr
              sauer werden könne, so machten Sie sich ein Gewissen, seine Vergebung anzunehmen.",negative,emotions of rejection,suffering
