,file,start,end,text,pre1_base_polarity,pre1_main_emotion_class,pre1_tag_type
811,GerDracor/goethe-egmont.xml,50072,50247,"Daß ich
              fröhlich bin, die Sachen leicht nehme, rasch lebe, das ist mein Glück; und ich
              vertausch es nicht gegen die Sicherheit eines Totengewölbes.",positive,emotions of joy,joy
812,GerDracor/goethe-egmont.xml,50248,50434,"Ich habe nun zu der
              spanischen Lebensart nicht einen Blutstropfen in meinen Adern, nicht Lust, meine
              Schritte nach der neuen bedächtigen Hofkadenz zu mustern.",negative,emotional movement,anger
813,GerDracor/goethe-egmont.xml,50435,50486,"Leb ich nur, um aufs Leben
              zu denken?",negative,emotions of suffering,love
814,GerDracor/goethe-egmont.xml,50487,50589,"Soll ich den gegenwärtigen Augenblick nicht genießen, damit ich des
              folgenden gewiß sei?",positive,emotions of joy,joy
815,GerDracor/goethe-egmont.xml,50590,50641,Und diesen wieder mit Sorgen und Grillen verzehren?,negative,emotions of suffering,fear
816,GerDracor/goethe-egmont.xml,50642,50714,"Ich bitt Euch, Herr; seid nicht so harsch und rauh gegen den guten Mann!",negative,emotions of rejection,anger
817,GerDracor/goethe-egmont.xml,50715,50769,"Ihr seid ja
              sonst gegen alle freundlich.",positive,emotions of affection,friendship
818,GerDracor/goethe-egmont.xml,50770,50842,"Sagt mir ein gefällig Wort, das den edeln Freund
              beruhige.",emotional movement,emotions of affection,suffering
819,GerDracor/goethe-egmont.xml,50843,50897,"Seht, wie sorgfältig er ist, wie leis er Euch berührt!",positive,emotions of affection,admiration
820,GerDracor/goethe-egmont.xml,50898,50936,Und doch berührt er immer diese Saite.,negative,emotions of affection,suffering
821,GerDracor/goethe-egmont.xml,50937,51054,"Er weiß von alters her, wie verhaßt mir diese
              Ermahnungen sind; sie machen nur irre, sie helfen nichts.",negative,emotions of rejection,"hate, disgust"
822,GerDracor/goethe-egmont.xml,51055,51268,"Und wenn ich ein
              Nachtwandler wäre, und auf dem gefährlichen Gipfel eines Hauses spazierte, ist es
              freundschaftlich, mich beim Namen zu rufen und mich zu warnen, zu wecken und zu töten?",negative,emotional movement,friendship
823,GerDracor/goethe-egmont.xml,51283,51333,Laßt jeden seines Pfades gehn; er mag sich wahren.,positive,emotions of joy,admiration
824,GerDracor/goethe-egmont.xml,51334,51418,"Es ziemt Euch, nicht zu sorgen, aber wer Euch kennt und liebt – in den Brief sehend.",positive,emotions of affection,love
825,GerDracor/goethe-egmont.xml,51419,51684,"Da bringt er wieder die alten Märchen auf, was wir an einem Abend in leichtem Übermut
              der Geselligkeit und des Weins getrieben und gesprochen; und was man daraus für Folgen
              und Beweise durchs ganze Königreich gezogen und geschleppt habe.",negative,emotions of rejection,anger
826,GerDracor/goethe-egmont.xml,51685,51969,"– Nun gut, wir haben
              Schellenkappen, Narrenkutten auf unsrer Diener Ärmel sticken lassen, und haben diese
              tolle Zierde nachher in ein Bündel Pfeile verwandelt; ein noch gefährlicher Symbol für
              alle, die deuten wollen, wo nichts zu deuten ist.",negative,emotions of rejection,"hate, disgust"
827,GerDracor/goethe-egmont.xml,51970,52298,"Wir haben die und jene Torheit in
              einem lustigen Augenblick empfangen gleich und geboren; sind schuld, daß eine ganze
              edle Schar mit Bettelsäcken und mit einem selbstgewählten Unnamen dem Könige seine
              Pflicht mit spottender Demut ins Gedächtnis rief; sind schuld – was ist's nun weiter?",negative,emotions of rejection,anger
828,GerDracor/goethe-egmont.xml,52313,52354,Ist ein Faßnachtsspiel gleich Hochverrat?,negative,emotional movement,emotional movement
829,GerDracor/goethe-egmont.xml,52355,52524,"Sind uns die kurzen bunten Lumpen zu
              mißgönnen, die ein jugendlicher Mut, eine angefrischte Phantasie um unsers Lebens arme
              Blöße hängen mag?",negative,emotions of suffering,suffering
830,GerDracor/goethe-egmont.xml,52525,52586,"Wenn ihr das Leben gar zu ernsthaft nehmt, was ist denn dran?",emotional movement,emotional movement,emotional movement
831,GerDracor/goethe-egmont.xml,52587,52752,"Wenn
              uns der Morgen nicht zu neuen Freuden weckt, am Abend uns keine Lust zu hoffen übrig
              bleibt, ist's wohl des An- und Ausziehens wert?",positive,emotions of joy,joy
832,GerDracor/goethe-egmont.xml,52753,52832,"Scheint mir die Sonne heut, um das zu
              überlegen, was gestern war?",emotional movement,emotions of joy,joy
833,GerDracor/goethe-egmont.xml,52833,52960,"und um zu raten, zu verbinden, was nicht zu erraten, nicht
              zu verbinden ist, das Schicksal eines kommenden Tages?",positive,emotions of joy,emotional movement
834,GerDracor/goethe-egmont.xml,52961,53057,"Schenke mir diese
              Betrachtungen, wir wollen sie Schülern und Höflingen überlassen.",positive,emotions of affection,anger
835,GerDracor/goethe-egmont.xml,53058,53199,"Die mögen sinnen und
              aussinnen, wandeln und schleichen, gelangen, wohin sie können, erschleichen, was sie
              können.",negative,emotions of rejection,"hate, disgust"
836,GerDracor/goethe-egmont.xml,53200,53312,"– Kannst du von allem diesem etwas brauchen, daß deine Epistel kein Buch wird,
              so ist mir's recht.",positive,emotions of joy,Schadenfreude
837,GerDracor/goethe-egmont.xml,53313,53359,Dem guten Alten scheint alles viel zu wichtig.,emotional movement,emotions of affection,emotional movement
838,GerDracor/goethe-egmont.xml,53360,53489,"So drückt ein
              Freund, der lang unsre Hand gehalten, sie stärker noch einmal, wenn er sie lassen
              will.",positive,emotions of affection,friendship
839,GerDracor/goethe-egmont.xml,53490,53605,"Verzeiht mir, es wird dem Fußgänger schwindlig, der einen Mann mit rasselnder Eile
              daherfahren sieht.",negative,emotions of fear,emotional movement
840,GerDracor/goethe-egmont.xml,53606,53611,Kind!,negative,emotions of fear,fear
841,GerDracor/goethe-egmont.xml,53612,53617,Kind!,negative,emotions of fear,fear
842,GerDracor/goethe-egmont.xml,53618,53631,nicht weiter!,negative,emotions of rejection,anger
843,GerDracor/goethe-egmont.xml,53632,53857,"Wie von unsichtbaren Geistern gepeitscht, gehen die
              Sonnenpferde der Zeit mit unsers Schicksals leichtem Wagen durch; und uns bleibt
              nichts, als mutig gefaßt die Zügel festzuhalten, und bald  Herr!",positive,emotions of fear,fear
844,GerDracor/goethe-egmont.xml,53858,53863,Herr!,negative,emotions of rejection,emotional movement
845,GerDracor/goethe-egmont.xml,53864,53968,"Ich stehe hoch und kann und muß noch höher steigen; ich fühle mir Hoffnung, Mut und
              Kraft.",positive,emotions of joy,joy
846,GerDracor/goethe-egmont.xml,53969,54103,"Noch hab ich meines Wachstums Gipfel nicht erreicht; und steh ich droben einst,
              so will ich fest, nicht ängstlich stehn.",negative,emotions of fear,fear
847,GerDracor/goethe-egmont.xml,54104,54288,"Soll ich fallen, so mag ein Donnerschlag, ein
              Sturmwind, ja ein selbst verfehlter Schritt mich abwärts in die Tiefe stürzen; da lieg
              ich mit viel Tausenden.",negative,emotions of fear,suffering
848,GerDracor/goethe-egmont.xml,54289,54493,"Ich habe nie verschmäht, mit meinen guten Kriegsgesellen um
              kleinen Gewinst das blutige Los zu werfen; und sollt ich knickern, wenn's um den
              ganzen freien Wert des Lebens geht?",negative,emotions of affection,Schadenfreude
849,GerDracor/goethe-egmont.xml,54494,54501,O Herr!,negative,emotions of suffering,suffering
850,GerDracor/goethe-egmont.xml,54502,54544,"Ihr wißt nicht, was für Worte Ihr sprecht!",negative,emotions of rejection,anger
851,GerDracor/goethe-egmont.xml,54545,54562,Gott erhalt Euch!,positive,emotions of affection,love
852,GerDracor/goethe-egmont.xml,54563,54591,Nimm deine Papiere zusammen!,emotional movement,emotions of rejection,fear
853,GerDracor/goethe-egmont.xml,54592,54606,Oranien kommt.,positive,emotions of joy,emotional movement
854,GerDracor/goethe-egmont.xml,54607,54713,"Fertige aus, was am nötigsten ist, daß
              die Boten fortkommen, eh die Tore geschlossen werden.",negative,emotions of joy,anger
855,GerDracor/goethe-egmont.xml,54714,54734,Das andere hat Zeit.,negative,emotions of rejection,emotional movement
856,GerDracor/goethe-egmont.xml,54735,54862,"Den Brief
              an den Grafen laß bis morgen; versäume nicht, Elviren zu besuchen, und grüße sie von
              mir.",positive,emotions of affection,joy
857,GerDracor/goethe-egmont.xml,54863,54970,"– Horche, wie sich die Regentin befindet; sie soll nicht wohl sein, ob sie's
              gleich verbirgt.",positive,emotions of rejection,fear
858,GerDracor/goethe-egmont.xml,54972,54984,Sekretär ab.,negative,emotions of rejection,anger
859,GerDracor/goethe-egmont.xml,54985,54999,Oranien kommt.,positive,emotions of joy,emotional movement
860,GerDracor/goethe-egmont.xml,55000,55020,"Willkommen, Oranien!",positive,emotions of joy,joy
861,GerDracor/goethe-egmont.xml,55021,55053,Ihr scheint mir nicht ganz frei.,emotional movement,emotional movement,suffering
862,GerDracor/goethe-egmont.xml,55054,55107,Was sagt Ihr zu unsrer Unterhaltung mit der Regentin?,positive,emotional movement,emotional movement
863,GerDracor/goethe-egmont.xml,55108,55173,"Ich fand in ihrer Art, uns aufzunehmen, nichts Außerordentliches.",positive,emotions of affection,joy
864,GerDracor/goethe-egmont.xml,55174,55224,"Ich habe sie schon
              öfter so gesehen.",positive,emotions of affection,love
865,GerDracor/goethe-egmont.xml,55225,55256,Sie schien mir nicht ganz wohl.,positive,emotional movement,suffering
866,GerDracor/goethe-egmont.xml,55257,55304,"Merktet Ihr nicht, daß sie zurückhaltender war?",emotional movement,emotions of affection,emotional movement
867,GerDracor/goethe-egmont.xml,55305,55816,"Erst wollte sie unser Betragen bei
              dem neuen Aufruhr des Pöbels gelassen billigen; nachher merkte sie an, was sich doch
              auch für ein falsches Licht darauf werfen lasse; wich dann mit dem Gespräche zu ihrem
              alten gewöhnlichen Diskurs: daß man ihre liebevolle, gute Art, ihre Freundschaft zu
              uns Niederländern nie genug erkannt, zu leicht behandelt habe, daß nichts einen
              erwünschten Ausgang  Nicht alles; ich dachte unterdessen an was anders.",emotional movement,emotions of rejection,anger
868,GerDracor/goethe-egmont.xml,55817,56339,"Sie ist ein Weib, guter Oranien,
              und die möchten immer gern, daß sich alles unter ihr sanftes Joch gelassen schmiegte,
              daß jeder Herkules die Löwenhaut ablegte und ihren Kunkelhof vermehrte; daß, weil sie
              friedlich gesinnt sind, die Gärung, die ein Volk ergreift, der Sturm, den mächtige
              Nebenbuhler gegen einander erregen, sich durch Ein freundlich Wort beilegen ließe, und
              die widrigsten Elemente sich zu ihren Füßen in sanfter Eintracht vereinigten.",positive,emotions of affection,love
869,GerDracor/goethe-egmont.xml,56340,56629,"Das ist
              ihr Fall; und da sie es dahin nicht bringen kann, so hat sie keinen Weg, als launisch
              zu werden, sich über Undankbarkeit, Unweisheit zu beklagen, mit schrecklichen
              Aussichten in die Zukunft zu drohen, und zu drohen – daß sie fortgehn will.",negative,emotions of rejection,anger
870,GerDracor/goethe-egmont.xml,56630,56684,"Glaubt Ihr dasmal nicht, daß sie ihre Drohung erfüllt?",negative,emotions of fear,anger
871,GerDracor/goethe-egmont.xml,56685,56696,Nimmermehr!,negative,emotions of rejection,anger
872,GerDracor/goethe-egmont.xml,56697,56743,Wie oft habe ich sie schon reisefertig gesehn!,positive,emotions of joy,joy
873,GerDracor/goethe-egmont.xml,56744,56765,Wo will sie denn hin?,emotional movement,emotional movement,emotional movement
874,GerDracor/goethe-egmont.xml,56766,56916,"Hier
              Statthalterin, Königin; glaubst du, daß sie es unterhalten wird, am Hofe ihres Bruders
              unbedeutende Tage abzuhaspeln?",negative,emotional movement,emotional movement
875,GerDracor/goethe-egmont.xml,56917,57015,"oder nach Italien zu gehen und sich in alten
              Familienverhältnissen herumzuschleppen?",negative,emotions of suffering,suffering
876,GerDracor/goethe-egmont.xml,57016,57244,"Man hält sie dieser Entschließung nicht fähig, weil ihr sie habt zaudern, weil ihr
              sie habt zurücktreten sehn; dennoch liegt's wohl in ihr; neue Umstände treiben sie zu
              dem lang verzögerten Entschluß.",emotional movement,emotions of suffering,love
877,GerDracor/goethe-egmont.xml,57245,57260,Wenn sie ginge?,emotional movement,emotional movement,emotional movement
878,GerDracor/goethe-egmont.xml,57261,57311,"und der König schickte einen
              andern!",negative,emotions of rejection,anger
879,GerDracor/goethe-egmont.xml,57312,57369,"Nun, der würde kommen, und würde eben auch zu tun finden.",negative,emotions of rejection,anger
880,GerDracor/goethe-egmont.xml,57370,57821,"Mit großen Planen,
              Projekten und Gedanken würde er kommen, wie er alles zurechtrücken, unterwerfen und
              zusammenhalten wolle; und würde heut mit dieser Kleinigkeit, morgen mit einer andern
              zu tun haben, übermorgen jene Hindernis finden, einen Monat mit Entwürfen, einen
              andern mit Verdruß über fehlgeschlagne Unternehmen, ein halb Jahr in Sorgen über eine
              einzige Provinz zubringen.",negative,emotions of suffering,suffering
881,GerDracor/goethe-egmont.xml,57822,57910,"Auch ihm wird die Zeit vergehn, der  Wenn man nun aber dem König zu einem Versuch riete?",negative,emotions of fear,fear
882,GerDracor/goethe-egmont.xml,57911,57920,Der wäre?,emotional movement,emotional movement,emotional movement
883,GerDracor/goethe-egmont.xml,57921,57964,"Zu sehen, was der Rumpf ohne Haupt anfinge.",negative,emotions of rejection,emotional movement
884,GerDracor/goethe-egmont.xml,57965,57969,Wie?,emotional movement,emotional movement,emotional movement
885,GerDracor/goethe-egmont.xml,57970,58393,"Egmont, ich trage viele Jahre her alle unsre Verhältnisse am Herzen, ich stehe immer
              wie über einem Schachspiele und halte keinen Zug des Gegners für unbedeutend; und wie
              müßige Menschen mit der größten Sorgfalt sich um die Geheimnisse der Natur bekümmern,
              so halt ich es für Pflicht, für Beruf eines Fürsten, die Gesinnungen, die Ratschläge
              aller Parteien zu kennen.",positive,emotions of affection,friendship
