,file,start,end,text,pre1_base_polarity,pre1_main_emotion_class,pre1_tag_type
302,GerDracor/eichendorff-der-letzte-held-von-marienburg.xml,17299,17312,Er entflieht.,negative,emotions of fear,fear
303,GerDracor/eichendorff-der-letzte-held-von-marienburg.xml,17313,17338,mit der Fahne auftretend.,positive,emotions of joy,admiration
304,GerDracor/eichendorff-der-letzte-held-von-marienburg.xml,17339,17349,Zurück da!,negative,emotions of rejection,anger
305,GerDracor/eichendorff-der-letzte-held-von-marienburg.xml,17350,17380,Rückwärts in die Szene rufend.,negative,emotional movement,emotional movement
306,GerDracor/eichendorff-der-letzte-held-von-marienburg.xml,17381,17484,"Greift das flüchtige Gesindel, Das heulend rings das Morgenrot verstört, Stoßt nieder, was nicht steht!",negative,emotions of rejection,"hate, disgust"
307,GerDracor/eichendorff-der-letzte-held-von-marienburg.xml,17485,17506,Die Ritter erkennend.,positive,emotions of joy,admiration
308,GerDracor/eichendorff-der-letzte-held-von-marienburg.xml,17507,17522,Wie Ihr seid's?,emotional movement,emotional movement,emotional movement
309,GerDracor/eichendorff-der-letzte-held-von-marienburg.xml,17523,17528,hier?,emotional movement,emotional movement,emotional movement
310,GerDracor/eichendorff-der-letzte-held-von-marienburg.xml,17529,17563,"Nun, Gott willkommen, Brüder mein!",positive,emotions of joy,joy
311,GerDracor/eichendorff-der-letzte-held-von-marienburg.xml,17564,17574,Du Plauen?,negative,emotional movement,emotional movement
312,GerDracor/eichendorff-der-letzte-held-von-marienburg.xml,17575,17596,Was soll der Schwank?,negative,emotions of rejection,anger
313,GerDracor/eichendorff-der-letzte-held-von-marienburg.xml,17597,17628,warum verrennst du uns Den Weg?,negative,emotions of rejection,emotional movement
314,GerDracor/eichendorff-der-letzte-held-von-marienburg.xml,17629,17638,Ich Euch?,negative,emotional movement,emotional movement
315,GerDracor/eichendorff-der-letzte-held-von-marienburg.xml,17639,17669,Der grade Weg geht ja Dorthin.,positive,emotions of joy,suffering
316,GerDracor/eichendorff-der-letzte-held-von-marienburg.xml,17670,17676,Wohin?,emotional movement,emotional movement,emotional movement
317,GerDracor/eichendorff-der-letzte-held-von-marienburg.xml,17677,17719,"Nun, wo in aller Welt Als nach Marienburg?",positive,emotions of rejection,emotional movement
318,GerDracor/eichendorff-der-letzte-held-von-marienburg.xml,17720,17745,Du willst aufs Haupthaus?,negative,emotions of rejection,anger
319,GerDracor/eichendorff-der-letzte-held-von-marienburg.xml,17746,17768,im höchsten Erstaunen.,emotional movement,emotional movement,emotional movement
320,GerDracor/eichendorff-der-letzte-held-von-marienburg.xml,17769,17780,Ihr nicht?!,negative,emotions of joy,emotional movement
321,GerDracor/eichendorff-der-letzte-held-von-marienburg.xml,17781,17799,Bist du denn toll?,emotional movement,emotions of joy,emotional movement
322,GerDracor/eichendorff-der-letzte-held-von-marienburg.xml,17800,17884,"Ein Häuflein Greise Wankt auf den Zinnen dort, gleich Wetterhähnen, Der Winde Spiel.",negative,emotions of suffering,suffering
323,GerDracor/eichendorff-der-letzte-held-von-marienburg.xml,17885,17910,So laß sie Kugeln gießen!,negative,emotions of rejection,Schadenfreude
324,GerDracor/eichendorff-der-letzte-held-von-marienburg.xml,17911,17952,Dreitausend frische Männer bring ich mit.,positive,emotions of joy,joy
325,GerDracor/eichendorff-der-letzte-held-von-marienburg.xml,17953,17977,Jagello dringt zum Haus.,negative,emotions of rejection,"hate, disgust"
326,GerDracor/eichendorff-der-letzte-held-von-marienburg.xml,17978,17996,Nun just deswegen!,negative,emotions of suffering,anger
327,GerDracor/eichendorff-der-letzte-held-von-marienburg.xml,17997,18043,Der Meister tot Der hohe Meister stirbt nicht!,negative,emotions of affection,emotional movement
328,GerDracor/eichendorff-der-letzte-held-von-marienburg.xml,18044,18066,"auftretend, zu Plauen.",negative,emotions of rejection,anger
329,GerDracor/eichendorff-der-letzte-held-von-marienburg.xml,18067,18078,"Herr, eilt!",negative,emotions of fear,fear
330,GerDracor/eichendorff-der-letzte-held-von-marienburg.xml,18079,18229,von jenen Höhn dort komm ich eben; Am Firmament fern überm dunklen Kranze Der Wälder zieht der Pole eine Furt Von Glut und Rauch grad nach Marienburg.,negative,emotions of fear,suffering
331,GerDracor/eichendorff-der-letzte-held-von-marienburg.xml,18230,18237,O Herr!,negative,emotions of suffering,suffering
332,GerDracor/eichendorff-der-letzte-held-von-marienburg.xml,18238,18274,"so gib denn Flügel, heut nur Flügel!",positive,emotions of affection,admiration
333,GerDracor/eichendorff-der-letzte-held-von-marienburg.xml,18275,18318,"Eil schnell hinunter, es soll niemand ruhn!",negative,emotions of rejection,anger
334,GerDracor/eichendorff-der-letzte-held-von-marienburg.xml,18319,18363,"Geh, treibe, bitte, schelte, fort nur, fort!",negative,emotions of rejection,anger
335,GerDracor/eichendorff-der-letzte-held-von-marienburg.xml,18364,18390,Ich folge gleich Hör noch.,negative,emotions of fear,anger
336,GerDracor/eichendorff-der-letzte-held-von-marienburg.xml,18391,18397,Leise.,negative,emotional movement,emotional movement
337,GerDracor/eichendorff-der-letzte-held-von-marienburg.xml,18398,18499,"Ein Fähnlein sende Hierher, sie sollen diesen Platz umzingeln Und keinen lebend lassen aus dem Kreis.",positive,emotions of rejection,"hate, disgust"
338,GerDracor/eichendorff-der-letzte-held-von-marienburg.xml,18500,18513,Hauptmann ab.,negative,emotions of rejection,admiration
339,GerDracor/eichendorff-der-letzte-held-von-marienburg.xml,18514,18533,Zu den Gebietigern.,negative,emotions of rejection,emotional movement
340,GerDracor/eichendorff-der-letzte-held-von-marienburg.xml,18534,18656,"Nun rundheraus, ihr Herrn: wer nicht mit uns, Ist gegen uns und so verhafte ich Euch hier in unsers heil'gen Ordens Namen.",negative,emotions of rejection,anger
341,GerDracor/eichendorff-der-letzte-held-von-marienburg.xml,18657,18678,sein Schwert ziehend.,negative,emotions of rejection,anger
342,GerDracor/eichendorff-der-letzte-held-von-marienburg.xml,18679,18718,"Komm her, wes Herz nach Stahl verlangt!",negative,emotions of affection,"hate, disgust"
343,GerDracor/eichendorff-der-letzte-held-von-marienburg.xml,18719,18764,"Wer gab So ungemeßnes Recht dir, Übermüt'gem?",negative,emotions of rejection,joy
344,GerDracor/eichendorff-der-letzte-held-von-marienburg.xml,18765,18857,"Frag mich nicht drum ich weiß es nicht, doch, so mir Gott helfen mag, ich kann nicht anders!",negative,emotions of rejection,anger
345,GerDracor/eichendorff-der-letzte-held-von-marienburg.xml,18858,18994,"Eins Muß Seel und Leib hier sein, und wo ein Glied Abtrünnig, faul haut's ab, bevor sein Gift  Ist's zu Erbarmen hier und Wortgeklingel!",negative,emotions of rejection,compassion
346,GerDracor/eichendorff-der-letzte-held-von-marienburg.xml,18995,19067,Gebt ihr das Haupthaus auf: Ihr findet nimmer Ein Haus auf Erden wieder!,negative,emotions of suffering,suffering
347,GerDracor/eichendorff-der-letzte-held-von-marienburg.xml,19068,19130,"Nun, so fange Dir Knechte ein, nicht deutschen Reiches Grafen!",negative,emotions of rejection,Schadenfreude
348,GerDracor/eichendorff-der-letzte-held-von-marienburg.xml,19131,19155,"Um Gottes willen, still!",emotional movement,emotions of fear,fear
349,GerDracor/eichendorff-der-letzte-held-von-marienburg.xml,19156,19178,"ich bitt euch, Friede!",positive,emotions of affection,suffering
350,GerDracor/eichendorff-der-letzte-held-von-marienburg.xml,19179,19222,"Was Friede da, hat gleich der Plauen recht!",positive,emotions of joy,joy
351,GerDracor/eichendorff-der-letzte-held-von-marienburg.xml,19223,19245,"Oho, ihr Gräflein, ho!",negative,emotions of rejection,anger
352,GerDracor/eichendorff-der-letzte-held-von-marienburg.xml,19246,19347,"Ihr lagt in Windeln Als nackte Heiden noch, da rauft ich hier Als Ritter schon der Königin der Ehren!",negative,emotions of rejection,"hate, disgust"
353,GerDracor/eichendorff-der-letzte-held-von-marienburg.xml,19348,19365,rasch vortretend.,emotional movement,emotional movement,emotional movement
354,GerDracor/eichendorff-der-letzte-held-von-marienburg.xml,19366,19395,"Nun gut, ich will ja Frieden.",negative,emotions of affection,suffering
355,GerDracor/eichendorff-der-letzte-held-von-marienburg.xml,19396,19583,"Hab's bedacht Ein schöner Strauß, Marienburg zu retten, Kühn, glänzend ob es glückt, ob nicht: wer's wagt, Des Name hebt mit feur'gem Arm der Ruhm Hoch über den gemeinen Strom der Zeiten.",positive,emotions of affection,admiration
356,GerDracor/eichendorff-der-letzte-held-von-marienburg.xml,19584,19619,Den Plauen scharf ins Auge fassend.,negative,emotional movement,fear
357,GerDracor/eichendorff-der-letzte-held-von-marienburg.xml,19620,19666,Tritt mir die Macht des Feldherrn ab so sei's!,negative,emotions of rejection,Schadenfreude
358,GerDracor/eichendorff-der-letzte-held-von-marienburg.xml,19667,19750,"Gib mir den Zügel dieser mut'gen Seelen, Und nach Marienburg lenk ich Roß und Mann!",positive,emotions of affection,admiration
359,GerDracor/eichendorff-der-letzte-held-von-marienburg.xml,19751,19770,Was sinnst du nach?,negative,emotional movement,emotional movement
360,GerDracor/eichendorff-der-letzte-held-von-marienburg.xml,19771,19830,Du bist mir unbekannt In fremde Hand so Großes alles legen.,negative,emotions of rejection,"hate, disgust"
361,GerDracor/eichendorff-der-letzte-held-von-marienburg.xml,19831,19878,Des Höhren Hand ist über dir und mir Willst du?,positive,emotions of affection,"hate, disgust"
362,GerDracor/eichendorff-der-letzte-held-von-marienburg.xml,19879,19889,willst du?,negative,emotions of affection,anger
363,GerDracor/eichendorff-der-letzte-held-von-marienburg.xml,19890,19907,nach einer Pause.,emotional movement,emotional movement,emotional movement
364,GerDracor/eichendorff-der-letzte-held-von-marienburg.xml,19908,19929,So nimm das Regiment!,negative,emotions of affection,admiration
365,GerDracor/eichendorff-der-letzte-held-von-marienburg.xml,19930,19954,Er reicht ihm die Fahne.,positive,emotions of affection,admiration
366,GerDracor/eichendorff-der-letzte-held-von-marienburg.xml,19955,19976,"Nur fort jetzt, fort!",negative,emotions of rejection,anger
367,GerDracor/eichendorff-der-letzte-held-von-marienburg.xml,19977,20008,"Mit Gott ein Herz, ein Schwert!",negative,emotions of affection,love
368,GerDracor/eichendorff-der-letzte-held-von-marienburg.xml,20009,20067,"zurücktretend, indem er sein Schwert in die Scheide wirft.",negative,emotions of rejection,fear
369,GerDracor/eichendorff-der-letzte-held-von-marienburg.xml,20068,20095,"Nun, so sei Gott gepriesen!",positive,emotions of joy,joy
370,GerDracor/eichendorff-der-letzte-held-von-marienburg.xml,20096,20111,Meinst du's so.,positive,emotions of affection,anger
371,GerDracor/eichendorff-der-letzte-held-von-marienburg.xml,20112,20182,So kann's gelingen und mit Freuden beug ich Mich vor dem bessern Mann.,positive,emotions of joy,joy
372,GerDracor/eichendorff-der-letzte-held-von-marienburg.xml,20183,20205,"Da nimm, und führ uns!",positive,emotions of affection,anger
373,GerDracor/eichendorff-der-letzte-held-von-marienburg.xml,20206,20298,"Ist's gleich die Regel nicht Man soll nicht sagen, Daß je ein Kyburg fehlt, wo's adlig gilt!",positive,emotions of rejection,admiration
374,GerDracor/eichendorff-der-letzte-held-von-marienburg.xml,20299,20392,"Ich zerr schon lang hier, wie ein Ochs am Stricke  Die Hörner eingesetzt und frisch drauflos!",negative,emotions of rejection,anger
375,GerDracor/eichendorff-der-letzte-held-von-marienburg.xml,20393,20403,zu Plauen.,negative,emotions of rejection,anger
376,GerDracor/eichendorff-der-letzte-held-von-marienburg.xml,20404,20432,Was stehst du zaudernd noch?,negative,emotions of rejection,emotional movement
377,GerDracor/eichendorff-der-letzte-held-von-marienburg.xml,20433,20493,Mir ist's so hell Wie 'n klarer Sonntagsmorgen in der Seele.,positive,emotions of joy,joy
378,GerDracor/eichendorff-der-letzte-held-von-marienburg.xml,20494,20667,"Seht, wie's im Tal da blitzt, die Banner wehn, Die Lerche schwingt sich auf und aus der Ferne Die Morgenglocken durch die stille Luft O großer Gott, wie bist du gnadenreich!",positive,emotions of joy,joy
379,GerDracor/eichendorff-der-letzte-held-von-marienburg.xml,20668,20690,Er sinkt auf die Knie.,positive,emotions of suffering,admiration
380,GerDracor/eichendorff-der-letzte-held-von-marienburg.xml,20691,20766,"Alle andern Ritter knien gleichfalls zu stillem Gebet
              nieder.",negative,emotions of suffering,suffering
381,GerDracor/eichendorff-der-letzte-held-von-marienburg.xml,20767,20787,Währenddes hört man.,emotional movement,emotional movement,suffering
382,GerDracor/eichendorff-der-letzte-held-von-marienburg.xml,20788,20796,draußen.,negative,emotions of fear,fear
383,GerDracor/eichendorff-der-letzte-held-von-marienburg.xml,20797,20898,"Sei gegrüßt, du Königin Himmels und der Erden; Hilf uns, laß die Deinen heut Nicht zuschanden werden!",positive,emotions of affection,admiration
384,GerDracor/eichendorff-der-letzte-held-von-marienburg.xml,20899,20910,aufstehend.,positive,emotional movement,emotional movement
385,GerDracor/eichendorff-der-letzte-held-von-marienburg.xml,20911,20948,"Sie rufen schon auf, nach Marienburg!",positive,emotions of fear,anger
386,GerDracor/eichendorff-der-letzte-held-von-marienburg.xml,20949,21004,"Während sich alle erheben, und, Plauen folgend, abgehn.",negative,emotional movement,anger
387,GerDracor/eichendorff-der-letzte-held-von-marienburg.xml,21005,21014,wie oben.,negative,emotional movement,anger
388,GerDracor/eichendorff-der-letzte-held-von-marienburg.xml,21015,21124,"Sei gegrüßt, du Morgenstern In dem Graun der Schlachten, Führ uns heim ins Morgenrot, Will uns Tod umnachten!",positive,emotions of affection,"hate, disgust"
389,GerDracor/eichendorff-der-letzte-held-von-marienburg.xml,21125,21288,"Schloßhof in Marienburg, links eine Mauer, über die man ins Land hinaussehen kann,
            im Hintergrunde buntbewegte Geschäftigkeit von Rittern und Soldaten.",emotional movement,emotions of joy,joy
390,GerDracor/eichendorff-der-letzte-held-von-marienburg.xml,21289,21366,"Hanns von Baysen,
            eine Büchse in der Hand, und ein Soldat kommen.",negative,emotions of fear,anger
391,GerDracor/eichendorff-der-letzte-held-von-marienburg.xml,21367,21384,Nun Gotts Wunder!,negative,emotional movement,emotional movement
392,GerDracor/eichendorff-der-letzte-held-von-marienburg.xml,21385,21494,"laßt Euch noch einmal betrachten wahrhaftig der Herr Junker Hanns
              von Baysen mit Haut und Haar!",positive,emotions of affection,admiration
393,GerDracor/eichendorff-der-letzte-held-von-marienburg.xml,21495,21512,wie kamt Ihr her?,emotional movement,emotional movement,emotional movement
394,GerDracor/eichendorff-der-letzte-held-von-marienburg.xml,21513,21545,Hab lange genug gehockt zu Haus.,negative,emotions of suffering,suffering
395,GerDracor/eichendorff-der-letzte-held-von-marienburg.xml,21546,21736,"Als heut der Plauen die Schar vorüberführte ich
              stand grade auf der Zinne und hört's von ferne trampeln und rasseln durch die  Ja, so ein Kriegsjahr kostet ein gut Stück Speck.",positive,emotions of suffering,suffering
396,GerDracor/eichendorff-der-letzte-held-von-marienburg.xml,21737,21920,"Sonst, wenn ich mich abends unter
              der großen Linde vor Eurem Schloße auf die Bank niedersetzte, da zitterte mir der
              ganze Leib vor Zufriedenheit wie Sülze.",positive,emotions of joy,joy
397,GerDracor/eichendorff-der-letzte-held-von-marienburg.xml,21921,21964,Du bist noch immer der alte lustige Gesell.,positive,emotions of joy,Schadenfreude
398,GerDracor/eichendorff-der-letzte-held-von-marienburg.xml,21965,21980,Da sieh einmal!,positive,emotions of joy,joy
399,GerDracor/eichendorff-der-letzte-held-von-marienburg.xml,21981,22082,"ein schmuck Gewehr, so
              blank; es spiegelt sich der Himmel drin wie lauter helles Glück.",positive,emotions of joy,joy
400,GerDracor/eichendorff-der-letzte-held-von-marienburg.xml,22084,22168,"Er legt über
                die Mauer an, läßt aber schnell die Arme wieder sinken.",emotional movement,emotions of suffering,love
401,GerDracor/eichendorff-der-letzte-held-von-marienburg.xml,22169,22231,Gewitter es fliegt der Sturm voraus und wirbelt den Staub auf.,negative,emotions of fear,emotional movement
402,GerDracor/eichendorff-der-letzte-held-von-marienburg.xml,22232,22372,"Die Marienburger sind
              es, die vor dem Hagelwetter, das von Stuhm aufsteigt, aus der Stadt zum Schlosse
              flüchten.",negative,emotions of fear,suffering
403,GerDracor/eichendorff-der-letzte-held-von-marienburg.xml,22373,22428,"Wahrhaftig, wie zerrissenes Gewölk vor dem Sturm daher!",negative,emotions of suffering,suffering
404,GerDracor/eichendorff-der-letzte-held-von-marienburg.xml,22429,22798,"Ein jeder trägt sein Liebstes
              da sieh das Weib, wie ein Apfelbaum, aus jeder Falte ihres Mantels guckt ein
              Kinderköpfchen, und dort der flinke Bursch sein Mädchen hoch im Arm schau nur, sie
              sieht uns hier und blickt schnell weg, als hätte die Morgensonne sie geblendet; ich
              wette, sie blinzelt doch wieder herauf.",positive,emotions of affection,love
405,GerDracor/eichendorff-der-letzte-held-von-marienburg.xml,22799,22832,Aber was soll uns das alles hier?,negative,emotions of rejection,emotional movement
406,GerDracor/eichendorff-der-letzte-held-von-marienburg.xml,22833,22983,"Der Plauen hat ihnen die Keller aufgetan, da sollen die Ratten hausen, bis wir die
              heidnischen Tigerkatzen draußen wieder verjagt haben.",negative,emotions of rejection,"hate, disgust"
407,GerDracor/eichendorff-der-letzte-held-von-marienburg.xml,22984,23024,Wie bei der Sündflut in der Arche Noahs.,negative,emotions of suffering,suffering
408,GerDracor/eichendorff-der-letzte-held-von-marienburg.xml,23025,23072,Die Arche wird etwas tief gehn von dem Ballast.,negative,emotions of suffering,suffering
409,GerDracor/eichendorff-der-letzte-held-von-marienburg.xml,23073,23189,"Laß es gut sein, der Plauen ist der rechte Schiffer, der steuert uns alle heraus
              durch Sturm und Flut!",positive,emotions of affection,joy
410,GerDracor/eichendorff-der-letzte-held-von-marienburg.xml,23191,23222,Nach dem Hintergrunde gewendet.,negative,emotional movement,suffering
411,GerDracor/eichendorff-der-letzte-held-von-marienburg.xml,23223,23333,"Ein Haufen Söldner, Czervany und Langschenkel an der Spitze, verfolgen den Johann
              von Schönfeld.",negative,emotions of rejection,"hate, disgust"
412,GerDracor/eichendorff-der-letzte-held-von-marienburg.xml,23334,23348,Seid ihr toll!,positive,emotions of joy,joy
413,GerDracor/eichendorff-der-letzte-held-von-marienburg.xml,23349,23388,Was habt ihr euch grade auf mich  Sold!,negative,emotions of rejection,anger
414,GerDracor/eichendorff-der-letzte-held-von-marienburg.xml,23389,23394,Gold?,emotional movement,emotional movement,emotional movement
415,GerDracor/eichendorff-der-letzte-held-von-marienburg.xml,23395,23407,Ihr sollt't!,positive,emotions of rejection,anger
416,GerDracor/eichendorff-der-letzte-held-von-marienburg.xml,23408,23419,auffahrend.,emotional movement,emotional movement,emotional movement
417,GerDracor/eichendorff-der-letzte-held-von-marienburg.xml,23420,23424,Bah!,negative,emotions of suffering,emotional movement
418,GerDracor/eichendorff-der-letzte-held-von-marienburg.xml,23426,23454,Indem er sein Schwert zieht.,negative,emotions of rejection,anger
419,GerDracor/eichendorff-der-letzte-held-von-marienburg.xml,23455,23466,auftretend.,negative,emotions of suffering,emotional movement
420,GerDracor/eichendorff-der-letzte-held-von-marienburg.xml,23467,23473,Still!,negative,emotional movement,emotional movement
421,GerDracor/eichendorff-der-letzte-held-von-marienburg.xml,23474,23533,Der Haufe teilt sich schweigend und bildet einen Halbkreis.,negative,emotional movement,emotional movement
422,GerDracor/eichendorff-der-letzte-held-von-marienburg.xml,23534,23549,Nun was gibt's?,negative,emotional movement,emotional movement
423,GerDracor/eichendorff-der-letzte-held-von-marienburg.xml,23550,23580,Laßt sehn: wer spricht zuerst?,positive,emotions of rejection,Schadenfreude
424,GerDracor/eichendorff-der-letzte-held-von-marienburg.xml,23581,23603,leise zu Langschenkel.,negative,emotional movement,emotional movement
425,GerDracor/eichendorff-der-letzte-held-von-marienburg.xml,23604,23629,Jetzt reiß dein Maul auf.,negative,emotions of rejection,anger
426,GerDracor/eichendorff-der-letzte-held-von-marienburg.xml,23630,23637,ebenso.,negative,emotions of suffering,anger
427,GerDracor/eichendorff-der-letzte-held-von-marienburg.xml,23638,23644,Ruhig!,emotional movement,emotional movement,emotional movement
428,GerDracor/eichendorff-der-letzte-held-von-marienburg.xml,23645,23714,"ich zerdrück dich, Wie 'n Pfeifenstiel sonst zwischen meinen Fingern!",negative,emotions of rejection,suffering
429,GerDracor/eichendorff-der-letzte-held-von-marienburg.xml,23715,23726,vortretend.,emotional movement,emotional movement,emotional movement
430,GerDracor/eichendorff-der-letzte-held-von-marienburg.xml,23727,23860,"Herr Ihr erlaubt der arme blinde Troß Ich kenn das Volk, glaubt einem grauen Krieger So lumpig 's ist, so furchtbar wenn sie hungern.",negative,emotions of suffering,compassion
431,GerDracor/eichendorff-der-letzte-held-von-marienburg.xml,23861,23948,"Ich kann 's nicht bill'gen doch die Armut drückt Sie bitten, daß Ihr ihren Sold erhöht.",negative,emotions of suffering,suffering
432,GerDracor/eichendorff-der-letzte-held-von-marienburg.xml,23949,23957,lachend.,positive,emotions of joy,joy
433,GerDracor/eichendorff-der-letzte-held-von-marienburg.xml,23958,23985,"Nun, dacht ich Wunder doch!",negative,emotions of joy,joy
434,GerDracor/eichendorff-der-letzte-held-von-marienburg.xml,23986,24011,Zu den Söldnern gewendet.,negative,emotions of rejection,"hate, disgust"
435,GerDracor/eichendorff-der-letzte-held-von-marienburg.xml,24012,24123,"Seid ihr Soldaten,  Von poln'schen Zelten, reichgewirkten Tepp'chen Mit goldnen Franzen dran und Reiherbüschen.",positive,emotions of joy,joy
436,GerDracor/eichendorff-der-letzte-held-von-marienburg.xml,24124,24198,"Jagjels Schabracke, ja ein Zipfel dran Gilt mehr, als meine ganze Rüstung.",positive,emotions of affection,admiration
437,GerDracor/eichendorff-der-letzte-held-von-marienburg.xml,24199,24238,"Holt's euch, Ihr habt den ersten Griff.",positive,emotions of joy,joy
438,GerDracor/eichendorff-der-letzte-held-von-marienburg.xml,24239,24298,"Wie gnäd'ger Herr, Ihr meinet, daß die Beute Gott gesegnes!",negative,emotions of rejection,joy
439,GerDracor/eichendorff-der-letzte-held-von-marienburg.xml,24299,24349,"Nicht, wie es sonst Gebrauch, geteilt soll werden?",negative,emotions of rejection,anger
440,GerDracor/eichendorff-der-letzte-held-von-marienburg.xml,24350,24379,Daß  So Vorhand haben dürfen?,negative,emotions of rejection,emotional movement
441,GerDracor/eichendorff-der-letzte-held-von-marienburg.xml,24380,24398,"Ja, so mein ich's.",positive,emotions of affection,anger
442,GerDracor/eichendorff-der-letzte-held-von-marienburg.xml,24399,24418,Nun geht ihr's ein?,negative,emotions of joy,fear
443,GerDracor/eichendorff-der-letzte-held-von-marienburg.xml,24419,24435,Zu den Söldnern.,negative,emotions of rejection,"hate, disgust"
444,GerDracor/eichendorff-der-letzte-held-von-marienburg.xml,24436,24455,"Heil, Plauen, Heil!",positive,emotions of joy,suffering
445,GerDracor/eichendorff-der-letzte-held-von-marienburg.xml,24456,24462,Hussa!,emotional movement,emotional movement,emotional movement
446,GerDracor/eichendorff-der-letzte-held-von-marienburg.xml,24463,24483,Sie zerstreuen sich.,emotional movement,emotional movement,emotional movement
447,GerDracor/eichendorff-der-letzte-held-von-marienburg.xml,24484,24505,auf Czervany deutend.,emotional movement,emotions of rejection,admiration
448,GerDracor/eichendorff-der-letzte-held-von-marienburg.xml,24506,24543,Den greift und werft ihn in den Turm.,positive,emotions of rejection,anger
449,GerDracor/eichendorff-der-letzte-held-von-marienburg.xml,24544,24571,Wie mich Unschuld'gen Mann?,negative,emotional movement,emotional movement
450,GerDracor/eichendorff-der-letzte-held-von-marienburg.xml,24572,24596,Indem er abgeführt wird.,negative,emotions of rejection,anger
451,GerDracor/eichendorff-der-letzte-held-von-marienburg.xml,24597,24623,Das will ich dir gedenken!,negative,emotions of affection,compassion
452,GerDracor/eichendorff-der-letzte-held-von-marienburg.xml,24624,24633,für sich.,positive,emotions of joy,emotional movement
453,GerDracor/eichendorff-der-letzte-held-von-marienburg.xml,24634,24646,"Oho, nur zu!",positive,emotions of rejection,joy
454,GerDracor/eichendorff-der-letzte-held-von-marienburg.xml,24647,24758,"Dem tut Ihr nichts, das ist Ein alter Walnußbaum, je mehr man ihn Mit Knüppeln schmeißt, je üppiger gedeiht er!",negative,emotions of joy,Schadenfreude
455,GerDracor/eichendorff-der-letzte-held-von-marienburg.xml,24759,24762,Ab.,negative,emotional movement,anger
456,GerDracor/eichendorff-der-letzte-held-von-marienburg.xml,24763,24776,zu Schönfeld.,negative,emotional movement,emotional movement
457,GerDracor/eichendorff-der-letzte-held-von-marienburg.xml,24777,24801,Nun hast du dich erholt?,negative,emotions of joy,joy
458,GerDracor/eichendorff-der-letzte-held-von-marienburg.xml,24802,24824,"Sieh, wie das wimmelt.",negative,emotions of joy,joy
459,GerDracor/eichendorff-der-letzte-held-von-marienburg.xml,24825,24937,"Mir ist, als wär ich heimgekehrt von ferne Auf meiner Väter Schloß und schmückt' mir's aus Zu einem großen Fest.",positive,emotions of joy,joy
