,file,start,end,text,pre1_base_polarity,pre1_main_emotion_class,pre1_tag_type
460,GerDracor/eichendorff-der-letzte-held-von-marienburg.xml,24938,24948,tritt auf.,emotional movement,emotional movement,emotional movement
461,GerDracor/eichendorff-der-letzte-held-von-marienburg.xml,24949,24968,Was bringst du uns?,negative,emotional movement,anger
462,GerDracor/eichendorff-der-letzte-held-von-marienburg.xml,24969,25058,"Schloß Stuhm, das letzte Bollwerk, ist gebrochen Und unaufhaltsam rauscht die Flut heran.",negative,emotions of fear,despair
463,GerDracor/eichendorff-der-letzte-held-von-marienburg.xml,25059,25104,"Schwarzburg rasch beiseite ziehend, heimlich.",emotional movement,emotions of rejection,emotional movement
464,GerDracor/eichendorff-der-letzte-held-von-marienburg.xml,25105,25144,"Ist alles fertig, wie ich dir befohlen?",negative,emotional movement,anger
465,GerDracor/eichendorff-der-letzte-held-von-marienburg.xml,25145,25152,ebenso.,negative,emotions of suffering,anger
466,GerDracor/eichendorff-der-letzte-held-von-marienburg.xml,25153,25201,"Ein Wink, und Stadt Marienburg steht in Flammen.",negative,emotions of rejection,fear
467,GerDracor/eichendorff-der-letzte-held-von-marienburg.xml,25202,25230,sich zu den Rittern wendend.,positive,emotional movement,suffering
468,GerDracor/eichendorff-der-letzte-held-von-marienburg.xml,25231,25252,Nun frisch zum Tanze!,positive,emotions of joy,joy
469,GerDracor/eichendorff-der-letzte-held-von-marienburg.xml,25253,25315,"Stimmt die Instrumente, Wir wollen ihnen weite Sprünge lehren!",positive,emotions of joy,joy
470,GerDracor/eichendorff-der-letzte-held-von-marienburg.xml,25316,25439,"Gebt acht, wer seine Note fehlt, den lachen Die Frauen aus; manch Lockenköpfchen duckt Wie Ringelblumen aus dem Erdgeschoß.",positive,emotions of joy,joy
471,GerDracor/eichendorff-der-letzte-held-von-marienburg.xml,25440,25524,"Schafft ihnen Speis und Trank hinab, das Volk Soll schmausen an der Herren Ehrentag!",positive,emotions of rejection,joy
472,GerDracor/eichendorff-der-letzte-held-von-marienburg.xml,25525,25577,"Nun, wenn's nur schmeckt nichts, als gekochtes Korn.",positive,emotions of rejection,"hate, disgust"
473,GerDracor/eichendorff-der-letzte-held-von-marienburg.xml,25578,25651,"Das macht die Zähne blank, wir können's brauchen, Uns durchzubeißen hier.",negative,emotions of rejection,anger
474,GerDracor/eichendorff-der-letzte-held-von-marienburg.xml,25652,25682,verstört und eilig eintretend.,emotional movement,emotional movement,emotional movement
475,GerDracor/eichendorff-der-letzte-held-von-marienburg.xml,25683,25703,Wo ist der Feldherr?,emotional movement,emotional movement,emotional movement
476,GerDracor/eichendorff-der-letzte-held-von-marienburg.xml,25704,25732,"Was willst du, Burgemeister?",emotional movement,emotional movement,anger
477,GerDracor/eichendorff-der-letzte-held-von-marienburg.xml,25733,25749,Schaust so trüb.,negative,emotions of suffering,suffering
478,GerDracor/eichendorff-der-letzte-held-von-marienburg.xml,25750,25757,O Herr!,negative,emotions of suffering,suffering
479,GerDracor/eichendorff-der-letzte-held-von-marienburg.xml,25758,26044,"Auf dein Gebot verließ das Volk Die Stadt ich schied zuletzt, und hinter mir War's da so leer und still auf allen Gassen,  Doch durch die Einsamkeit, bald da, bald dort Sah ich geschäftig fremde Männer schreiten Ein schreckliches Gerücht geht um o sprich, Gestrenger Herr, was soll das?",negative,emotions of suffering,suffering
480,GerDracor/eichendorff-der-letzte-held-von-marienburg.xml,26045,26057,Was es soll?,negative,emotions of rejection,emotional movement
481,GerDracor/eichendorff-der-letzte-held-von-marienburg.xml,26058,26075,Was macht ihr da!,negative,emotions of rejection,emotional movement
482,GerDracor/eichendorff-der-letzte-held-von-marienburg.xml,26076,26104,dorthin bringt das Geschütz!,negative,emotions of rejection,anger
483,GerDracor/eichendorff-der-letzte-held-von-marienburg.xml,26105,26144,"Er geht, anordnend, in den Hintergrund.",emotional movement,emotions of suffering,emotional movement
484,GerDracor/eichendorff-der-letzte-held-von-marienburg.xml,26145,26158,an der Mauer.,negative,emotions of rejection,suffering
