,file,start,end,text,pre1_base_polarity,pre1_main_emotion_class,pre1_tag_type
1281,GerDracor/grabbe-kaiser-heinrich-der-sechste.xml,103841,103887,Daß er mit ihr die Pfalz an Frankreich bringe?,positive,emotions of rejection,emotional movement
1282,GerDracor/grabbe-kaiser-heinrich-der-sechste.xml,103888,103948,Ich mag ihn nicht – Mein Erbteil gönn ich deutschen Männern.,positive,emotions of rejection,"hate, disgust"
1283,GerDracor/grabbe-kaiser-heinrich-der-sechste.xml,103949,103953,Wie?,emotional movement,emotional movement,emotional movement
1284,GerDracor/grabbe-kaiser-heinrich-der-sechste.xml,103954,103990,schlägst du aus den Bund mit Valois?,positive,emotions of rejection,love
1285,GerDracor/grabbe-kaiser-heinrich-der-sechste.xml,103991,104031,"Wahrlich, sie konnte Besseres nicht tun.",positive,emotions of affection,admiration
1286,GerDracor/grabbe-kaiser-heinrich-der-sechste.xml,104032,104063,zu dem französischen Gesandten.,negative,emotional movement,anger
1287,GerDracor/grabbe-kaiser-heinrich-der-sechste.xml,104064,104122,"Ja, – wenn ich liebe, lieb ich nicht bloß Macht Und Namen.",positive,emotions of affection,love
1288,GerDracor/grabbe-kaiser-heinrich-der-sechste.xml,104123,104191,"– Kaiser, ich war unvorsichtig, Ich tändelte, und sah nicht um mich.",negative,emotional movement,emotional movement
1289,GerDracor/grabbe-kaiser-heinrich-der-sechste.xml,104192,104420,"Plötzlich Stürzt' aus der Luft ein Edelfalk Mit braunem Haupt und weißer Kehle, und Ergriff mich – Zürnen sollt ich ihm – Allein Ich konnte nicht – Das Mädchenherz ist ein Unselges Ding – Wer es recht scharf anpackt, Der hat es.",negative,emotions of rejection,"hate, disgust"
1290,GerDracor/grabbe-kaiser-heinrich-der-sechste.xml,104421,104441,Wie versteh ich das?,emotional movement,emotional movement,emotional movement
1291,GerDracor/grabbe-kaiser-heinrich-der-sechste.xml,104442,104473,führt den Prinzen Heinrich vor.,positive,emotions of joy,admiration
1292,GerDracor/grabbe-kaiser-heinrich-der-sechste.xml,104474,104509,Hier ist der Falk – der Welfensohn!,positive,emotions of joy,joy
1293,GerDracor/grabbe-kaiser-heinrich-der-sechste.xml,104510,104526,O Tod Und Hölle!,negative,emotions of fear,despair
1294,GerDracor/grabbe-kaiser-heinrich-der-sechste.xml,104527,104579,"Vetter, Ich liebt ihn, konnte wahrlich nichts davor.",positive,emotions of affection,love
1295,GerDracor/grabbe-kaiser-heinrich-der-sechste.xml,104580,104599,Nimm es nicht übel.,negative,emotions of rejection,anger
1296,GerDracor/grabbe-kaiser-heinrich-der-sechste.xml,104600,104757,"Mädchen, dank dem Himmel, Daß du 'ne Blume, zart und hold, wie ich Nicht eine kenne, bist, – wärst du 'ne Zeder, Bei Gott, sie fiele vor meines Zornes Sturm!",positive,emotions of affection,admiration
1297,GerDracor/grabbe-kaiser-heinrich-der-sechste.xml,104759,104830,"Es geht nicht, denn ich bin mit ihm vermählt, Und, Kaiser, hör ins Ohr!",positive,emotions of affection,suffering
1298,GerDracor/grabbe-kaiser-heinrich-der-sechste.xml,104831,104852,Vor diesem Reichstag?,emotional movement,emotional movement,emotional movement
1299,GerDracor/grabbe-kaiser-heinrich-der-sechste.xml,104853,104865,Warum nicht?,emotional movement,emotions of rejection,emotional movement
1300,GerDracor/grabbe-kaiser-heinrich-der-sechste.xml,104866,104942,"Bin ich denn nicht deine Muhme, Und darf ich dir nicht etwas heimlich sagen?",emotional movement,emotional movement,emotional movement
1301,GerDracor/grabbe-kaiser-heinrich-der-sechste.xml,104943,104961,Wie keck und kühn!,positive,emotions of rejection,joy
1302,GerDracor/grabbe-kaiser-heinrich-der-sechste.xml,104962,105029,"– Sie ist aus meinem Hause, Und Wang und Augen tragen seine Farben!",positive,emotions of affection,admiration
1303,GerDracor/grabbe-kaiser-heinrich-der-sechste.xml,105030,105058,heimlich zu Kaiser Heinrich.,positive,emotions of affection,love
1304,GerDracor/grabbe-kaiser-heinrich-der-sechste.xml,105059,105350,"Hör, Kaiser, – kämpf und kriege nicht um  Welf und Waiblingen wären eins, wenn sie Gleich hießen – Du mußt nach Neapel, dort Den Aufruhr wieder zu beschwichtigen – Was kann dir lieber sein, als unterdes Vor deinem großen Feind, dem Leuen, Friede Zu haben, und ich schaff ihn dir durch Liebe.",positive,emotions of affection,love
1305,GerDracor/grabbe-kaiser-heinrich-der-sechste.xml,105351,105494,"Denn ob du gleich dich eben bei der Meldung Des Boten gut verstelltest, sah ich doch, Daß in Sizilien nicht alles so steht, wie Du heucheltest.",negative,emotions of rejection,suffering
1306,GerDracor/grabbe-kaiser-heinrich-der-sechste.xml,105495,105539,"Wie schade, Mädchen, Daß du nicht Mann bist.",negative,emotions of suffering,suffering
1307,GerDracor/grabbe-kaiser-heinrich-der-sechste.xml,105540,105556,Du blickst tief.,negative,emotional movement,suffering
1308,GerDracor/grabbe-kaiser-heinrich-der-sechste.xml,105557,105598,"Das Weib Sieht tief, der Mann sieht weit.",emotional movement,emotional movement,love
1309,GerDracor/grabbe-kaiser-heinrich-der-sechste.xml,105599,105653,"Euch ist die Welt Das Herz, uns ist das Herz die Welt.",positive,emotions of affection,love
1310,GerDracor/grabbe-kaiser-heinrich-der-sechste.xml,105654,105659,laut.,emotional movement,emotional movement,emotional movement
1311,GerDracor/grabbe-kaiser-heinrich-der-sechste.xml,105660,105787,"Agnes Von Hohenstaufen – Nicht kann ich es loben, Daß du dich mit dem Welfen hast vermählt – Jedoch, wer kann der Liebe wehren?",positive,emotions of affection,love
1312,GerDracor/grabbe-kaiser-heinrich-der-sechste.xml,105788,106029,"Eher Dem Hasse und dem Tode – Sei mir denn Willkommen, Stern, bei dessen Liebesglanze Die beiden mächtigen, so lang getrennten Geschlechter wieder freudig sich vereinen – Mög ihnen stets ein solches Himmelslicht Als deine Schönheit leuchten!",positive,emotions of affection,love
1313,GerDracor/grabbe-kaiser-heinrich-der-sechste.xml,106030,106051,Zum Prinzen Heinrich.,positive,emotions of affection,admiration
1314,GerDracor/grabbe-kaiser-heinrich-der-sechste.xml,106052,106143,"Welfe, reich Die Hand mir, – wir sind Freunde – Und in  Nenn ich bald deinen Vater auch so.",positive,emotions of affection,friendship
1315,GerDracor/grabbe-kaiser-heinrich-der-sechste.xml,106144,106196,"Edler Und größer, Kaiser, konntest du nicht handeln.",positive,emotions of affection,admiration
1316,GerDracor/grabbe-kaiser-heinrich-der-sechste.xml,106197,106234,Wir alle sind verwundert und gerührt.,emotional movement,emotional movement,emotional movement
1317,GerDracor/grabbe-kaiser-heinrich-der-sechste.xml,106235,106277,Des Höchsten Segen ruh auf diesem Frieden.,positive,emotions of affection,admiration
1318,GerDracor/grabbe-kaiser-heinrich-der-sechste.xml,106278,106345,"Sehr wichtig und erfreulich ist es mir, daß ihr Dies so betrachtet.",positive,emotions of joy,joy
1319,GerDracor/grabbe-kaiser-heinrich-der-sechste.xml,106346,106447,"Und drum seid ihr würdig, Aus Kaisermunde einen kaiserlichen Vorschlag, Den ich – Gott sei mir Zeuge!",positive,emotions of affection,admiration
1320,GerDracor/grabbe-kaiser-heinrich-der-sechste.xml,106448,106678,"– nicht Um meines Hauses willen, einer Hütte, Die allem Irdschen gleich, auf Deutschlands Boden Kaum nach Jahrhunderten noch stehen wird, Den ich vielmehr um Deutschland selbst euch tue: Auf die Kaiserkrone seines Hauptes deutend.",positive,emotions of affection,admiration
1321,GerDracor/grabbe-kaiser-heinrich-der-sechste.xml,106679,106797,"Macht diese Krone  Woher seit Karl dem Großen, ewger Streit Bei jeder Kaiserwahl, stets Widerspenstigkeit Der Sachsen?",negative,emotions of rejection,emotional movement
1322,GerDracor/grabbe-kaiser-heinrich-der-sechste.xml,106798,106881,"Weshalb gilt dies mächtige, Erhabne deutsche Volk, lang das nicht, was Es wert ist?",negative,emotions of rejection,emotional movement
1323,GerDracor/grabbe-kaiser-heinrich-der-sechste.xml,106882,106977,"Warum wagen Nachbarn, die Weit schwächer sind, weit elender als wir, Uns Tag für Tag zu höhnen?",negative,emotions of rejection,anger
1324,GerDracor/grabbe-kaiser-heinrich-der-sechste.xml,106978,107055,Warum rauschen Des Reiches Banner nicht in Rußlands Schnee Und Libyens Sande?,negative,emotions of joy,suffering
1325,GerDracor/grabbe-kaiser-heinrich-der-sechste.xml,107056,107156,"Warum schwillt die Brust Dem Einzelnen wie Meereswoge, und Verliert so jämmerlich sich in der Masse?",negative,emotions of suffering,suffering
1326,GerDracor/grabbe-kaiser-heinrich-der-sechste.xml,107157,107236,"Warum zertrümmerten wir Romas Welt, Und können diese Trümmer nicht beherrschen?",negative,emotions of suffering,suffering
1327,GerDracor/grabbe-kaiser-heinrich-der-sechste.xml,107237,107325,"– Weil jeder einzelne in seinem Hochsinn glaubt, Daß er bestehen könne, ohn das Ganze –!",negative,emotions of rejection,"hate, disgust"
1328,GerDracor/grabbe-kaiser-heinrich-der-sechste.xml,107326,107477,"– Ein Faszesbündel ohne Reifen ist dies Reich – Laßt es uns binden mit dem Kaiserdiademe, Und dieses bindet fest nur, wenn es ewig Und erblich ist – –.",positive,emotions of affection,love
1329,GerDracor/grabbe-kaiser-heinrich-der-sechste.xml,107478,107536,"Bischof, Vasall, behalten Die Länder, welche sie besitzen.",positive,emotions of affection,admiration
1330,GerDracor/grabbe-kaiser-heinrich-der-sechste.xml,107537,107726,"Der Vasall vererbe sie auf seine Söhne, Den neuen Bischof wähle das Kapitel,  Der Kaiser erblich herrschendes Geschlecht, Bewache ewig schützend, alle ewig In ihrer Kraft und ihren Rechten.",positive,emotions of affection,admiration
1331,GerDracor/grabbe-kaiser-heinrich-der-sechste.xml,107727,107755,Dazu Geb ich die Stimme nie.,negative,emotions of rejection,anger
1332,GerDracor/grabbe-kaiser-heinrich-der-sechste.xml,107756,107852,"Der deutsche Fürst Ist stolzer, edler als die Kön'ge alle, Weil er wahlfähig ist zur Krone Roms!",positive,emotions of affection,admiration
1333,GerDracor/grabbe-kaiser-heinrich-der-sechste.xml,107853,107892,Den hohen Vorzug sollte er verscherzen?,positive,emotional movement,emotional movement
1334,GerDracor/grabbe-kaiser-heinrich-der-sechste.xml,107893,108166,"Wohl möglich, daß du selbst die Erblichkeit Der Krone nicht mißbrauchest – Kannst du bürgen, Daß es dein künftiges Geschlecht nicht tut, Und, wie in Frankreich, diese Erblichkeit Benutzt, die Lehn allmählich einzuziehen, Und statt Vasallen, Sklaven um den Thron Zu sammeln?",negative,emotions of rejection,Schadenfreude
1335,GerDracor/grabbe-kaiser-heinrich-der-sechste.xml,108167,108361,"Erblichkeit verschafft vielleicht In unsren Kaisern uns Eroberer, Schafft einen Hof voll Pracht, wie jener in Konstantinopel – Doch wird der Erobrer Nicht stets auch der Despot des eignen Volks?",negative,emotions of joy,admiration
1336,GerDracor/grabbe-kaiser-heinrich-der-sechste.xml,108362,108508,"Ersetzt scheinbare Pracht, (die Schlangenhaut, Worunter Schmeichler und Verräter lauern,) Der deutschen Fürsten, deutschen Städte Macht Und Treue?",negative,emotions of rejection,"hate, disgust"
1337,GerDracor/grabbe-kaiser-heinrich-der-sechste.xml,108509,108592,"– Herr, das  Was wir auf Kindes Kind vererben – Drum Braucht seine  Wer sprach das?",negative,emotions of affection,love
1338,GerDracor/grabbe-kaiser-heinrich-der-sechste.xml,108593,108622,"Hermann, Landgraf Thüringens.",emotional movement,emotional movement,emotional movement
1339,GerDracor/grabbe-kaiser-heinrich-der-sechste.xml,108623,108632,für sich.,positive,emotions of joy,emotional movement
1340,GerDracor/grabbe-kaiser-heinrich-der-sechste.xml,108633,108737,"Ich hätte als  Groß, Kaiser, riesenhaft ist dein Entwurf, Doch ist die Zeit für ihn zu klein, zu unreif.",negative,emotions of affection,admiration
1341,GerDracor/grabbe-kaiser-heinrich-der-sechste.xml,108738,108849,"Wie mancher Anspruch wäre zu bewältgen, Wie vieles Unbestimmte zu bestimmen, Eh man sich über ihn verständigte!",emotional movement,emotional movement,emotional movement
1342,GerDracor/grabbe-kaiser-heinrich-der-sechste.xml,108850,109049,"Thüringen du, und du Erzbischof – Mit Derartgen Phrasen, wie ihr braucht, wird Deutschland So lang noch eingeschläfert werden, bis Es einst sich selbst zerreißt, und seine Stücke  Gut, ich verzichte.",negative,emotions of rejection,anger
1343,GerDracor/grabbe-kaiser-heinrich-der-sechste.xml,109050,109379,"– Dafür bitt ich eins: Es steht der Kreuzzug mir bevor; – leicht könnt Ich fallen – Wenns geschähe, wenn kein Herrscher Mich dann sogleich ersetzte, würden in Dem noch so sehr bewegten Reich, Aufruhr Und Unordnung an jeder Stelle aus Der Erde brechen – Wählet meinen Sohn, Den Prinzen Friedrich von Sizilien, Zum römschen Könige.",negative,emotions of fear,fear
1344,GerDracor/grabbe-kaiser-heinrich-der-sechste.xml,109380,109410,Prinz Friedrich ist Noch Kind.,negative,emotions of joy,love
1345,GerDracor/grabbe-kaiser-heinrich-der-sechste.xml,109411,109427,Was schadet das?,negative,emotions of suffering,fear
1346,GerDracor/grabbe-kaiser-heinrich-der-sechste.xml,109428,109508,"Bei Fürsten reicht Es hin, wenn sie nur  Nicht die Person tut ihren Völkern not.",negative,emotions of suffering,compassion
1347,GerDracor/grabbe-kaiser-heinrich-der-sechste.xml,109509,109555,"Und dann, wo wären tüchtgre Vormünder Als ihr?",negative,emotions of rejection,emotional movement
1348,GerDracor/grabbe-kaiser-heinrich-der-sechste.xml,109556,109585,Laß uns den Antrag überlegen.,emotional movement,emotional movement,anger
1349,GerDracor/grabbe-kaiser-heinrich-der-sechste.xml,109586,109613,"Ich bitte, tuts – Für sich.",negative,emotions of suffering,compassion
1350,GerDracor/grabbe-kaiser-heinrich-der-sechste.xml,109614,109690,"Wenn sie erst überlegen, will Ich auch die Überlegung wohl zu lenken wissen.",negative,emotional movement,anger
1351,GerDracor/grabbe-kaiser-heinrich-der-sechste.xml,109691,109696,Laut.,emotional movement,emotional movement,emotional movement
1352,GerDracor/grabbe-kaiser-heinrich-der-sechste.xml,109697,109775,Ich mag bei dem Beraten über meine Nachfolge selbst nicht gegenwärtig bleiben.,negative,emotions of suffering,anger
1353,GerDracor/grabbe-kaiser-heinrich-der-sechste.xml,109776,109841,– Nach Braunschweig eil ich Auf Agnes und Prinz Heinrich deutend.,positive,emotional movement,love
1354,GerDracor/grabbe-kaiser-heinrich-der-sechste.xml,109842,109912,"mit den beiden, – Dorthin schickt Nachricht, was ihr habt beschlossen.",negative,emotions of rejection,anger
1355,GerDracor/grabbe-kaiser-heinrich-der-sechste.xml,109913,109960,"Heut hab ich viel von dir gelernt, mein Kaiser.",positive,emotions of affection,friendship
1356,GerDracor/grabbe-kaiser-heinrich-der-sechste.xml,109961,110093,"Leb wohl, o Richard – Wie der Klang der Kriegstrompete Hat deine bloße Stimme mir das Ohr Erschüttert – Du bist doch der erste Held.",positive,emotions of suffering,suffering
1357,GerDracor/grabbe-kaiser-heinrich-der-sechste.xml,110094,110134,Und doch hältst du gefangen mich zurück?,negative,emotions of fear,emotional movement
1358,GerDracor/grabbe-kaiser-heinrich-der-sechste.xml,110135,110298,"Nicht tadle mich, erkenne mein Geschick –  Richard wird fortgeführt, Kaiser Heinrich entfernt sich mit Agnes und dem Prinzen
              Heinrich vom Reichstage.",negative,emotions of suffering,suffering
1359,GerDracor/grabbe-kaiser-heinrich-der-sechste.xml,110299,110363,Ein Vorsaal in dem Schlosse Heinrichs des Löwen zu Braunschweig.,negative,emotional movement,emotional movement
1360,GerDracor/grabbe-kaiser-heinrich-der-sechste.xml,110364,110370,Nacht.,negative,emotions of suffering,suffering
1361,GerDracor/grabbe-kaiser-heinrich-der-sechste.xml,110371,110415,"Ein paar
            große Leuchter brennen.",positive,emotions of joy,joy
1362,GerDracor/grabbe-kaiser-heinrich-der-sechste.xml,110416,110450,Christoph und Wehrfried auf Wache.,negative,emotions of fear,emotional movement
1363,GerDracor/grabbe-kaiser-heinrich-der-sechste.xml,110451,110479,Ob der Herzog noch wach ist?,emotional movement,emotional movement,emotional movement
1364,GerDracor/grabbe-kaiser-heinrich-der-sechste.xml,110480,110486,Gewiß.,negative,emotions of fear,joy
1365,GerDracor/grabbe-kaiser-heinrich-der-sechste.xml,110487,110546,"Ich glaube, er schläft gar nicht, so kränklich er auch ist.",negative,emotions of suffering,suffering
1366,GerDracor/grabbe-kaiser-heinrich-der-sechste.xml,110547,110687,"Sicher sitzt er
              wieder über den alten Chroniken, oder sieht dort nach dem Harze, oder wandert im
              Schlosse umher.",negative,emotions of rejection,emotional movement
1367,GerDracor/grabbe-kaiser-heinrich-der-sechste.xml,110688,110707,"Horch, was war das?",emotional movement,emotional movement,emotional movement
1368,GerDracor/grabbe-kaiser-heinrich-der-sechste.xml,110708,110772,"Der Wind schlägt ein paar Türen zu, die in rostigen Angeln gehn.",negative,emotions of suffering,suffering
1369,GerDracor/grabbe-kaiser-heinrich-der-sechste.xml,110773,110792,'s ist grauserlich!,negative,emotions of rejection,"hate, disgust"
1370,GerDracor/grabbe-kaiser-heinrich-der-sechste.xml,110793,110822,Daß der Wind Türen zuschlägt?,negative,emotions of rejection,emotional movement
1371,GerDracor/grabbe-kaiser-heinrich-der-sechste.xml,110823,110933,"Spotte nicht – Der Herzog wird die Freude, wieder in Braunschweig zu sein, nicht
              lange genießen.",positive,emotions of joy,joy
1372,GerDracor/grabbe-kaiser-heinrich-der-sechste.xml,110934,111056,"Bardewicks Eroberung wird wohl seine letzte Tat bleiben, und auch da
              schon machte ihn nur der Zorn so stark.",negative,emotions of rejection,anger
1373,GerDracor/grabbe-kaiser-heinrich-der-sechste.xml,111057,111308,"– Es riecht im ganzen Schlosse nach
              Fichtenholz – Das geht auf ihn nicht, denn er würde in einem  Gestern, bei hellem lichten Mittag, geht der Adolf die große Wendeltreppe hinunter, –
              was sieht er, da er auf den Flur kommt?",emotional movement,emotional movement,emotional movement
1374,GerDracor/grabbe-kaiser-heinrich-der-sechste.xml,111309,111449,"Dich, mich, die ganze Dienerschaft in tiefster
              Trauer, mitten dazwischen einen großen Sarg, und darin der Löwe bleich und tot.",negative,emotions of suffering,suffering
1375,GerDracor/grabbe-kaiser-heinrich-der-sechste.xml,111450,111500,"Er
              will näher gehen – Weg ist alles.",negative,emotions of fear,love
1376,GerDracor/grabbe-kaiser-heinrich-der-sechste.xml,111501,111598,"Adolf ist guter Freund des Schloßkellermeisters, und trinkt wohl mal ein
              Tröpfchen.",positive,emotions of suffering,friendship
1377,GerDracor/grabbe-kaiser-heinrich-der-sechste.xml,111599,111762,"Und – Gott sei mit uns, und uns und dem Herzoge gnädig – Schon drei Schildwachen
              haben nachts um diese Zeit, gegen zwölf Uhr, die Weiße Frau gesehen.",negative,emotions of joy,joy
1378,GerDracor/grabbe-kaiser-heinrich-der-sechste.xml,111763,111962,"–  Schurken sind die Schildwachen gewesen, wenn sie die Canaille, die ihrem Herzoge
              Unheil verkünden will, sei's ein Geist, sei's ein Menschenkind, nicht angehalten
              haben.",negative,emotions of rejection,anger
1379,GerDracor/grabbe-kaiser-heinrich-der-sechste.xml,111963,112032,"Hör, mit wie lang aushallenden Tönen krähen über uns die Wetterhähne.",negative,emotions of suffering,suffering
1380,GerDracor/grabbe-kaiser-heinrich-der-sechste.xml,112033,112095,Der schlimmste Wetterhahn ist der Schnee auf des Löwen Haupte.,negative,emotions of suffering,"hate, disgust"
1381,GerDracor/grabbe-kaiser-heinrich-der-sechste.xml,112096,112219,"Da kommt jemand – Nun, sei's die Hölle selbst, ich sterbe als ehrlicher Kerl auf dem
              mir angewiesenen Posten.",negative,emotions of fear,despair
1382,GerDracor/grabbe-kaiser-heinrich-der-sechste.xml,112220,112260,"Du hast ebensoviel Mut, als Aberglauben.",negative,emotions of affection,admiration
1383,GerDracor/grabbe-kaiser-heinrich-der-sechste.xml,112261,112365,"– Doch, laß nur die Waffe ruhn, – hörst du
              denn nicht, daß es der Herzog ist, der da naht?",negative,emotions of rejection,fear
1384,GerDracor/grabbe-kaiser-heinrich-der-sechste.xml,112366,112396,– Wir müssen uns zurückziehen.,negative,emotions of suffering,suffering
1385,GerDracor/grabbe-kaiser-heinrich-der-sechste.xml,112397,112430,"Er ist
              gern allein.",negative,emotions of suffering,suffering
1386,GerDracor/grabbe-kaiser-heinrich-der-sechste.xml,112431,112476,Zieht sich mit Christoph aus dem Saal zurück.,negative,emotional movement,suffering
1387,GerDracor/grabbe-kaiser-heinrich-der-sechste.xml,112477,112550,"tritt auf, im schlichten Gewande, einen aufgebrochenen Brief in der Hand.",negative,emotions of rejection,suffering
1388,GerDracor/grabbe-kaiser-heinrich-der-sechste.xml,112551,112594,"Er
              blickt noch einmal hinein.",emotional movement,emotional movement,emotional movement
1389,GerDracor/grabbe-kaiser-heinrich-der-sechste.xml,112595,112600,Dann.,emotional movement,emotional movement,emotional movement
1390,GerDracor/grabbe-kaiser-heinrich-der-sechste.xml,112601,112671,"Wahr also, Heinrich der Welfe ist vermählt mit Agnes Der Hohenstaufin!",positive,emotions of joy,joy
1391,GerDracor/grabbe-kaiser-heinrich-der-sechste.xml,112672,112823,"– Zorn und Unmut hätten Vor Jahren mich darob ergriffen – Nun Ists anders – Mögen Ruh und Frieden Aus diesem Bündnis, keimen – Ruhig möcht Ich sterben.",negative,emotions of suffering,anger
1392,GerDracor/grabbe-kaiser-heinrich-der-sechste.xml,112824,112925,"Mich umwehn die kühlen Lüfte Des Grabes schon, und sanft und sanfter schlägt Das einst so wilde Herz.",negative,emotions of affection,suffering
1393,GerDracor/grabbe-kaiser-heinrich-der-sechste.xml,112926,113036,"– – Wie hab ich nicht gekämpft, Gesiegt, gelitten, um den großen Zwist Der Welfen und Waiblinger zu beenden –?",negative,emotions of suffering,suffering
1394,GerDracor/grabbe-kaiser-heinrich-der-sechste.xml,113037,113083,Es war umsonst – Jetzt endet ihn 'ne Hochzeit!,negative,emotions of suffering,suffering
1395,GerDracor/grabbe-kaiser-heinrich-der-sechste.xml,113084,113385,"– Wie auch der Mensch drauf losstürmt – Nie erreicht er Das Ziel, führt Gott es ihm nicht zu – – Gebirge drängen, Mit ihrer Föhrenwälder Brauen höhnisch Und finster auf ihn niederschauend, sich Um den verirrten Wanderer – Er klimmt Und klimmt – ringt über Felsen, windet durch Gebüsche sich – umsonst!",negative,emotions of rejection,suffering
1396,GerDracor/grabbe-kaiser-heinrich-der-sechste.xml,113386,113767,"– kein Ausweg – Er  Um eines Berges Ecke, und sieh da: geschmückt Und reich, wie eine offene Muschel mit Der Perle, prangt vor ihm das Tal Mit seiner Stadt, dem Endpunkt seiner Reise – Im Sonnenstrahle blinken ihre Türme, Heerstraßen reißen Ross' und Wagen, Die Ströme Schiffe brausend zu ihr hin, Den Wanderer mit ihnen – Aber wird Er auch da finden, was er dort Zu finden hoffte?",positive,emotions of joy,joy
1397,GerDracor/grabbe-kaiser-heinrich-der-sechste.xml,113768,113827,Wird der junge Bund Der Welfen und Waiblinger lange währen?,positive,emotions of affection,love
1398,GerDracor/grabbe-kaiser-heinrich-der-sechste.xml,113828,113844,– – Ich zweifle.,negative,emotions of fear,suffering
1399,GerDracor/grabbe-kaiser-heinrich-der-sechste.xml,113845,113890,"– Alles was ich je erfahren, lehrt Es anders.",negative,emotions of suffering,emotional movement
1400,GerDracor/grabbe-kaiser-heinrich-der-sechste.xml,113891,113977,"Auf der Erde Streit und Wut, Selbst unter Freunden,  – – – Wie hold ist doch das Grab!",negative,emotions of rejection,friendship
1401,GerDracor/grabbe-kaiser-heinrich-der-sechste.xml,113978,114214,"Da auszuruhn Von all den heftgen Aderschlägen, sicher In ewger Stille vor den Stürmen allen Des Lebens und des Hauptes – Nicht vertausch Ich es um meinen Herzogsthron – Man lernt Des Todes Wollust schätzen, wenn man achtzig Jahr Gelebt.",positive,emotions of joy,joy
1402,GerDracor/grabbe-kaiser-heinrich-der-sechste.xml,114215,114241,– Er tritt an das Fenster.,emotional movement,emotional movement,emotional movement
1403,GerDracor/grabbe-kaiser-heinrich-der-sechste.xml,114242,114408,"Dort liegt der Harz, hoch und gewaltig, Und Wetter leuchten über seinen Scheiteln – Ha, seid ihr es, ihr glänzenden Gestalten Der Kampfgenossen aus der Weserschlacht?",positive,emotions of joy,joy
1404,GerDracor/grabbe-kaiser-heinrich-der-sechste.xml,114409,114451,"Blitzt ihr vom Himmel, winkt mich zu euch?",positive,emotions of joy,fear
1405,GerDracor/grabbe-kaiser-heinrich-der-sechste.xml,114452,114526,"Wie flammt da Truchseß, funkelt Orla – O Freunde, Freund', ich komme bald!",positive,emotions of joy,joy
1406,GerDracor/grabbe-kaiser-heinrich-der-sechste.xml,114527,114642,"– Still ist dies Schloß, ganz Braunschweig schläft, – Die alte, treue Stadt, und weiß nicht, daß Ihr Herzog stirbt.",negative,emotions of suffering,suffering
1407,GerDracor/grabbe-kaiser-heinrich-der-sechste.xml,114643,114904,"– – In Deutschlands großen Fürstenhäusern Wohnt nicht der Lebende allein, – nein, auch Des Stammes Mutter wandelt durch sie hin, Versagt sich selbst des Paradieses Freuden, Und achtet auf der spätsten Enkel Schicksal, – So mächtig zieht es sie zu ihren Kindern!",positive,emotions of affection,love
1408,GerDracor/grabbe-kaiser-heinrich-der-sechste.xml,114905,115047,"– Der Pöbel fürchtet und belügt Mit blutgen Märchen sie – Wir Fürsten wissen  Wie die Wachen flüstern, Soll sie in diesem Hause jetzt umgehen.",negative,emotions of rejection,fear
